id,text,video_url,iteration,created_at
7731,"Integrity of thought in the way you present the fact based which is the If you don't have that in the CFO, stop looking, move on, right? That's the first and foremost thing The second most important thing is the ability to be strategically Strategic thinking The third I would say if you think about it in these storms we are a little bit disturbance of the resources of the company for the company and for the CEO we got to make sure that resource Is up to scratch That we are allocating resources where there is the biggest return possible and finally, we also have to be coaches. We have to coach our colleagues and team members and my job the way I think about it is we have to shine the spotlight on their strength. But also at the same time make sure that we understand Our weaknesses and are clear About the areas that we need to improve So a lot of the CFO job is to distill what I simply would say is tough love. It's about being tough right matters and also being encouraging in other circumstances. What's the opportunity here for HBE over the next 10 The opportunity for HBO over the next 10 years to to really find the industry. And because we firmly believe with Antonio that the future of the industry is extra cloud and I think that there will be a growing acceptance and starts already you have evidence of it That the future is hybrid and that the future of an enterprise is to become essentially a digital service provider. The pandemic has taught us that the enterprises who perform the best during that period were the ones who had digitized their business models. ",https://www.youtube.com/watch?v=dp8PhLsUcFE,1444,2022-09-11 05:28:44
7732,"Whatever we're trying to control. Hey There's multiple places where we think this technology applied Driving or commanding a man's grand vehicles or on Mondays perhaps providing menu selection and control within a control room environment maybe in a nuclear power station and all those kind of things are perhaps in a daily wick of this technology You probably notice that these big expensive cities keep getting more well You could always move away you might have just started working remotely so there's really nothing keeping you there Moving is a hassle. Well, what if someone paid you 10 grand to do it? What if they threw in free office space? A bicycle or a gym membership Programs in cities and states around the US are doing exactly that and they're getting Lot of interest. We've had over 50 1000 applications about 90 1000 applications. We had over 1800 applicants from all over North America. So are these nation programs actually beneficial to their Advertising campaigns for places looking for an injection of fresh talent. Watch Bloomberg surveillance early edition for the news you need when you need it. In New York and Anna Edwards in London. Australia Central Bank. Then surveillance ",https://www.youtube.com/watch?v=dp8PhLsUcFE,1445,2022-09-11 05:33:05
7733,"Pewter mark in Vancouver Washington where you were selling A lot of computer games. Yeah. In the 80s. Yeah. I'm thinking like stranger things. Stranger things resonates with my, yeah, definitely, growing up my inner geekdom is there. I'm gonna need some photograph What were your most played games in the 80s? So it's funny when I started growing up playing video games Most of it was going to the arcades now most people won't remember these days of like going to a store where you put quarters and play robotron was one of my favorites in the arcades I would go play that and then probably more in the 70s and the 80s I remember my dad bringing a video game the Atari 2600 with the cartridges home and Microsoft as an intern. 1988. How would you compare Microsoft's history on games under Bill Gates versus Steve Bobber versus Sachin Made Yeah I think like many things at Microsoft back in the 80s we started in video games as much out of out of kind of a defensive we were worried that other companies might be putting the whole PC in place and the avenue to get there was through video Games and game consoles. So, we say okay, we're gonna go start our own game console cuz if anybody's gonna build a computer for the home, we wanted it to be Microsoft. I think through Steve's years, it was more about growing the business and how do we bring kind of business leadership into this group of ragdack people who are out there just having fun building video games as part of Xbox. When I first took this job and I I got this job as head of Xbox ",https://www.youtube.com/watch?v=dp8PhLsUcFE,1446,2022-09-11 05:37:31
7734,"Hey so I gotta edit 10 10 o'clock. People who play with me online, they tease me about how militant I am at 10 o'clock. I'm out. I probably play 15 hours a week. As I understand that you do your own deals. You don't necessarily need permission from Sacha to do a deal. Is that true? Depends on the amount of the money and the deal but when we think about some of our bigger deals we go to the board and so Satina Dell and Amy Hood the CFO have been incredibly supportive as Xbox for one of the biggest consumer businesses in the company were a brand that makes Microsoft relevant to a whole Narration that probably doesn't think about a lot of other Microsoft products in their day-to-day life. Activision specifically is facing a lot of challenges here. There have been lawsuits. There have been employee walkouts. How much did that concern you? What you're thinking about this deal? You will put a woman on Mars. You will bring fourth global cooling. You will be the first chief crypto officer Bloomberg you won't just get news. Insight into limitless possibilities, knowledge, and inspiration to feed your ambition. So before you invent pioneer, disrupt. Before you change the world Bloomberg. Hey Important and I think we've moved from this attitude from it's an indulgence a waste of time almost an illness that needs a cure. ",https://www.youtube.com/watch?v=dp8PhLsUcFE,1447,2022-09-11 05:41:43
7735,"Might say it's unfair What? I I think your point about us having grown through that time. I might call that the adolescent years for us as we were kind of learning. I think it's an important consideration that we did learn a lot Company through that time and and what it meant and I think that sticks with us You've been a really big advocate across platform play in this idea that gamer should be allowed to play whatever games they want on whatever platform they want. Why is that so important to you? Maybe you happen in your household to buy an Xbox and I buy a PlayStation and our kids wanna play together and they can't because we bought the wrong piece of plastic to plug into our television. It just seems That these artificial constraints that the industry might put up for near-term kind of business dynamics. In the long run, if you take a business that is at three 1 billion people growing to four Over the next decade How do we continue to grow this business reducing friction for our customer's hat as an industry has to be at the top. So, how far does this go? Does this mean that active vision games that call of duty? You'll be able to play on any platform in perpetuity. Means in forever like when you think about how long and it's not for any kind of nefarious business reason it's just like what do we even platforms mean 10 years ago like I think the definition of some of these things might change over time but our expect Is we want more people to play. So, I know you're working with Sony on some things for the benefit of gamers. Can you talk to us about that a little bit? We have a pretty big publishing footprint on PlayStation as well as Nintendo which means we have good relationships with those platforms because we're ",https://www.youtube.com/watch?v=dp8PhLsUcFE,1448,2022-09-11 05:46:05
7736,"Is Bobby Kodik gonna stay on? Yeah I'm not in a position to make comments about Their leadership team were in the regulatory phase and and how that will close like when the deal closes then we have say and how their managed and how it goes but until that point Right in position to say. Very specific allegations of I'll be being aware of things That happened and not reporting it to the board. What has he communicated to you about what he knew what he didn't know? The discussions we've had were about the teams Can they Make the progress they need to make is the closing is a long process are they putting in the work that they need to put in to Move along their journey And I believe they're committed to that when I look at the work that they're doing now. There's always more that can be done. Activism has divisions that are unionizing and I know Microsoft has said they'll recognize those. Yes. Unions. What does that look like? I've never run an organization that has unions in it. So, I but what I can't say in working through this We recognize Workers needs to feel safe and heard And and compensated Fairly in order to do great work. So, we thought it was important to make a public statement on that front for workers that are there that are making decisions about their employment and how they wanna, you know, what that relationship looks like, to understand what it would mean if Microsoft was able to When I think about ",https://www.youtube.com/watch?v=dp8PhLsUcFE,1449,2022-09-11 05:50:21
7737,"Stay strong cuz I think from a value Gaming's a good value for people in a time of of kinda economic construction if people bought minecraft they can continue to go play Minecraft what about supply chain what challenges are you still seeing are all the consoles that you want to have made in time for the holidays gonna be here. I still think demand will outstrip supply for us this holiday we'll see when we get into 2023 you'll start to see more that supply is is catching up with demand and maybe actually see one in the store when you walk in what's the future of the console I mean our console's gonna be around in 10 years if even Microsoft is your Emphasizing. In my head gaming on console the gaming on a television but absolutely people are playing on more screens and I think for us as a platform if we don't adopt that as part of our strategy we're kinda pushing against what our consumer what our customers are asking for we talked a bit about kids earlier and you know as a mom I'm always slightly terrified that my kids are playing too much video games are ruining their brain Gonna be exposed to all this bad stuff. I know You're very pro game for And I wonder I wonder how do you support that? As a parent, What's best for your kid first? Like I'm not gonna say what's best for any individual's kids. What we can say in the research box this up Gaming can be a great on rap for kids into stem education as they think about well how are these games built The community power of gaming is something that Doesn't get talked about enough. Last night, I was playing escape room on Xbox with one of my friends and while the conversation might start about how we gonna escape from this room, then, we're talking about his daughter who's looking at colleges and we just talked about life like people will when they're in the same place ",https://www.youtube.com/watch?v=dp8PhLsUcFE,1450,2022-09-11 05:54:48
7738,"You keep doing deals are you still on the lookout for new studios or new geographic locations where you want to build out Microsoft Gaming presents? Definitely on the second part geographic Expansion is critically important but we've hired our first people in Nigeria now as part of our team. We have teams in India, teams in South America. You know, again, when I talk about three 1 billion gamers, I'll just use Africa for a second. Like one. 2 billion people on the average age is what 20 or 21. I think it's very, very likely that Big hit games that we're gonna see are not from the traditional locations not from the traditional people and I think that's Geographic expansion is critical. Cloud is important to that as we put our data centers in places and we can not only distribute the games but allow creators to use our cloud development platforms to build games without having to have the local hardware right there in their house or in their office to go build. I think that is important. So, we're gonna do a little rapid fire. Okay. What video games are you Now. Of the lamb most important meeting you've ever played a game in. You're trying to get me in trouble Have you ever just played a game in a meeting with Sacha? It's easier on team's calls cuz they can't see your screen. You're not I have played games. And yeah I'd say it's up to you meeting What's your favorite thing to do when you're not gam Of all things snowbird with my family. You have a lot of gaming fans. Who do you fan over? Love to go do Is find a game I've never heard of and go spend time with it and then talk to the creators about it. I think creating something ",https://www.youtube.com/watch?v=dp8PhLsUcFE,1451,2022-09-11 05:59:14
7739,Japan's critical role in the global economy is changing as the world's recalibrate. Japan's leaders are forging a more innovative and sustainable path forward to revitalize the nation Corporate Giants policy makers and pioneers tell us how they're doing just that. Every week on Japan ahead right here on Bloomberg Television. ,https://www.youtube.com/watch?v=dp8PhLsUcFE,1452,2022-09-11 06:03:19
7740,"To Bloomberg again when I was last year in 2019 you would just been reelected now you're halfway through your No term as president of Indonesia you know you are the biggest country in Southeast Asia you are right in the middle Of the United States and China and that arguments You recently said the world was in dire need of I suppose my first question for you was See Pelosi's visit to Taiwan was it wise Was it even responsible? Yeah The rivalry of the big countries is indeed worrying what we want is for this region to be stable peaceful so that we can build economic growth and I think not only indonesian Also want the same thing So you go I think Very diplomatic present. There was word that Nancy Pelosi was gonna come to Indonesia And then you decided to change that plan is is that true? No no we will openly receive but there was no visit. Now seems to be a more serious danger A Chinese invasion in Taiwan and there is a concern that if there is a conflict in Taiwan It would spill over into the South China Sea Where you have territory, territory that China contests is Indonesia ready to defend Or defend it And waters in that case. So you ready for that? ",https://www.youtube.com/watch?v=dp8PhLsUcFE,1453,2022-09-11 06:07:39
7741,"There must be communication. Even if it doesn't necessarily resolve the problem. It is better to have dialogue than to have open conflict. When we started this interview, I said that you know, you were in the middle between China and America. But Looked at Indonesia. I looked at the numbers. Investment in Indonesia Over the past 5 years is nine 1 billion dollars China has invested 40 1 billion dollars you know Grant here. We have a Chinese car factory around the corner China's China is buying up a lot of the refineries that make precious America at the moment is losing the battle For hearts and minds In Indonesia but also in Southeast Asia do you do you Susan approach that needs to be renewed because what is needed by countries in Asia including Indonesia is investment What investment? China. We welcome it. If it comes from America, we welcome it. We are not going to be choosy. One side is coming and saying I want to invest I want to trade and the other one is saying no trade packs I and and I want to come and talk about other things That is why I said previously they need to renew their approach. You've dealt with Donald Trump who famously insulted his allies and promoted America first Joe Biden was supposed to be different but rhetoric Is there any change Shorty Joe Biden is still saying America first he just isn't insulting you ",https://www.youtube.com/watch?v=dp8PhLsUcFE,1454,2022-09-11 06:12:04
7742,Hydrogen has a very special place in the universe It's the first element on the periodic table It is the most abundant element in the universe And when clean energy advocates think about what can we find which would be as easy to use as possible Think about hydrogen. That will when burn only produce water We like to imagine that if we just built enough of these and these we could ditch fossil fuels and save the planet. Unfortunately it's not that simple Combustible fuel. ,https://www.youtube.com/watch?v=dp8PhLsUcFE,1455,2022-09-11 06:16:20
7743,"Automatically will stop what we want is to build a large ecosystem to produce electric cars as many as we can here in Indonesia. Will also be in this list of materials To use inside the Indonesian Yes, that is correct. Not only nickel, box site for example is used to produce aluminum. And then be used to make cars body or car's chassis. Okay sis small You've talked about putting a tax on nickel You know the next stage up is that gonna happen this year? Export tax on nickel products. You just possible to impose it this year Around here you've had a lot of success you and I went round up a nice car factory and you have the electric vehicle The electric battery construction you've got Hyundai LG Volkswagen and Toyota Seam Keen The person Everyone talks about his Tesla And do you have a five 1 billion dollars contract To supply Nicola But you wanted to have a Tesla car factory. It now looks as if you hope together a Tesla battery facility and I wondered if you could Any news on that? Is that any closer? Some more adelaide If it is Tesla we want them to build electric cars in Indonesia from Ford as well we want them to build the electric cars here from Hyundai Electric Cars from car makers in Japan Toyota and Suzuki ",https://www.youtube.com/watch?v=dp8PhLsUcFE,1456,2022-09-11 06:20:43
7744,"Didn't solve the problems 4 months on so we stopped exporting crude palm oil and the domestic price fell. Then we resumed exports. I think it's okay. No problem. Will you remove the obligation to serve the domestic market first the famous This idea that you palm oil has to be offered to the domestic market first do you now want to get rid of that? Yeah. If going forward, the price is stable, we can remove the DMO policy. We prioritize our national interest. Souring energy prices in a short supply of key chemicals that produce in 30 fertilizers Even human waste is in demand as farmers hunt for alternatives fertilizer helps increase crop yields. You can see how much moisture is held into this. It's it's a lot of organic material into that. Compost that breaks down the man In the store breaks down into a Just soil in the ground and and for growing a whole range of different vegetables Nutrients in holds the water and it really increases the Profile the soil. The recent price bike could mean more farmers going organic for the long term. ",https://www.youtube.com/watch?v=dp8PhLsUcFE,1457,2022-09-11 06:25:03
7745,Not new ones. Indonesia has an over supply of electricity Half of the emissions from Indonesia come from land use and forest clearing And 51% of Indonesia's forest Have committed to keep to that level but you are still letting people cut down rainforest which is the really Most useful bit they're building other forests farm forests Isn't that the wrong thing you should be protecting the rainforest First and then thinking about the other kinds of forest next. John John Forest wire happened more than 20 years ago since 2016 it has been reduced by 85% we also do restoration on more than two 1 million hectares of Pete lands within the next 3 years we will also do restoration for 660 1000 hectares of man Forest in the past 5 years we also imposed a moratorium on new palm oil plantation. Does it make you cross when people from the rich world like me appear And That have already Down there forests Use their call And you have a country of 270 1 million much poorer people who have not done this yet. And we come and lecture you about this. The Adelaide Forest clearing is in the past no more today what we have now is restoration revitalizing taking care of the environment i have required all mining companies to build a nursery for reclamation of their mining areas we are ,https://www.youtube.com/watch?v=dp8PhLsUcFE,1458,2022-09-11 06:29:30
7746,I'd like to send to you I'm still looking forward Thank you very much for talking Bloomberg again. Why did the biggest names in business choose Bloomberg? That is a great question. Three question. The markets are preparing to close but the day is not over yet. 45%. Lot of volatility right now. The Bloomberg Terminal to get you market moving data before anyone else. Upgraded today to overweight. You need top analysts to bring you exclusive global insight into cross asset markets. ,https://www.youtube.com/watch?v=dp8PhLsUcFE,1459,2022-09-11 06:33:41
7747,"Management business before. So, he had a brokerage business, Johnson and Associates and he set up a little subsidiary called Franklin Funds and my father His older brother took over the the brokerage business and my father wanted to do his own thing as an entrepreneur So, he asked if he could run Franklin funds. It was two and a half one 1 million dollars in assets and a part time employee. Was the extent of it and as he reminds me, it was $10 thousand in revenue at the time. So, when you're growing up, did your family say you're gonna be the CEO someday of a money managing company that we own? No, no, there was never, there was never any pressure to go into the business. Technology around the operations. You know, kinda came up on that side of the business and you know, I think my brother after 15 years was ready to do something different. He had an Be the control person of a major league baseball team. I mean, who wouldn't wanna do that? So, it was kinda time. What team is that? The San Francisco Giants. Okay. So, that they won a world series under a leadership yet? They haven't. I was on the board when they won their three world series. So, I just will put that out there and. Okay. So, let's talk about Size of your company and what it actually does. Today, how much assets under management do you have? We bought I think one. 450 billion. ",https://www.youtube.com/watch?v=dp8PhLsUcFE,1460,2022-09-11 06:38:22
7748,"I think it's the the S and P from its S and P 500 from its sort of beginning. I think the average return is about 10 and a half percent. The last It was closer to 15% The problem is people then start to expect 15% I think you take you know too much risk for somebody trying to put money away for retirement to expect something like 15% so I think a pre tax you know 10% return over a long period of time you're gonna have time when the markets go down but you know a 10% the average is probably a reasonable return Aprophy is something like Like nine%. Private equity and things like that. They've been getting higher rates of return. You have kind of said if you can't beat them, join them. Recently, you have bought a lot of alternative businesses. Why did you do that? Yeah. So Tell people you know my my grandfather got into the mutual fund business cuz the average investor could not get a diversified stock portfolio and it was too dangerous to put you know you're an entire savings in it just a couple of of companies so the mutual fund was created to give a diversified Expert management. At a reasonable price. We have a phenomenon where companies are waiting much longer to go public and so in in 2000 the average company went public after 3 years now companies are waiting 9 to 10 years cuz there's so much money available in the private markets as a matter of fact they're half the number of public companies ",https://www.youtube.com/watch?v=dp8PhLsUcFE,1461,2022-09-11 06:42:39
7749,"Time in 2021 a couple of the big ones UBS bought robo advisor wealth front for $one. 4 billion Hawaiian spurn state paid the same amount for private credit manager Carval Certain targets. Wealth management via acquisitions. So, as we talked today, the United States economy seems to be slowing down a little bit and some people actually worry about a recession. How has that affected the money management business that you're in? What are your investment professionals telling their clients? So, We have 18 Pendant investment teams. I can tell you that our macronomists have differing views on whether they'll be a recession if there's a recession the depth of recession so I'm gonna say that it depends a bit on that but what I you know look at is we're we're looking at some statistics on market returns and in the 20 Period between 2001 and and 2020. Alright, I guess 2002 and 2021. They're 5000 Trading days. If you missed the 10 best days of the market You lost 65% of your return in that window. So, the problem is you can never time the market well and so, you know, the message is ",https://www.youtube.com/watch?v=dp8PhLsUcFE,1462,2022-09-11 06:46:49
