id,text,video_url,iteration,created_at
7898,"With a 20 1 billion dollars fortune Andrew Force is one of Australia's richest people And as the founder of mining giant for Tescue he's been a key business figure for decades But after doing the almost unthinkable committing his heavy metal producing company to net oh by 2030 he's now gained reputation as a trailblacing sustainability pioneer Now as global energy prices sore due to the war in Ukraine There's even more urgent need to make a change. Deeply unreliable They are the cause of immense immeasurable pain. And that the world has a choice now. In this episode, I speak to the billionaire nicknames Twiggy. And would drives him to be a green leader. Andrew Forest welcome on leaders with Lacom so excited to be speaking to you now your name your nickname is Twiggy how did that happen You probably can't tell now fair enough and it doesn't TV make it look that I always get told when I was when I was a kid I was so skinny Francine that Forestry You'll probably I had to run around in the shower just to get wet. I got nicknames Wiggy. I love that. Do you still use it? ",https://www.youtube.com/watch?v=dp8PhLsUcFE,1611,2022-09-11 17:36:15
7899,BHP and Rio Tinto From being a tiny cup in the first place What's the best piece of advice you've ever gotten Open to stay humble to to maintain enthusiasm But stay humble yourself. Or anyone that you admire I mean what about Elon Musk He's a great and crazy guy and and I wish him well. I mean he's he's he's entire business model for Tesla's built around batteries and Short side supporting only a business model and not what is good for the world what is good for the world is some batteries some cables some are electrication and then you've got Huge part of the world which can never exist on batteries and that's chemical processing which is done with coal all the gas and can always be done with hydrogen Plans and all these things which will rely on a mobile Of energy a pollution free chemical source energy which is of course green hydrogen and to say the world can get by with only green electrons You're just flogging a business bottle and you're not really trying to eliminate pollution from the plant. Up next and your forest on how the war in Ukraine is further highlighting the need to weed the world off outdated energy sources ,https://www.youtube.com/watch?v=dp8PhLsUcFE,1612,2022-09-11 17:40:30
7900,Terribly unjust invasion of Ukraine. Will the green energy transition continue now It's a question which is probably not well considered if you think about it a second And now the world is looking for serious alternative so you know ironic way The fact that fossil fuel is so expensive people looking for alternatives and of course that huge alternative is green electricity and green harsh and that is our very competitive So While I hate everything about that invasion Fossil fuels are deeply unreliable They are the cause of immense immeasurable pain And that the world has a choice now and that choice is green electricity Let's take that choice cuz that feel Last forever Any kind of fossil fuel The more you use it The more you need it the more expensive it becomes ,https://www.youtube.com/watch?v=dp8PhLsUcFE,1613,2022-09-11 17:44:52
7901,"Overall what's the rough price tag for hitting that goal which is huge of producing 15 1 million tons of green 100 by 2030. The investment for 15 times I think will be inaccessive 100 1 billion dollars Fully replace Energy and gas going into say Germany Investments like that in oil and gas be several times that number So I said it's very competitive it just from a captain cost but then again look at our operating cost we're not spending zidians pumping rubber shot of the ground and burning it we're getting free Risel. So our operating costs are low a capital cost competitive against fossil fuel. These are very good investments. But I mean in many ways China has dominated clean energy manufactur And it's now aiming to replicate its success in green hydrogen. How can other nations compete where, you know, who's best positioned to really move this forward? Look every nation in the world has access Green energy. You're not relying on some dictator somewhere for to You can determine your own cost of living by producing your own energy. Than others when it comes to wind and solar and the other obvious forms between energy but don't forget your thermal don't forget hydro don't forget title Access to not all of those elements ",https://www.youtube.com/watch?v=dp8PhLsUcFE,1614,2022-09-11 17:49:13
7902,"Talk to me about the infinity train. Now, you're pursuing this gravity charge electric train to shift. Iron or is this Utopia or will it really happen? Okay so that's a terrific question I've been focusing you in on transporting electrons and transporting molecules in the form of hydrogen And you've come back to another form of energy which I missed which is gravitational energy Add graduation energy is going to be huge the infinity train is is the world's largest train set I mean it's don't believe me it's in the Guinness Book of Records these are huge trains which transport 500 km away from the coast Now that 500 m four from when you go from one of your simple line or mines down the ceiling. Good so much energy into your breaking system. Now, if you can catch that energy in your breaking system Pump it in a battery Then you have more than enough energy to send that empty train back up the hill to go and collect another load Literally Never stops it has no pollution A big believer in this and we've talked about it before but actually it hasn't really captured the imagination You know scientists and the media is maybe you thought it would have why Hey other colleagues have jumped right on it they really wanna know about our technology for ammonia which is oh pollution five locomotives ",https://www.youtube.com/watch?v=dp8PhLsUcFE,1615,2022-09-11 17:53:33
7903,What were the achieved in trucks and trains we also intend to do in ships because Frank saying we said we'd go green and we're serious about it we've got less than 7 years to achieve it And how many more ships does for test you plant Running. What type of ships are they are they you know is it existing ships being converted or are they completely new build Technology which we've run a land invented on land and work just as well in a ship And then we'll we'll do new bills as well as conversions of our major ships ships just to give you some scale 330 m long they are 2000 tons of cargo Which history will judge should probably hang our heads in shame because we use a fuel called marine great fuel which is a fancy name for funky sea oil And this is the last quality oil or last quality fossil fuel you can buy. We burn it out in the ocean where you can't see it. This is what every ship owner does. And if you try to do it online you'd probably be locked up. Andrew you're Australia's richest man. Is money important to you? What's important to you? Look I get that trying to meet all the time I did say when I was going out with Nicola even before we were engaged in hope she's not embarrassed by me sharing this story with the world but ,https://www.youtube.com/watch?v=dp8PhLsUcFE,1616,2022-09-11 17:57:56
7904,"And you're one of the most fascinating entrepreneurs cuz you all started really young. What did you learn? Did you always think that you'd been entrepreneur? Probably yes. Which is a bit sad for me. Privilege and I started my business officially at 18 but I think I knew I wanted to do it very differently from about 15. But I'm sure it's If you're surrounded by it feels very natural. So so yes, it's it's it's fun. Handbags ",https://www.youtube.com/watch?v=dp8PhLsUcFE,1617,2022-09-11 18:02:15
7905,"Wealthiest man in the world. Ari Emmanuel is today one of the most important figures in the entertainment industry In the mid 1990's she started endeavor and built it into being a leading talent agency firm representing among others Martin Scorsese He's built endeavor into being one of the leading entertainment and sports conglomerates in the world. I sat down with Ari in his offices in New York to discuss the entertainment industry in his firm's future in it. So you were a talent agent for much of your professional career but now you're running a multinational multibillion dollar sports entertainment conglomerate so what's it like running a multinational sports Public as opposed to being a talent agent. For me, it really Natural right now is definitely different Bigger, it's everything I've ever dreamed of. I still do a lot of work with clients on the talent side, whether it be writer director Et cetera. But then there's the portion of my life where you're dealing with investors You're dealing with how to grow the business where you wanna go A great training ground Has been the town agency business because you have to build a business for your clients you have to make sure that they're happy and now I'm doing all that plus doing stuff for the company but also Ensure that the shareholders are happy Oh yeah. Yeah. Time is people would say. I don't really find it a pain. I don't know why and I guess John Donahoe from Nike said to me Well when the earnings are good it's an easy process and they've been For Five quarters now ",https://www.youtube.com/watch?v=dp8PhLsUcFE,1618,2022-09-11 18:06:30
7906,"Put people you know on hiatus it was a horrible time cuz I didn't I'd never gone through this and I don't think anybody's gone through But the funny thing is, you know, by the end Started working through it on the representation side Bend side. We did about seven D 75% of our economics. Even during COVID. We figured it out by the end On the on PBR at the time in UFC PBR was First work back Ahead of it Sean kind of figure that out how to do it with testing etcetera and then Dana was very quickly right behind that and Dana calls me up he said get me an island I saw what? He said, get me an island. I'm gonna put on fights and he was like, we're going. Nobody's getting no getting laid off. He's he's he's an incredible And I said, okay. You know, I didn't know what to do and then, You know, you know, cuz I've seen you and in Abu Dhabi. How do you uncalled me And he said cuz it was rumors about this and he says Why don't you come here We'll give you an island And we'll figure out economics And I called up Dana and I said here's the situation. Here's the economics. He goes we're going. And we set up in Abu Dhabi I mean it's famous now I mean it kinda I think really catapult the The sport in this horrible time. We set up fight island And the That whole engine that Dana runs and and Dana's force of nature ",https://www.youtube.com/watch?v=dp8PhLsUcFE,1619,2022-09-11 18:10:56
7907,"You are one of three very famous brothers You're holding Or infamous your oldest brother Zeke Emmanuel is a very well known bio ethicist and medical doctor on TV a lot for his views on health care Ron Emmanuel is now our ambassador Japan previously was cheapest staff to present Obama and also Mayor of Chicago And you are the youngest of the three brothers. Is that right It all works my father used to say god rest this all the picture Oh, that shit is for small. Right. So, when is it that your parents did that produce these three very talented children who are in different areas of life, but all have done quite well. Well, first of all, I would say When we're growing up One of the things I try to do with my kids and I afford children Is they let us figure stuff out. They didn't program us every hour what we were doing. You had a fen for yourself. You had a figure things out And the other thing that my parents did is education was crucial. And if you didn't perform I've been there with punishment. Meaning you'd be grounded you know and there was competition of who got the better grades between the kids and so with those two things and you know my father was a workaholic he was a pediatrician And you kind of went around with him when he went on rounds and out of my mother's side you know she was a woman Went against the grain in the suburbs of Chicago Was very prominent in civil rights which for that period of time was you know Nobody could believe that in Chicago in the suburbs ",https://www.youtube.com/watch?v=dp8PhLsUcFE,1620,2022-09-11 18:15:16
7908,"Everyday for 2 weeks. Any turn to me at the time and he was another great man. And he said on a Thursday And he said if you can be out here on Monday you're a Melro. Out there I bought a car used car for $1500 or something and I was in the mail room and everybody was younger and I was off to the races. Explain this to me very often. I've read that people work in the mail room. I think David Geffen, sorry the male room, Barry Diller, started the male room. What actually happens in a male room and one of these talent agency firms enables you to rise up. You would make copies Scripts And you drive the scripts around To clients or to studio heads And you know, you deliver paperwork everywhere. You get lunches And then you'd become an assistant and then you'd become an agent if you were good enough. And that process of, you know, learning the town and Etcetera. To be an agent, you have to have clients I assume. Yes. So, to get clients, you have to go to lunches and dinners or how do you get clients when you don't have any clients? Well, Promoted in the television department cuz I had worked They had a business affairs and then they had one of the lead agents there and also this gentleman named Bill Haber and I was in the office as their assistant everyday for seven You know Monday through Sunday Doing whatever it took and they were great teachers you know Both Haver. They promoted me and then you would go out to the studios and go to sets where people were shooting in writers were writing and I was a writer's television agent And you would read stuff that came over the transfer And you would try to sign up. ",https://www.youtube.com/watch?v=dp8PhLsUcFE,1621,2022-09-11 18:21:03
7909,"How did that happen? About 4 years before that. We went to see another kind of mentor person who's Unbelievable in helping my life professor didn't who became the chairman of Harvard Business School And we asked him to kinda let's go over yeah I've never been Like Theory of what we should do to grow and kind of consolidate the business with the thesis that distribution is gonna change the environment and we laid out over 2 days on a whiteboard that we should go after way of more and try and merge by whatever. So, you you merge a company, you become the socio, and then you start. Patrick White's will my partner who's my partner and I became the CEOs. Now, you are starting to buy companies. Yes, you bought IMG which is entertainment. This is a sports representation business, right? It's a sports production Events company. Later you bought. Well, we then bought PBR We brought Drago five To that we then bought the UFC and bought some other stuff. You bought UFC and you did it with the help of Sugar Lake a well-known privately firm and the the CEO of there help you get this done. Yeah, I mean what what happened was I was lining up people to go by. IMG. You're not had that. And he came in and he said listen let me invest in William Morris endeavor And then let's go after IMG ",https://www.youtube.com/watch?v=dp8PhLsUcFE,1622,2022-09-11 18:25:24
7910,"Character that many people thought was named after you. Did you like that? Did you not like that? And what is it like when you're more famous than your clients? Well, here's what I would say. At the time of the show, And mark Wahlberg as a client of mine and I help put that show together I didn't like it at the beginning because it depicted me there was some things that were for sure not true and then there was something that I hated seeing that were true I'm not that same person anymore Later on Especially after COVID a lot of people kept that seeing it it's it's for sure opened a lot of doors and it and at the time at the end my brother was in the White House the show was on the air I mean I got a lotta You know, people would pick up my phone call. Is there anybody today that won't return your phone calls? I simbers nobody in the world. I get a lot of people on the phone when I need to. So, with the entertainment world today, you're pretty much at the top of the totem pole, you know everybody, you have one of the best companies under you, you're the CEO of it. How many more years would you like to do this? Well, here's what I'd say to you is If I'm not happy If I'm not still intellectually stimulated If I'm not feeling like I get up every morning and I get up Bright and early every morning. Do what I do every day And and kinda do it and I'm bored of it. I will not be doing it. But today you're pretty happy and you're not bored. Today, I'm really happy. I've built everything that I wanna built that there's more things I wanna do and there's more dreams I have. You're famous to bring a fitness expert or I guess. This is this is the men's health Of this interview. Oh my god. ",https://www.youtube.com/watch?v=dp8PhLsUcFE,1623,2022-09-11 18:29:50
7911,Hey portal places where we think this technology can be applied perhaps in I don't know driving or commanding a man grand vehicles we're on naval vessels perhaps providing menu selection and controlled within a control room environment maybe in a nuclear power All those kind of things are perhaps in their daily work of this technology. Watch Bloomberg surveillance early edition for the news you need when you need it. In new york and Anna Edwards in London. Twice as much as possible. Can it sustain? Bloomberg. Be prepared be ahead of the game. Access the financial world on demand. Hear from leading economists Policy makers. And industry experts be alive and on demand webinars. Only from Bloomberg. Start exploring to see what's moving the markets. ,https://www.youtube.com/watch?v=dp8PhLsUcFE,1624,2022-09-11 18:33:57
7912,"20 plus year 10 year that I've had you know in the past it was more of a function of you know let's make sure the numbers are good let's make sure we get a great control environment let's make sure we're actually able to close the books on time let's make sure we've got all the financial elements of the business in order Making sure we are creating the right linkage. Between what the purpose of the business is, what the strategy of the business is, Delivering on the financial returns for the company all while driving long term shareholder value. We're in the business of leading beyond the numbers. It's great that we know what the numbers are. How do we use those numbers to better drive, execution of the business, to accomplishment of the strategy of the company? MasterCards core business is no surprise cards credit products currently account for over half the company's revenue the company set ambitious growth targets it is 2021 investor day committing to expand this core and to diversify beyond it. We've been on a 6 year strategy to be a multi-rail company in plain English that means whichever way you pay people enable that despite the fact that card is an hour name is essentially any type of payment we have the reach so I think we're reasonably well positioned I mean you've just gotta Not only weather consumers today but weather gonna go because a lot of what we've gotta do takes time to prevent ",https://www.youtube.com/watch?v=dp8PhLsUcFE,1625,2022-09-11 18:38:27
7913,"Sides consulting man it's services loyalty and our fraud capabilities is roughly 35% of the revenues of this company Wow. Yeah. So, it's not insignificant. So, often times people think mask record and think god. Very important but there's a very different part of Mexico as well. Flexibility to continue investing. Valuations are lower than they were a year ago. Let's go and buy something. That is that is an opportunistic approach. It doesn't work for us. For me, it What are we trying to accomplish from a strategy standpoint What are inherent capabilities we as a company have What are the gaps in our internet capabilities to meet that strategy and then follow those gaps is the best to build Or partner. We're out there and we're trying to find a right companies together. It's gonna make sure that we have a clear view on short and long-term synergies and so forth. And to investors to explain what we're doing and why we're doing it and why it's good. Shareholders have reason to appreciate MasterCard's capital allocation strategy. It's included annual share buybacks and steadily increased dividends. How do you prioritize the amount of money that you put toward innovation and toward building out different businesses versus share buybacks and dividends because master card is traditionally had robust program in rewarding shareholders. Right. First call of capital is towards growth of the business. After we have done that, it's about making sure we're being good students And returning access cash to shareholders with a buyers to a share buybacks. ",https://www.youtube.com/watch?v=dp8PhLsUcFE,1626,2022-09-11 18:42:46
7914,"Mirror took the chance even though it took him Months to land his first job at General Motors where he worked for over a decade Then it was on to the energy industry it has corporation before finding his way to Mastercard. Today, my dad couldn't be prouder of the fact that, you know, I chose the path I did. Obviously, he misses the fact that we're not there as a family, but that's just part of life, right? We've all gotta grow in Blossom and Groom. Accepted the beginning. Hey took him all of 30 minutes to get there Together with his team and the employee cafe and Mastercard's campus. It's clear that he said his element. Well, more important stuff. What's the plan for the weekend? And of course, the cafe provides a demonstration of the tap and go technology that's changed the game for payment companies. Hey just go to regular coffee at home please Yeah. Okay that would be 571. You got it. We're gonna make this work. There we go. I think contactless is a very powerful catalyst for accelerating In the last 2 years what we have seen in the US is god penetration could go through it annually has doubled What says what was the average the price 5 years the pandemic was one of the reasons people did want to touch cash there's a lot of e-commerce purchases the contact list definitely contributed to this group as well Made a difference on has been in terms of how it's driving a shift from cash to electronic payment particularly on the small ticket items Really really important. As it is about the number of transactions we can get over our network ",https://www.youtube.com/watch?v=dp8PhLsUcFE,1627,2022-09-11 18:47:03
7915,"Work and the attract the best talent and we go and this brings us back to the CFO. We go and look at our vitality index. So, how are the revenues looking? What is generated from new products? What do we see? Is there real momentum? Is there real growth? And if you overlay that and link that back to our tech hubs in these regions where we have them clearly that is what driving what is driving our new solutions. Woman investment standpoint. We try and make sure we've got our foot in the door and all of these new and emerging technologies. Cuz what we don't wanna do is play favorites with one versus the other. We Make sure we're investing just appropriate amounts of money to have skin in the game to know that if this thing has got legs to it we wanna be at the inflection point for them to write on In your tech hubs can you act like bond James Bond what are the queue movies and like the laboratories we walk in and they you know you sort of face off and clear the system and they serve to this Who can do that? I'm not one of them. No, you? No, that's not me. Coming up how mastercard has embraced the brave new world of cryptocurrency with all its ups and downs. Tells me what advice he'd offer a CFO just starting out in the job Important to stay calm. I think it's important to recognize that change is going to happen. You can't fight change. This is bloomer. ",https://www.youtube.com/watch?v=dp8PhLsUcFE,1628,2022-09-11 18:51:24
