id,text,video_url,iteration,created_at
8644,"There's a guy in the sport from the guy who just got his first fight all the way up to the Conor McGregors that is pleased with the way the UFC treats fighters. The way we've been strong armed, the way we've been coerced. Unization in some sports. Over free agency in baseball In boxing the Muhammad Aliac which restricts the kinds of contract terms that can be imposed on boxers. The fighters who brought this lawsuit CNN is the continuation of a tradition in sports of athletes fighting to have agency and power in the terms of their work. And who they do it for. Martial arts used to be pretty culturally and legally fringe in the United States. It was banned by most states John McCain had famously called it human cock fighting. There are some rules in the UFC but to a large extent all sorts of body parts and tactics and attacks are on the table and people get Stay injured at times. In multiple times. Torn off how to get that reattached. The two places about my neck broken. Ain't go broken had to get that repaired I've had torn right labrum in my shoulder he broke my eyeball I mean the bone that holds up my head my left eye orbital fracture twice where my eye caved in But I knew don't blow your nose or both eyes as well At the time that UFC was bought for just two 1 million dollars ",https://www.youtube.com/watch?v=dp8PhLsUcFE,2418,2022-09-14 00:02:08
8645,Designed to control every aspect of a fighter's career. There are long term. They last multiple fights. Fighters under these contracts Are To fight For UFC for a period of time. And UFC can extend that time if a fighter declines a match or if a fighter gets injured Who the fighter fights they control when the fighter fights and then they have a number of different classes that make it very difficult for a fighter to ever break free from UFC if that fighter ever did want to become a free agent So one sided there really is no negotiation room for any of the things especially as you're coming up and as they're strangle hold on the sporter MMA got so much stronger. Part of what's at the heart of this lawsuit is the ways that UFC Took other competitors off the board. The UFC has such a strangle hold on mixed martial arts and as they were buying up so much of the competition shutting them all down. They really became the the only option for anybody that wanted to do this professionally. If you follow You could have seen Dana White calling himself the grim reaper in bragging about how he has Defeated or derailed or acquired Or another company that tried to compete with the UFC. ,https://www.youtube.com/watch?v=dp8PhLsUcFE,2419,2022-09-14 00:06:21
8646,Those fighters are not available to any other MMA promoter. Even if they wiggle their way out of the very restrictive contract that you have seen post on them Didn't have another Mixed martial arts option because there weren't robust rivals to go sell their work to. On Tuesday afternoon a class action lawsuit was filed in US district court in San Jose against a zumba LLC with fighters kung lee quarry and john pitch attached to the soup Jason. Came to me and says hey come I know this lawyer he will help get some fairness for the fighters on you know in in the marketplace and I decided I wanted to step up for all the fighters that being affected At the end of 2014 6 years ago now Group of now all former fighters Auntie Trust class action lawsuit against UFC In broad terms the case is an any trust case where we're claiming that the UFC is both a monopoly and a monopoly Hey when we talk about monopoly we're talking about the power that a company has when it becomes the only one selling something monoposony is about the power of being a monopoly purchaser of something in particularly a monopoly purchaser of labor A key argument in this lawsuit has been about as UFC succeeds and it's revenue source how much should we expect that absent illegal conduct The fighters pay would soar as well. In UFC After year the share of the company's revenue that goes to actually ,https://www.youtube.com/watch?v=dp8PhLsUcFE,2420,2022-09-14 00:10:50
8647,"In one of the hearings in this lawsuit Attorney argued that if the fighters were really the product if all that UFC were selling were the fighters then the fighters wouldn't need you to see it all that a fighter is not The UFC product An Apple engineer who makes a cool iPhone is the product that Apple is selling. We the fighters make this whole thing happen. And it's been driven by Chuck Ladell. It's been driven by writing a guitar. It's been driven by Conor McGregor's been driven by Brock Lesnar. It's been driven by all the greats that have walked before us and that walked this path Now. The product. If the fighters are not the product, then go ahead and release us from our contracts. You'll do fine without us. Clearly. It's the identity and rank and popularity of those fighters that attract the eyeballs and make the sport what it is and if you can lock all those up, and keep them from other promotions, you can dominate the sport Which is what they've admitted they've done. William Isaacson a lawyer for UFC set in a statement that UFC has spent many years building a world class organization enhancing the brand of our athletes and championing the sport of MMA. He pays its fighters more than any other MMA promoter with average fighter compensation rising by over 600% since 2005 Our efforts have raised the global popularity of the sport and the overall revenue potential of all MMA organizations and athletes. In Of A 20 the judge announced a crucial step in this lawsuit ",https://www.youtube.com/watch?v=dp8PhLsUcFE,2421,2022-09-14 00:15:07
8648,"The area that's underwater exceeds the area that's Water. So, huge amounts of nations, areas, and regions are just really unexplored, uncharacterized. We know really know what's there. We know less about our sea bed than we do about the surface of the moon or mars. Only 20% of it has been mapped. A map of the sea floor could lead to all kinds of discoveries like new marine species and rare earth minerals like cobra that we need for electric cars and mobile phones. The value of all the gold deposits alone on the sea floor is estimated to be around 150 1 trillion dollars. I'm up could also help us when tragedy strikes Malaysia Airlines flight 370 disappeared from radar screened mapping of the ocean floor is being carried out problem is that the southern Indian Ocean is just so incredibly huge Fundamental piece of understanding of who we are, where we are, where things are, once you understand something, you start to value it more When you start to value something that's when you start to really think about making it healthy and preserving it and keeping it going. A map is the first step. It's the basic understanding that you need to figure out where you are. Oceans they cover over 70% of the planet but most of what lies underneath is a mystery ",https://www.youtube.com/watch?v=dp8PhLsUcFE,2422,2022-09-14 00:19:28
8649,King of expiration Until the early 20th century mapping technology was simple usually a weight attached to a long group known as a deadline. After the Titanic sank in 1912 explorers proposed using sound waves to find its hole in the north Atlantic this led to Sona the most common technique used for mapping today Operated by the schmidt ocean institute the falco is an 82 m long research vessel equipped with two multi beam so nar systems That have helped Deborah Smith and a team of other marine technicians to mop over a one 1 million square kilometers of the sea floor From somebody with AA rope with some knots to Acoustics that is I call it math magic but it is incredibly advanced mathematical technology to be able to measure the distance and time of travel of sound on a moving ship. Multibe mapping works by using Sonars so Sonar is taking sound and measurement of time so you have a multibeam sewnar and it sends out a ping of sound that sound travels to the water column hits the sea floor and comes back to the ship and we measure that time and we're able to calculate the distance Each individual hang of sound has many many beams so it looks like a giant fan across the sea floor and that fan is moving along the sea floor so you have many tiny little beams going across and they're travelling along a track. You can look at that data and look at both the peaks and the valleys and the highs and the lows and in sort of create Three dimensional image of the sea floor. ,https://www.youtube.com/watch?v=dp8PhLsUcFE,2423,2022-09-14 00:23:49
8650,"Autonomous vehicles could make the data gathering process faster, cheaper, and safer. A new discoveries might help with exploration of all kinds. I think the ocean cannot see We will have a different kind of access to the ocean because of virtual reality and augmented reality and to that will allow us to sit in our Alien planet. Since the dawn of man meet has been on the menu. ",https://www.youtube.com/watch?v=dp8PhLsUcFE,2424,2022-09-14 00:28:03
8651,"Production that we engage in. When we bring animals in tiny little spaces, bit accelerates the probability that more zo and object diseases are gonna impact our families. And from a morality perspective, why do we need to cause any harm to any other living thing to have dinner that taste good Does not have to be that way and those things underly the force of this idea. The meat alternatives that have made it to the market thus far have been plant based imitation beef and pork made from ingredients like pea protein and coconut oil by companies like Beyond Meat and impossible foods That's a very different proposition from cultured meat which is made from actual animal cells. I'm a huge fan of any company of any person trying to make a product that's improving the food system including all the plant-based proteins maybe in some future menu you'll have this kind of cultivated chicken and you'll also have a plant-based version that's fine Ask yourself in our lifetime is that diner likely to also remove the conventional option on the menu too This is more likely to be that the path to achieve that. So animal Celtic technology has been around for several decades Applications such as development of vaccines and other biothiltics. ",https://www.youtube.com/watch?v=dp8PhLsUcFE,2425,2022-09-14 00:32:26
8652,"Also grow various animals. There's similarities in the feed that we give cows and takes and chickens but there's also differences how we cultivate and it's very similar for us as well. So we've been working with the FDA and the USDF for the last 3 years and really developing the guidelines on how this food should be regulated when we come to the market. As soon as we get regulatory approval in the People will be able to go to their supermarket and buy it and enjoy it. They'll be able to go to a restaurant near them and order meat directly from animal cells. But it's not just getting the meat right once approved the gates open to a very high potential demand and scaling becomes the next big hurdle Raises or drop Hey, some chicken. The nutrients we feed ourselves does the same things. We need to drive that down. The cell density is another technical element. We need to continue to to increase that and hammering all those things of the person next 510, 15 years, we'll put us in a place where we're significantly below the cost of this animal protein and that will be one of the main inflection Points that will will lead to a new way of eating meat. So here is a close up Of Featon. Chicken bite. You know what? What I'm really thinking is Just I'm eating chicken. I like chicken. Nope. The normal chickens eat I don't know where they came from And so I don't know why I should be very stressed where this came from either. The meat market is worth more than one 1 trillion dollars annually and there are over 60 startups in the cultured meat field ",https://www.youtube.com/watch?v=dp8PhLsUcFE,2426,2022-09-14 00:36:54
8653,"Impossible foods might be the world's most ambitious company. Just listen to founder and CEO Pat Brown. People wonder how big the plant based meat industry is gonna be. It will be the meat industry in 20 years. We're gonna look back and basically say Wow. Remember back in the day when we used to use animals to make meat. Yes impossible stated goal really is to replace the use of animals as a food production technology globally by 2035 Mean supplying a $one. 20 billion industry not to mention a source of sustenance as old as time. To be fair, the company has got a lot of people talking about its products. So, there's this thing called the impossible burger. Let's call the artificial meat, the realest, fake burger in the world. Not that. But before impossible foods can take over the world it's going to have to overcome strong competitors penetrate tough new markets and generally transform its product from a conversation piece into a new big with a staple food With the coronavirus turning the world of food upside down this could be the moment when impossible's new fangled meat goes main street Impossible foods was founded in 2011 when Pat Brown a long time vegan was nearing the end of an accomplished career in biochemistry. I've been a scientist my whole life and just came to this organization that by far the most important scientific question in the world is what makes me delicious? Pat Brown at someone call a Zellett for his mission. ",https://www.youtube.com/watch?v=dp8PhLsUcFE,2427,2022-09-14 00:41:12
8654,It taste like yokers. No it doesn't taste like a burger. On the impossible burgers relative meetings but the debate itself was fantastic free advertising help them to propel impossible into major chains like white castle and then in the summer of 2019 into more than 7000 burger kings across the US To date the company has raised over a one 1 billion dollars and a funding round in March valued the company at around four 1 billion. But fake meat is a happening space these days and impossible faces some daunting competition so I'm now for the stock of the hour and that is beyond meat shares of the meat or plant based protein company are soaring today beyond me is also making a very meaty burger from Lance. Non GMO they stress that all the time to differentiate themselves from impossible. Animal protein. Right. But we won't do that. Had one of the biggest IPOs of the year in 2019 so impossible which is still privately held has some catching up to do. That you won't hear Pat Brown knocking his biggest competitor. But success they have the same mission we have the only rival we care about is the incumbent animal based industry Rivals or not impossible and beyond certainly agree on one thing the true prize isn't the American market it's China. ,https://www.youtube.com/watch?v=dp8PhLsUcFE,2428,2022-09-14 00:45:27
8655,No that is very very What are is a strategically important point on the map of Pakistan it sits very close to Iran actually on the very southern coast but it's about a 10 hour drive west of Karachi but it's only about an hour drive to Iran the area is extremely pork it's very aired it doesn't Of water City has been very spotty. One of the most surprising things about visiting Guadar is the high degree of security that is absolutely everywhere. There are armed guards that are required to escort foreign visitors everywhere you go because it is contested region because there have been militant attacks in the past. Despite all this guada is a key part of the China Pakistan economic corridor also known as CPEC. The crown jewel of President Xi Jinping's Belton Road initiative. We would leave no stone unturned. ,https://www.youtube.com/watch?v=dp8PhLsUcFE,2429,2022-09-14 00:49:48
8656,"Shortly afterwards China designated Pakistan as it showcase flagship project so the China Pakistan economic quarter was going to be the biggest and most important showcase for the success of the Belton Road. Pakistan is in great need of infrastructure development. They wanted to create a railway, a highway, All kinds of economic development that is intended to help Pakistan and it's meant to provide jobs two. 3 million jobs for Pakistanis it's meant to provide a two. Five% boost to GDP growth And China would gain economically as well CPEC was intended to reduce oil and gas roots from the Middle East by thousands of miles away to cut over land into western China instead of going around southeast asia by ship. Projects in Pakistan also provide Chinese state owned companies within additional market. Chinese workers are brought to Pakistan to build infrastructure and then take wages home. See pec is also strategically significant for China and Pakistan. China wants to strengthen this relationship to counter their shared rival India. An instrument of Chinese power as well as a test of Chinese power. If it's succeeds China will be demonstrating that it's able to do what great powers have not been able to do in Pakistan including the United States. Which is why guada is so important. It's in Pakistan's beloches and province and area with serious electricity and water shortages. ",https://www.youtube.com/watch?v=dp8PhLsUcFE,2430,2022-09-14 00:54:08
8657,Would be surprised if China did use it in that way. I don't think in a short term like it is set up in Juboti where it has a permanent base Think it's more likely to use it as almost like a sort of forward based resupply option something I can use when it wants to Other projects like building Pakistan's largest airport in Guada and two special economic zones have been delayed and 19 km highway linking the port with the macron coastal highway in Bolochestern is under construction too. Most of the people who live there and work there already are fishermen. They rely on access to the sea. The way that they highway express highway from the port was originally proposed would have cut off their sea access and so that was AA real Of contention with the community. There have been some proposals to allow them underpass. It's still a little bit unclear how that is. It's finally going to be resolved. Even if those projects are eventually built there are serious questions about who will work there. There is a problem with manpower of course in Guadara. It's a very small city and so one proposal has been well just shipped Chinese workers and from China and build lots of fancy housing for them. The first Chinese build community in Pakistan a 500 1 million dollars development spanning over 10 1 million square feet with over 60% open spaces Kind of proposal is what makes a lot of the Pakistan local people quite upset. Aguado based journalist express concerns to Bloomberg over projects like this the journalist spoke anonymously for fear of persecution from the Pakistan government ,https://www.youtube.com/watch?v=dp8PhLsUcFE,2431,2022-09-14 00:58:24
8658,Some degree of runaway expectations. I think there was also some degree that they were an extremely forthcoming with the state of the game. The cyber punk 2077 story is very much kind of a story of everything they can and and will go rocking games development Jack is AI flipped out he wasn't there before. Hey The release of cyber punk 2077 in December of 2020 we'll go down as one of the most disastrous game launches in history Instantly reroke the narrative of its celebrated developer city project red. Larger studios with bigger budgets weren't able to create the same quality of open world game. The inside story of the making of cyber punk depicts a process marred by unchecked ambition unrealistic timelines and a focus on marketing at the expensive development On CD project stock was at its high it was the largest stock in the Polish stock market Was supposed to be the biggest game of 2020. Supposed to be the big temple release of last year and for it to become such a disaster for so many people I think we'll have pretty far reaching consequences. City projects origins are somewhat unique in the games industry. ,https://www.youtube.com/watch?v=dp8PhLsUcFE,2432,2022-09-14 01:02:48
8659,"There's a level of just storytelling. An emphasis on on making every side quest count on top of the atmosphere that dialogue the character interactions, the different way stories can end. They nail that. Other open world games felt empty and and forest and the developers of Gave excuses as to why there couldn't be more rich story or interactions Blew them out of the water. See the project red was They were seen as a studio that was willing to make what the player wanted and to truly put in the love and effort required to make a high quality game that really connects with the people playing with it. For game of the year 2015 is The witcher three. Which are free we're going to win over 250 games of the year awards but along with being a critical success for CD Project who's also a financial success. Estimates put the sales of which are three at around 20 1 million copies in 2019. Huge step up concerning by 2014 the witcher and the witcher too had only combined to sell eight 1 million copies and with two large expansions for the which are three city project also helps separate themselves from other triple A publishers at the time. Stupid that this has to hold on i got this guys here we go ",https://www.youtube.com/watch?v=dp8PhLsUcFE,2433,2022-09-14 01:07:18
8660,"Another trailer for cyber punk until 2018 The Ethree trade show and they showed off a it was like a 2 minute trailer of cyberbunk. Look pretty rad. And then they showed behind the scenes for Ethree attendees for Press and anyone else who could get a score an appointment in there. They show this 45 minutes them up and it blew people away. Welcome to the game play demo walk through of CD project reds upcoming title cyber punk 2077 Game player about to see is from a work in progress version of the game everything you see is potentially subject to chin Paul Lee This if they can live up to what they showed me It's game over. It all looks incredibly impressive. They had enough action, enough narrative beats with just the right amount of attention. They touted how each of these NPCs, there are thousands of them, each one with their own daily routines and everything. We've greatly enhanced our crowd and community system To create the most believable city in any open world game today So, yeah. So, people were certainly blown away by this demo at 183 awards and just people left the theater just in in where they didn't know of course is that the demo was completely fake. Fake demos are common at Ethree. Studios put together bills of games to show off what they attend the game to be like rather than ",https://www.youtube.com/watch?v=dp8PhLsUcFE,2434,2022-09-14 01:11:32
8661,Reputation for crunch especially during the development which are three there management wanted them to have a reputation for treating workers well and not forcing them to go through. So March Founder and co CEO of me and said hey I wanna make AA vow right now that we're not gonna force anybody to crunch that people will not have to work mandatory overtime on this project Over the course of reporting Bloomberg has conducted interviews with more than 20 current and former CD project staff most of whom requested anonymity so it's not to risk their careers. City Project declined a comment on the process or provide interviews for the story. The company would end up delaying the game three different times first pushing from an April 2020 release to September then November and once again December 2020 As well as cancelling some features and while those measures helped developers still said they were under significant crunch. Including one former audio programmer who claimed to work up to 13 hours a day 5 days a week and stating he had seen friends with lost their families over this This was not a big secret in the office that a game was not going to be ready but A similar sort of thing happened with the Richard three and a similar sort of thing happens with a lot of games where they don't seem ready until suddenly everything just clicks some of the best games ever made like we're created through this process I don't know that it's the most efficient or the wisest way to make video games but it it's won a lot of people too I think that management there has genuinely To change it or they said they wanted to change it but it is proven very difficult ,https://www.youtube.com/watch?v=dp8PhLsUcFE,2435,2022-09-14 01:15:55
8662,"What we have been building in terms of our simple vacation and our freedom and our ability to exchange information freely have been disrupted by a country that we knew very little about. North Korea has reportedly made attempts to steal COVID-19 vaccine technology by hacking pharmaceutical giant Pfizer. The justice department has charged three North Korean hackers over a wide ranging scheme that included the attempt theft of billions of dollars for multiple Despite so many attacks blamed on North Korea that was not much known about the people behind the hacking attacks In my aim was Operations are like And on what their dreams and fierce war. Man, man, man, My name is Sam Kim I'm a reporter for Bloodberg News. In our ruler story for business week about North Korean hackers My story is about people who are sent from North Korea to countries like China to hack for the regime Enemies. And make money North Korea's cyberbibilities began In the 1970's with a lot of students going to countries like Russia, And even use Germany to learn coding it was aimed at improving the productivity of factories at home An army of people who could For North Korea's military ",https://www.youtube.com/watch?v=dp8PhLsUcFE,2436,2022-09-14 01:20:04
