id,text,video_url,iteration,created_at
7804,"We need the absolute reverse and that is green energy. Andrew, so let's talk a little bit, you know, business screen hydrogen. So, BP in 2000 have both agreed to enter into major green hydrogen projects. How actively is for test if you're indus Discussing partnerships on projects with some of these existing energy majors. Lost statement by a fossil fuel company which spends more than that investment on appetizing and promoting that tiny little investment as a form of greenwashing. Where is saying look over here what I'm doing? Don't look over there The huge part of my enterprise We wouldn't do that. We would commit our energy our focus in 10% of our profits to just seating A huge number of projects around the world. We now have 140 major projects where in the process of developing 10 of them Is now structured towards going fully green by 2030 that's seven and a half years we have to get this job done Yeah. So Andrew where do you see where do you seek funding to realize FFI's ambition Will we are putting in around a one 1 billion a year now so that's not chocolate it's certainly not a little bit of advertising for me to fossil fuel cup with that serious money ",https://www.youtube.com/watch?v=dp8PhLsUcFE,1517,2022-09-11 10:46:36
7805,"Most countries are in fact all countries have access to some not all of those elements In Australia, we have one of the windiest, hottest continents in the world. We're in a environment which like just loves to build out huge projects. We have a government now which fully understands our responsibility World leaders on the stage of green energy and green ocean We'll take our place to capture what is an infinite source of energy in Sorenguin and convert that to power to make Australia very competitive but also to make our customers straight Europe and Asia just as competitive too because the shipping cost of this energy Is actually minimal. Up next to Andrew Forrest on my good environmental intentions alone are not enough to change the world the solutions need to be financially viable. Otherwise no one will follow. And if no one follows then how ",https://www.youtube.com/watch?v=dp8PhLsUcFE,1518,2022-09-11 10:50:49
7806,"Other colleagues have jumped right on it. They really wanna know about our technology for ammonia which is oh pollution five locomotives to push all their trains around Germany with oh pollution and where they have got altitude Sea level then they also would be using Gravitational energy Now that we know how to Capture it once we know it exists Ben, let's get on and use it. Andrew, you understand China like few understand it because of your business there. What does, you know, diplomatic and trade relationships, between Australia, and China look like to you. How much is a minerals industry? Holding the two countries together. I think the two catches are held together by good relationships. I mean, One of the largest populations in Australia or Chinese. I mean, you know, Once the Restrict my humble opinion Rules in China breaking down. Transact very good business with a Chinese partners and I have to say that just before coming on the show and I helped launch a massive Industrial park In in a Mongolia where they're hoping out of this park to eliminate 100 1 million tons of carbon dioxide Let's not underestimate China, China, can really drive the green energy revolution. ",https://www.youtube.com/watch?v=dp8PhLsUcFE,1519,2022-09-11 10:55:18
7807,"Even before we were engaged in But we we Proper selves upon our elbow just having a chat on Saturday morning And she looked at me in the eyes and said look What do you wanna achieve in your life And I wasn't worth much back then my assure you I could Put food on the table with a bit of push I wanna give most of it away. And and You know I think I think that that's still my primary driver. I'd like To do good in the world. Once you've worked out how to feed the kids, how to pay off the mortgage, And yes along the way It must be profitable Francine otherwise no one will follow And if no one follows then how Global warming is gonna take us all by throat. Sustainable which is a fancy word for being profitable Stop wording the world then they'll follow and that's what we all must do. Lizard island which you purchase for 42 1 million dollars. What song lizard island? Why? It's a beautiful research station on this island which I must say is ",https://www.youtube.com/watch?v=dp8PhLsUcFE,1520,2022-09-11 10:59:30
7808,"Now throw in rising energy prices and processing transporting even refrigerating food is more expensive plus fertilizer production is extremely energy intensive less fertilizer means lower crop field and prices rise even more. Revealed how complicated and fragile global trade systems are. Global agriculture, perhaps even more so. Unlike metals for example, food goes bad. Unpredictability like the weather. Food prices will be felt everywhere but the poorest countries in the world that we hit the hardest. All these factors compound the real fear is that record high will lead to record high and ultimately to a global food crisis with vast consequence. Big, expensive cities have a lot going for them but if you live in one, you probably notice that these big, expensive cities keep getting more well expensive. So there's really nothing keeping you there But then again moving is a hassle Well, what if someone paid you 10 grand to do it? What if they threw in free office space? A bicycle or a gym membership Programs and cities and states around the US are doing exactly that and they're getting Of interest. We've had over 50 1000 applications about 90 1000 applications. We had over 1800 applicants from all over North America So are these nation programs actually beneficial to their communities and the workers joining them? Or are they little more than flashy advertising campaign Places looking for an injection of fresh talent. ",https://www.youtube.com/watch?v=dp8PhLsUcFE,1521,2022-09-11 11:03:56
7809,"Father His older brother took over the the brokerage business and my father wanted to do his own thing as an entrepreneur and so he asked if he could run Franklin funds. It was two and a half one 1 million dollars in assets and a part-time employee. Was the extent of it and as he reminds me, it was $10 thousand in revenue at the time. So, when you're growing up, did your family say Money managing company that we own. No, no, there was never, there was never any pressure to go into the business. Aspired to be in the business there was only one time where I considered a different career and and I didn't never I wasn't focused on being a CEO I'd loved what I did I ran technology I ran the operations I you know kinda came up on that side of the business and you know I think my brother after 15 years was ready to do something different he had an Be the control person of a major league baseball team. I mean, who wouldn't wanna do that? So, it's kinda time. My team is that. The San Francisco Giants. Okay. So, they won a world series under his leadership yet. They haven't. I was on the board when they won their three world series. So, I just will put that out there. Okay. So, let's talk about the Of your company and what it actually does. Today, how much assets on your management do you have? We bought i think one. 450 billion. Right And most of what you have done over the years is offer mutual funds, is that right? Correct. Now, in the last 10, 2030 years, or so, a new phenomenon clock, index funds, or ETF funds have come along and they say more or less, don't worry about smart money managers picking good stocks. We're just gonna The index and you don't need to worry about paying higher fees of mutual funds charge. How does that affected your business? So and let me Did that answer? So, one is ETF's I look at as a vehicle ",https://www.youtube.com/watch?v=dp8PhLsUcFE,1522,2022-09-11 11:08:33
7810,"The last Decade of this kind of very momentum market it was closer to 15% The problem is people then start to expect 15% and I think you take you know too much risk for somebody trying to put money away for retirement it takes expensively like 15% so I think a pre tax you know 10% return over a long period of time you're gonna have time when the markets go down but you know a 10% the average is probably a reasonable return An appropriate something like Private equity and things like that. They've been getting higher rates of return. You have kind of said if you can't beat them, join them. Recently, you have bought a lot of alternative businesses. Why did you do that? Yeah. So Tell people you know my my grandfather got into the mutual fund business cuz the average investor could not get a diversified stock portfolio and it was too dangerous to put you know your entire savings in it just a couple of of companies so the mutual fund was created to give a diversified Management. At a reasonable price. We have a phenomenon where companies are waiting much longer to go public and so in in 2000 the average company went public after 3 years now companies are waiting 9 to 10 years cuz there's so much money available in the private markets as a matter of fact there are half the number of public companies There were in 2000 ",https://www.youtube.com/watch?v=dp8PhLsUcFE,1523,2022-09-11 11:12:46
7811,"Credit manager Carval One 1 million dollars upfront and it could pay another 350 1 million dollars to give out central hit certain targets. She knows though that the momentum slowed in the second quarter. Expect for the rest of the year. Acquisitions. So as we talked today the United States economy seems to be slowing down a little bit and some people actually worry about a recession how has that affected the money management business that you're in what are your investment professionals telling their clients so We have 18 Investment teams. I'm gonna say that it depends a bit on that but what I you know look at is we're looking at some statistics on market returns and in 20 year period between 2001 and and 2020 alright I guess 2002 and They're 5000 Vibe trading days. If you missed the 10 best days of the market You lost 65% of your return in that window. So, the problem is you can never time the market well and so, you know, the message is Diversified in it ",https://www.youtube.com/watch?v=dp8PhLsUcFE,1524,2022-09-11 11:16:56
7812,"Create much greater efficiency but disruption on on business models and I'll give you a couple examples that today you go on google and they capture 100% of your value on your search via their ads. There's a company that has been set up and when you use their search engine, they're actually paying you in cryptocurrency Portion of your economic value that you're bringing to the table. Another company that wants to be the fastest streaming service out there. So, when you're watching the the contents as I'm watching it on my say phone, I'm agreeing to let them cash their content on my phone. So, now that you wanna watch something, it only has to jump from my device to your device and they're paying me in their currencies to to lever My device is infrastructure. So now, I'm not just a client. I'm capturing the economic value as they grow as a firm and by the way, I've become part of the infrastructure. They don't have to buy as many computers and it because they're leveraging their clients infrastructure. So, the the technology enables that kind of disruption and You know you have new revenue streams like I think the NBA race 500 1 million in selling off NFT video clips so that's in a new stream I can imagine we we talked about my brother and his role in the San Francisco Giants you could imagine sports teams What have you sold one% of the San Francisco Giants 200 1000 people and oh by the way it you know they get bragging rights that they own it they own it with their token maybe the the they get special access to the coach who's gonna do a post video after the game where there's it becomes a loyalty program what do you do about Are you very conscious of investing companies have good ESG performance? Yeah, well, again, we're we're asset managers. So, we we do what our clients ask us to do. But we ",https://www.youtube.com/watch?v=dp8PhLsUcFE,1525,2022-09-11 11:21:39
7813,"1973 my Franklin bought a company out in California and so I moved out to California the family and so you grew up in a pretty large family Lot of seven children in 10 years yeah a lot of chaos Dinner table. They talk about money management all the time. Yo I mean as a matter of fact my mother after having seven kids went on and and graduated from Stamford Medical School and I would say there were way more conversations around the sciences then there were around financial services and asset management. So when you were growing up did you say you wanted to do the same or what did you say you wanted to do when you were growing up? I Maybe I would become a coach cuz I love sports. I was a double major in economics and physical education. I thought that would be a fun thing to do and then I decided that I could probably volunteer as a coach. Where did you go to college? I went to University of Davis. Okay, and so after college, what did you do? I To my father said if you're gonna be in the financial services business you should probably live in New York and so I got a job at Drexel Burnham and I worked in kind of like a training program at Trucks and Barley. And at that time did you think a woman could ever be this CEO of your family's business? You know I grew up in a household where View that women could do as much as men as a matter of fact my father was the first one to hire we're the first female general council in the asset management business you know he was obviously very supportive of my mother going back and and going back to school and graduating as a doctor at one point we had three times ",https://www.youtube.com/watch?v=dp8PhLsUcFE,1526,2022-09-11 11:25:53
7814,"You know, you gotta cocktail parties from time to time. You're running Franklin Templeton. I assume people come up there and say, Jenny, can you give me some investment tips? What should I do with my money? Does that happen a lot? Well, I've been Say is the best thing to do is actually to ask an expert you know financial adviser who knows exactly what your needs are because you know the beauty is people can customize for their personal needs I don't know what a person's situation is and frankly I just managed 1300 investment people that that's not my expert Walk of this job what's the pleasure of it what's the greatest pleasure of running Franklin Tamilton I think it's this knowing that we're helping people achieve the most important goals in their lives what's the greatest challenge of running a company like this I think you know look it's it's it's hard my cat has to say he says you know you either are a tough boss or you One. Sometimes you have tough decisions. You you have to you know terminate people or move them into a different role and you know sometimes AA job scroll beyond somebody's capabilities. Sometimes you have to to make a decision where you're outsourcing and those are tough. People decisions are the tough part of job Let me ask you isn't it really difficult that when your father is around and your brother is around both of them or she goes you've got two family members who are CO's and they must know your business pretty well isn't that the toughest part of your business your job hey guys I think that's the greatest benefit you know when we're making an I think eight acquisitions in the last you know ",https://www.youtube.com/watch?v=dp8PhLsUcFE,1527,2022-09-11 11:30:00
7815,Profit or revenue you can't really manage the outputs you have to manage at the input level and that's where we spend all our time and so if you do the right things for the business long term things tend to work out I think we've had very good returns for investors and I expect that to be true again. Bloomberg has enhanced search on the terminal to deliver what you need when you need it now you can simply type phrases in everyday English in the command line Compare financials Find people analyze markets You can enter phrases. Or ask questions. What do you want to know today? Ask a question or visit search go to find answers now. Idea that It. Central Bank. Can it sustain it's normal at a time when everybody else is facing a very different reality Be prepared be ahead of the game. Performances see new concerts that go behind the scenes plus a claimed art carnival concerts visit PSO. Org slash now with a music plays on BSO season sponsor Bank of America ,https://www.youtube.com/watch?v=dp8PhLsUcFE,1528,2022-09-11 11:34:13
7816,"Defensive. We were worried that other companies might be putting the home PC in place and the avenue to get there was through video games and game consoles. So, we said okay, we're gonna go start our own game console cuz if anybody's gonna build a computer for the home, we wanted it to be Micro I think through Steve's years was more about growing the business and how do we bring kind of business leadership into this group of ragdec people who are out there just having fun building video games as part of Xbox I think Wasatia when I first took this job and I I got this job is head of Xbox About 2 months after Satiab Nadella became the CEO of Microsoft. Well, and when Sacha started, there were activist investors targeting the company. Yes. The stock hadn't been doing well. They were targeting Xbox. Absolutely, yeah. Absolutely right, that there was a question. Why are we in video games? In fact, one of his first questions to me was, cuz he had come from the cloud part of the business being in the cloud. He didn't actually understand why we're in video games. Not as a negative, just as literally the wires, wise Microsoft this at the time what one 1 trillion dollars market cap company. Why are we in the video game business? Any any challenged us? Like, let's go figure out why we're in the video game space. And see if it makes sense. And if it Let's be all in and if it doesn't, we'd make other decisions. Early in that journey is when this game which I know you know about is Minecraft and the opportunity to acquire Minecraft came about like months after this moment. So, I might have a kid or two that move Minecraft, yes. And it really caused us as a team to think about, okay How does this fit into the mission of this company? Let's talk about that strategy. Was the idea to tie gaming to the cloud? Was that the clincher? Night or roadblocks. ",https://www.youtube.com/watch?v=dp8PhLsUcFE,1529,2022-09-11 11:38:46
7817,"Policy makers. And industry experts via live and on demand webinars. Only from Bloomberg. Start exploring to see what's moving the markets. Visit Bloomberg. Com webinars Hey Facebook crucially important and I think we've moved from this attitude from it's an indulgence a waste of time almost an illness that needs a cure. For something as universally important to human life Sleep mystery surrounding its necessity and utility have only just been recently uncovered Some of our biggest discoveries were in the 1970's or 1980's and so it makes it a really exciting feel because it seems as though we're uncovering new insights each and every day. Some scientists are going further to find out how sleep and what happened there can be harnessed to further expand our understanding It's easy to memorize that makes you smart. It can Act a lot of facts. But if you wanna be wise, if you really want wisdom, you gotta know when and how and why to use that information. And that's what you bring figures out while you're sleeping. What year in the process of of a potentially monster deal 70 1 billion dollars acquisition of activision. Talk to us about how this deal came together. When we were thinking about on that idea of what are we capable of doing today and where do we need to go the biggest gaming platform on the planet is mobile phones ",https://www.youtube.com/watch?v=dp8PhLsUcFE,1530,2022-09-11 11:42:54
7818,"Like when you think about how long and it's not for any kind of nefarious business reason it's just like what do we even platforms mean 10 years ago like I think the definition of some of these things might change Overtime but our expectation is we want more people to play. So, I know you're working with Sony on some things for the benefit of gamers. Can you talk to us about that a little bit? We have a pretty big publishing footprint on PlayStation as well as Nintendo which means we have good relationships with those Platforms because we're they're a big part of our business and we're a big part of their business. I think our long-term ambition of where we see this industry growing is also shared. I think the area where things get stuck a little bit. It's in the kind of near midterm Somebody walks into a store and they have one $500 bill. There's either gonna walk out with a switch which is what most Or they're gonna walk out of the PlayStation five or they're gonna walk out with an Or maybe somebody will go buy a gaming a windows PC. But in that world of somebody's gotta make a decision for one platform over another in the beginning. That is where I think we we get stuck in some of the kind of near term competition. I don't think that's bad. Right? It's just the dynamic of each of us pushing each other. To build the best product for our customers. Gaming industry has historically been tough for women for diverse voices when you look back on gamer gate Do you think you did enough? I can always look back in any incident for me and think about things that in hindsight I should have done more. I should have done better. I'm proud of how our team evolves, how our leadership team evolves, their societal issues around us, the gaming industry is not kind of immune to those. People in my position sitting there as ",https://www.youtube.com/watch?v=dp8PhLsUcFE,1531,2022-09-11 11:47:18
7819,"But i can't say in working through this is we Workers needs to feel safe and heard And and compensated Fairly in order to do great work. So, we thought it was important to make a public statement on that front for workers that are there that are making decisions about their employment and how they wanna, you know, what that relationship looks like to understand what it would mean if Microsoft was able to When I think about The environment on any of our teams. I build from perspective of people of building a workplace where people feel like they can do their best work and it's sustainable way and they could see this as a long-term career for themselves. So, if Xbox employees decided to unionize with We knew we made the public statement that it was it wasn't that it would have a broader impact than just the impact at what would potentially happen on the clothes of activation blizzard. For 30 years. You will put a woman on Mars. You will bring forth global cooling. You will be the first chief crypto officer. You won't just get news. Possibilities, knowledge, and inspiration to feed your ambition. So before you invent pioneer, disrupt. Before you change the world Bloomberg. ",https://www.youtube.com/watch?v=dp8PhLsUcFE,1532,2022-09-11 11:51:38
7820,"You know what's best for your kid first. Like I'm not gonna say what's best for any individual's kids. What we can say in the research box this up that gaming can be a great on ramp for kids into stem education as they think about well how are these games built? I also think the community power of gaming is something that Doesn't get talked about enough. Last night, I was playing escape room on Xbox with one of my friends and while the conversation might start about how are we gonna escape from this room? Then, we're talking about his daughter who's looking at colleges and we just talk about life like people will when they're in the same place and that ability Gaming whether it's with kids or adults to bring people from different backgrounds, different geographies, different social economic, different religion, different genders And shared experiences Pretty unique out there and I think building those connections that video games can enable Maybe this is too alteristic but there aren't enough of those things in the world today. Which brings me to the metaverse. You know, obviously, Sacha came on my show. Facebook change its name to Meta Don't even want this whole metaverse thing. A world of warcraft game you're playing in Block. You're playing in a racing game where everybody's in a shared world. These 3d shared worlds that gamers have been playing in for years and years. I think what we found is there's more connection as I was talking about before cuz we have shared purpose. It's not at all ",https://www.youtube.com/watch?v=dp8PhLsUcFE,1533,2022-09-11 11:55:58
