id,text,video_url,iteration,created_at
7656,"Frozen Serves of Russian bank reserves and if you don't think that every single Maybe not every single but it's substantial number Nance Ministers around the world have to rethink Where are there as a secure I've had many people ask me What do I do if my assets in China What do I do with my answers in Hong Kong? There's a lot of there's a lot of western investment in Hong Kong residual. Happens if we end up in a similar disagreement or conflict are those assets subject to immediate abandonment. These are questions everybody's gonna ask whether they talk about them a lot or not. They're gonna be asked I'm not saying we'll go to 100% investment in your own country but boy the risk premium has significantly gone up. I mean, is this just a giant little sustaination of assets around the world? As you see it, given that now, governments are getting involved in a much more Way in terms of the resources that they own oversee and trade. Companies. We've had to abandon assets immediately because of a political because of a conflict. So now you have to anticipate where in the world might we not like the activities of a future regime. And you could come up with a long list of where you might be uncomfortable and you have to truly change your your wrist profile there so we're in the middle of seeing a very effective use. The weaponization of resources. Now, not everybody can weaponize the resources because they don't have ",https://www.youtube.com/watch?v=dp8PhLsUcFE,1369,2022-09-11 00:00:30
7657,Certainty that we haven't had to deal with. Television and radio. When you think of cutting edge technology at sea you might be thinking of stuff like this. But there's an incoming revolution on the high seas that isn't quite as sexy but could be significantly more impactful. Katrina shipping is the key component of global trade about 80 or 90% of all the world's goods are transported see at some point but there's a significant unseen cost to the modern era of global commerce about three% of all the world is huge two missions Three% mean that sound like a lot But that's roughly comparable to the entire COtwo output of Germany. Since reducing trade isn't a likely option. What about a technological improvement to help reduce the emissions from these well stocked maritime behemoths? Indonesia's economy is rising fast with massive factories like these ones dominating the outskirts of Jakarta. I last met President Joco Wido or Jakoi as he's more often known in his hometown of solo but that was almost 3 years ago and a lot has changed. Yeah. Jakarta's presidential palace by convoy for a huge Hyundai factory built during COVID on three quarters of a one 1 million square meters of land ,https://www.youtube.com/watch?v=dp8PhLsUcFE,1370,2022-09-11 00:04:47
7658,"Taiwan and there is a concern that if there is a conflict in Taiwan It would spill over into the South China Sea Where you have territory, territory that China contests is Indonesia ready to defend All defendants And waters in that case. So you ready for that? Conflict militarily if it happens Yeah We do want the region to be peaceful it shouldn't come to the point the tensions rise until it affects economic growth and then later on affects the well being of our people In my opinion, it is very important that there is a space for dialogue between leaders, especially leaders of big countries. The global situation is extremely difficult and there shouldn't be further unnecessary issues we are going through a food crisis and an energy crisis that hasn't been resolved the pandemic still exists since some countries Is that going to be a big theme for you at the G 20 Want to turn the debate away from these Between superpowers And focus on issues like food security Inflation. Yellow people Yes it is better than having open conflict it is better to have a forum for dialogue like G 20 If there are space for discussion we can discuss and have debates and hopefully come up with solutions this is what we want this is why we have a space for dialogue I know that you have invited President Xi Jinping to come to the G 20 ",https://www.youtube.com/watch?v=dp8PhLsUcFE,1371,2022-09-11 00:09:12
7659,I want to come and talk about other things. They need to renew their approach. You've dealt with Donald Trump who famously insulted his allies and promoted America first Joe Biden was supposed to be different but rhetoric aside There any change Shorty Joe Biden is still saying America first he just isn't insulting you at Time. Indonesia wants to be friends with everyone with any country we don't have problems with any country each country will have their own approach each leader has their own style and approach so there shouldn't be a problem but now what's needed by Indonesia is investment technology that will change our I just To ask you about Azian since you mention You have a group of countries But it is one where you look at the It includes Myanmar At which seems to have all these problems with human rights and so on Why do you keep me on my in Asian? The implementation hasn't taken place and the approach we have taken Hasn't worked that's the complication we're facing there are several ozzie on meetings after that which we did not include me and my participation You've been to go and see Vladimir Putin. ,https://www.youtube.com/watch?v=dp8PhLsUcFE,1372,2022-09-11 00:13:27
7660,"We have the technology. We have the lasers. We have the climbers. We have all of it. Private entity wants to build it. Or a government They can build it. It'll change society. We have no clue how colonizing in the space. How really spreading on this face. Really change our society over the next 50 toe. 200 years. It'll be completely different. Indonesia is an extremely resource rich country and the economies potential is enormous. It has a third of the world's nickel reserves used in the lithium batteries of electric vehicles. It's the world's biggest grower of palm oil, And largest minor of tin the third biggest producer of coal and ranks fifth for box site It's grassberg mine has won the largest reserves of gold and copper. Resource nationalism is nothing new but Indonesia's two-term president is doubling down. After banning the export of raw nickel he's now planning the same path for all the others. Jakoi is moving downstream creating higher value products who will be used in everything from aircraft to semiconductors to touchscreens and the batteries in electric vehicles Did that again? ",https://www.youtube.com/watch?v=dp8PhLsUcFE,1373,2022-09-11 00:17:50
7661,"If you could Give us any news on that. Is that any closer? Some more adele, more police strict. If it is Tesla, we want them to build electric cars in Indonesia. From Ford as well. We want them to build the electric cars here. From Hyundai Electric Cars, from car makers in Japan, Toyota, and Suzuki. We want a huge ecosystem of electric cars for the world. We don't just want to reach batteries only because this is just half of it. Elon Musk is a famously reasonable man Why is he said no to the car factory then It's still in discussion let's see later the final result. You have you have negotiated with Gijin Ping and Vladimir Putin Either of them as difficult to deal with as Elon Musk. Yeah, some Everything needs time. I don't want to go quick with no result. It needs an intense communication and the result will show. I said yeah Do you think there has been an element though again looking around here that it has been tends to be the Asian countries which have First into Trying to trying to build electric Battery facilities here Ecosystem ",https://www.youtube.com/watch?v=dp8PhLsUcFE,1374,2022-09-11 00:22:08
7662,"Admissions to Mars we are going to have to learn to live and work off world in a different way The place where we are going to learn to do that is on the moon. Can Isa help humanity take its next giant leap You will put a woman on Mars. You will bring forth global cooling. You will be the first chief crypto officer. Because when you subscribe to Bloom Birth you won't just get news. Insight into limitless possibilities, knowledge, and inspiration to feed your ambition. So before you invent pioneer, disrupt, before you change the world, Bloomberg. Innovation, money, and power collide in Silicon Valley and beyond. Weekdays at 5 PM in New York and 2 PM in San Francisco Consistent thing you you've been talking about is green industries and the environment To make Indonesia carbon neutral by 2060. As you know most of your energy now ",https://www.youtube.com/watch?v=dp8PhLsUcFE,1375,2022-09-11 00:26:26
7663,Much poorer people who have not done this yet And we come in lecture you about this. The Adelaide Forest clearing is in the past no more today what we have now is restoration revitalizing taking care of the environment i have required all mining companies to build a nursery for reclamation of their mining areas we are working to improve the environment I can take you to the nearest nursery center in begore that produce about two 1 million seedlings a year and we will have 30 of those nurseries then you will believe that we are serious This capitol You are building. Four 1 billion dollars. The aim is to finish it by 2045. This would be the new capital of Jakarta in Bourneo I wondered will you finish the first stage? In August 2024 are you on time in terms of that? But I've been daniel Responsibility to put the policy in place but we still check the feasibility studies. It will need funding of 33 1 billion dollars and we will use state budget to cover for 20% while the rest 80% from private sector from investment. And this isn't just for 2 years. It's for 20 years. Confident with a good concept and with good returns for the investments I am sure many investors will come in. You know that many people in Indonesia look at problems look at Building new Santara that will happen After you are ,https://www.youtube.com/watch?v=dp8PhLsUcFE,1376,2022-09-11 00:30:58
7664,"Talking about that all day yesterday. The global appetite for data is growing faster than ever and no matter what statistics you use to describe it big data is big business 50 1 billion devices would be connected by 2025 and more than 175 zebras of it will be created Month. Now we're talking about zettabites. It's a near And companies just don't know how to make image and secure all this new information. There's also a growth in a nature and location of data as well, you know, expanding beyond structure dated unstructured data. We're looking at 500 plus one 1 billion in revenue. ",https://www.youtube.com/watch?v=dp8PhLsUcFE,1377,2022-09-11 00:35:14
7665,"Your heart functioning. We have to be there providing the information that allows us to continue to create value for our shareholders and making sure that our customers get what they want. In 2015 the human packer corporation split into two separate H P Inc primarily makes devices from desktop and laptop computers to printers, tablets, and Enterprise or HPE provides information technology solutions in 2019 CEO Antonio Mary announced that the company would pivot from a focus on servers and on site Systems to it's cloud software as a service platform Greenlake HPE calls it a hybrid cloud platform not just storing data in the cloud but managing it across 10 1000 locations. When I became oh in 2018 I said that the enterprise of the future will be edge centric meaning where we live where we work. Enable in data driven. And one of the things that we saw through the pandemic is that the enterprise became way more distributed. People working everywhere. And at the same time, data became the most important. I said the custom half. Explain for a second the difference between the edge there. Why that is sort of more useful and the idea of a more centralized sort of cloud system that I thought a lot of companies at least at one point were embracing. ",https://www.youtube.com/watch?v=dp8PhLsUcFE,1378,2022-09-11 00:39:29
7666,Energy infrastructure and secure specific business outcome under certain performance Air conditions. We managing construction on your behalf. We grow and expand an infrastructure as your need to grow and expand in turn. And so the degree of customer intimacy is a quantum leap above the transactional world. With a different business model comes a different metric for measuring Annualize run rate or ARR has become the focus for Tarek Robiati and his finance team. The ARR is actually measuring the amount of our revenue that is locked in and recurring with our customer base and to the extent that there are ARR is going fast. The more robust the future of the company is then on Green Lake we have to grow customers we have to grow the revenue we make from those customers and the ARR is the annualized run rate of revenue that you have from one period to the next if your offer has a perennial future It translates into a going AR This is the way for us to truly understand that we remain relevant for our customers over the long term What about margins when you hear from some of these analysts these investors here they're still dialed in on gross margin some of the more traditional metrics Cross margin for me is the most important metric in our sector It's fundamentally if you think about our our business which comes from a hardware heritage moving into as a service And with hard commoditizing ,https://www.youtube.com/watch?v=dp8PhLsUcFE,1379,2022-09-11 00:43:52
7667,"Recently trained as a scientist earning a master's degree in nuclear physics and electronics. He told romaine bostic how those studies set him on his professional path. It did prepare me in terms of my analytical capabilities but there was a moment in my career where I felt he was reading point that I hold my financial skills and then eventually Majoring in finance and such easier care analysis and entrepreneurship. I discovered finances and discipline. I loved it and ever since then, I've became a finest person. Highlights from Lehman Brothers in London and later experiences CEO first with the telecommunications firm CSL in Hong Kong and then Australian financial services company flexi group He came to the US to serve a CFO at Sprint leading the company's turn around efforts That was very lucky I had the opportunity to work in Europe New Zealand, Asia In the United States so I'm truly a global citizens people ask me where he's home my answer that question is home is where I'm not. For HPE is now just outside Houston Texas where the company opened its new global headquarters this spring for CEO Antonio Nerry the campus is a passion I love the design I love art and I felt this was a unique opportunity for me to start with a blank sheet of paper. This was a piece of land, nothing. There was nothing here. And it's a remarkable in in 2 years where able to build this 500 1000 square feet side. With a unique experience, digitally In everything we do. ",https://www.youtube.com/watch?v=dp8PhLsUcFE,1380,2022-09-11 00:48:14
7668,"HPE CFO was taking steps to relieve the company's supply chain pain. We have to rethink our network of our suppliers And he outlines the mindset that makes the chief future officer If you start with a view that the world is in constant change and you have to adopt, you have to anticipate on what comes next. The strategic thinking is very key for that purpose. This is Bloomberg We make it very transparent to the shopper before they accept an order. What's your order? It's gonna look like how much we're gonna pay them and how much like so consumer is paying them. And so they can decide whether they take an order or as I'll say we use it. And that's the kind of flexibility that our shoppers Value is a kind of transparency that they want. Are you seeing a labor shortage right now? And what are you doing to to combat that? It's different in different places. All demographic of shoppers is Different from food delivery and rate sharing. We have 70% women and half of them moms. And that's because a lot of the job are in stock is very different and just being in the car with strangers. It's about like going to the store, doing a good job of customer service, of really picking the right products for the And we are seeing that being very appealing to women. Japan's critical role in the global economy is changing as the world recalibrates. ",https://www.youtube.com/watch?v=dp8PhLsUcFE,1381,2022-09-11 00:54:03
7669,"The technology to the newer nails. Mm hmm. And that takes time. Tarik Robiati will play a key role for HPE as it retools to face new challenges. Romaine bostic asked him what skills to see if he needs to truly succeed as a chief future officer. The first quality you need to look for is here for it's almost stable steaks, right Integrity and it's not about being honest or or dishonest. Of course, we're all honest. But it's integrity of thought in the way you present the fact based, which is the If you don't have that in the seafood, stop looking, move on, right? That's the first and foremost thing. The second most important thing is the ability to be strategic It's absolutely critical to be injecting in the work that is here for performance Thinking. The third I would say if you think about it in these terms we are a little bit disturbance of the resources of the company for the company and for the CEO we gotta make sure that resource Is up to scratch Where there is the biggest return possible and finally, we also have to be coaches. We have to coach our colleagues and team members and my job at the way I think about it is we have to shine the spotlight on their strength. But also at the same time make sure that we understand Weaknesses and are clear About the areas that we need to improve. So a lot of the CFO job is to distill what I simply would say is tough love. It's about being tough right matters and also be encouraging in other circumstances. What's the opportunity here for HBE over the next 10 years The opportunity for HBO over the next 10 years to really find the industry. And because we firmly believe with Antonio that the future of the industry is extra cloud and I think that they will be a growing acceptance and starts already you have evidence of it ",https://www.youtube.com/watch?v=dp8PhLsUcFE,1382,2022-09-11 00:58:19
7670,"You know on a basketball court you can't control whether somebody's gonna make a shot you've gotta get lucky and what's the greater pleasure making five times your money on a distressed debt investment or winning the NBA championship They're both fabulous I I wish I could do one each year that would be great but He was a great feeling and being right on an investment that you've done a tremendous amount of work and you've made money for your clients which I think is great. I think winning a championship It's a very surreal feeling because there's a whole city or state that is actually behind you You know, we had 70 1000 people at the finals and we had them all outside. It's 17 1000 in stands And then literally like 60 1000 people outside And when we won like just the joy that you had brought to the city was phenomenal. 1997 I was interested in the following question which is there are a bunch of the dinosaurs called Sorapod Dinosaurs which had really long skinny necks so apostoras is an example I also really long skinny tails. Dinosaurs could actually act like a whip. There's a way of ball clip makes that cracking noise Is because the tip of the whip actually goes about twice the speed of sound. Okay. And that crack is a sonic boom. Yup ",https://www.youtube.com/watch?v=dp8PhLsUcFE,1383,2022-09-11 01:02:41
7671,Say we we are already working for a 1000 years on this topic. Keeping the water out isn't a new challenge for another ones It's a battle they've been fighting for centuries. So when the effects of climate change started to crap up they were like yeah let's do this we're ready. We traveled to Riderdown to find out how this city is getting ready for the future and whether the ingenious stuff they've come up with we'll ultimately be enough to save them And hopefully the rest of us too. When you look at Holland or the Netherlands then the name the Netherlands already says that we are a low line country One for this country is below and two third is funeral to flooding. Back in the day the only things keeping the water at bay were the dikes which are basically just raised amounts of earth. Once every few decades the water would overwhelm the dikes and cause catastrophic flooding. And that was just the way things were. Until 1 day in 1953 all that suddenly changed. 53 disorder That was 5 years long and I live on the farm There was no radio People didn't know Moving hard ,https://www.youtube.com/watch?v=dp8PhLsUcFE,1384,2022-09-11 01:06:53
7672,Not by keeping the water out But by giving it a place to go This is the water square and it is actually you could say a symbol for our approach how to become climate adaptive. So under normal circumstances this square can be used as for example a basketball field. But on days like this it's stores access rainwater and keeps it from flooding the streets. So it's a multi-functional solution We want to add quality to the urban space but in this way we are also adding a water storage This is the first water square that we have been developing but it's part of a bigger package of measures. An interesting one close by here is what we call the duck park or the the rooftop park Which is a kind of a long levy of one km and on top of it a huge rain park It's storing excessive rain or water because of the green roof. Looking at the challenges released from to climate change a lot of people think it's going to cost us a lot of space and money And we try to show that also can use it to work on a better city. Some ways the Dutch are just as baffled as the rest of us about climate change. For one thing there's a question of what happens when sea levels rise beyond a certain point The Maslik barrier was built to withstand one m of sea level rise. And a redesigned barrier could potentially handle even more than that. ,https://www.youtube.com/watch?v=dp8PhLsUcFE,1385,2022-09-11 01:11:14
7673,Part of what I love about business is you get to build things from nothing. Master. It's pretty much full service shadow banking with nobody in charge. Hey CFOs are reshaping Analyst Chief No one covers the world like Bloomberg. And bring inflation back to our target. One 1 million people have been affected by this flooding in the zoo. Disruption is the whole point of a strike. The moment news breaks 24 hours a day. Bloomberg. ,https://www.youtube.com/watch?v=dp8PhLsUcFE,1386,2022-09-11 01:15:35
7674,This is Tokyo Sky Tree At 634 m it's the world's tallest tower. Designed for broadcasting and observation the base of sky tree occupies a relatively small plot of land that isn't ideal for such a tall structure. QBC Add to and his colleagues designed a steel trust tower so instead of fighting against the wind it can simply pass through the gaps between the trusses You don't Device that's a Up. To stabilize the tower the team used a traditional Japanese design called Shimbashira that dates back over a 1000 years This is the flexible central pillar of a Japanese pagoda which stabilizes the teared wooden structure during an earthquake or typhoon in a similar way to a tree trunk supporting its branches. A Shimbashire has been found at the center of the world's oldest wooden structure made from a tree filled in 594 AD ,https://www.youtube.com/watch?v=dp8PhLsUcFE,1387,2022-09-11 01:19:59
7675,On ways 40 tons. When the tower shakes these two dampers act together as reverse pendulums reducing vibrations caused by wind or earthquake When SkyTree was designed in the late 2000's architects and engineers flew weather balloons to collect data on wind speed and build models which they tested in a wind tunnel But for some building designs this expensive and time consuming process has been replaced by faster and cheaper software powered by artificial intelligence After a decade of research architectural engineering company techinaka has developed a typhoon simulation software called Kasamadori Come on. It's kind of Hey Hey ,https://www.youtube.com/watch?v=dp8PhLsUcFE,1388,2022-09-11 01:24:19
7676,Japanese architects are also experimenting with unconventional building materials for high rises. Skyscrapers are usually built from concrete or steel because they're strong and cost effective. But building from wood is more environmentally friendly. Compared with the production of steel and concrete production of timber consumes less energy and releases less carbon dioxide. Trees can also be planted to absorb emissions. But building tour structures with wood offers up its own engineering and financial challenges That didn't stop Japanese construction company Mayada from trying though. Hey Could've take what's no And talk to this. Mokusa you are Maya is going to construct a 13 story wood and steel hybrid office building in Tokyo Shabuya district To make the building earthquake proof designers came up with a hybrid lattice structure that will support the walls and create a more user-friendly experience. ,https://www.youtube.com/watch?v=dp8PhLsUcFE,1389,2022-09-11 01:28:39
7677,On the world. Access the financial world on demand Hear from leading economists Policy makers. And industry experts via live and on demand webinars. Only from Bloomberg. Start exploring to see what's moving the markets. Visit Bloomberg. Com webinars Secular shift. It's knocking it out the ballpark. This is a level of uncertainty that we haven't had to deal with. ,https://www.youtube.com/watch?v=dp8PhLsUcFE,1390,2022-09-11 01:33:02
