id,text,video_url,iteration,created_at
8890,"The projects and that's where companies like us step in. Marco Alvera, CEO of Snam there speaking with our Maria today. Let's turn out to the aviation industry. It's Contributor to global greenhouse gas emissions and it Pressure to change that. In October, the International Air Transport Association, a tree body representing Approved a target of achieving net oh missions by 2050 to achieve that many airlines in the US and Europe are looking to buy sustainable aviation fuel made from renewable sources like used vegetable oil Initiatives like these are pushing play makers to come up with some radical new aircraft that will eventually cater to our growing appet Travel without hurting the environment. We took a look at how airbus the world's number two aircraft manufacturer is stepping up to the challenge. How long until we can fly emission free Airbus says it's more confident by the day it can be done by its 2035 target Hydrogen powered planes at the company's summit in France. The physic works highly organic technology are not new they are used in in other sectors we use them in space on our rockets and we don't need the loss of physics to change to be able to use hydrogen on our planes so everyday we become more confident but we think we need to have a plan we need to have the the right fuels the high At the right time and we need your regulations to be ready. So, we really need the the work and the collaboration of many people on the globe to make it happen on time. Passenger jets go mainstream ",https://www.youtube.com/watch?v=dp8PhLsUcFE,2664,2022-09-14 17:55:24
8891,"From Bloomberg's World headquarters in New York I'm KB Lyons and this is Bloomberg Green now let's bring in Meredith Annex our Bloomberg NEF hydrogen special Talk more about how hydrogen could change the energy landscape. So Meredith What place do you think hydrogen is likely to have in the future energy mix globally? Hydrogens this incredible solution for us is we look to decarbonize because it's a perfect solution in areas that are hard to electrify. So, where we like to think about hydrogen playing a role, it's in things like heavy industry, especially where you need a feed stock as well as energy source And then things like dispatchable power long call transport maybe even shipping an aviation. That sounds great that it can be used for such diverse industries. At the end of the day though, how much Going to cost. Well, that's the amazing thing about hydrogen. Because depending on how you make it, it can actually see significant cost declines in So when we're talking about clean hydrogen we're usually mean green hydrogen produced from a new electricity. ",https://www.youtube.com/watch?v=dp8PhLsUcFE,2665,2022-09-14 17:59:38
8892,The Bloomberg business app. This is a bloomberg business flash. ,https://www.youtube.com/watch?v=dp8PhLsUcFE,2666,2022-09-14 18:03:58
8893,"September 14 2020 to Carol Master along with my cohost Tim's Denver guys tired of vacation so I thought I'd come back I think this is the first time we've been back together in the studio for 3 weeks it's good to have you back Carol are you well rested or you relax Veggie going on. Nothing happened while you were gone. Yeah, what happens? Does not happen every year. So, I'm not gonna go away anymore. This is I'm gonna do something for the bulls out there. Speaking of the market, stocks though, continuing to bounce around him. Yeah, we're actually seeing the S and P 500 moving to the red but the Nazda is still up by two fence of one%. Investors still trying to figure out what's going on with Fed. They're getting hot and heavy when it comes to raising rates. Yeah, that's the problem, right? Alright, and keeping with that, Talk about how the looming US rail strike may make inflation matters even worse. Sorry everybody. Yeah, two 1 billion dollars a day if that strike up and it's just wild. Plus, Walmart and checking accounts soon to be a thing. Also, the haven for Chinese manufacturers. There's a hint Yep looks south. Yeah exactly. Also we've got the inside story of YouTube. How it upended everything. And we also go beyond beer with the CMO at AB and Bev. Bloomberg business week is brought to you by Commonwealth supporting more than 2000 independent financial advisors with the solutions they need to grow a thriving business. Commonwealth go where you grow. Visit Commonwealth. Com to learn more Alright let's get to it and let's get to the market drivers report. Set your business week agenda on his happy hump day Wednesday as we said September 14 in our studio interactive broker studio to my right markets correspondent at Bloomberg and to my left Molly Smith economic editor of Bloomberg News it's almost like it's like AA boxing match to my right to my left no no no no we all get along. Anything can happen in our studio. Alright, let's kick it off with you. We are bouncing around in terms of ",https://www.youtube.com/watch?v=dp8PhLsUcFE,2667,2022-09-14 18:08:49
8894,"Overseas caught up with him well known investor global investor talking about their fed maybe needing to go as high as we are seeing in terms of rates as to what we're seeing on inflation is that realistic do you guys have those conversations in terms of your expectations about how high the Fed has to go in order to Bring this down. I mean, as far as next week goes, I think 75 still seems to be the clear preference. There are a few people who are calling for 100 but basis points but that seems to be more of an outlier than the realistic Used to think as far as credibility and messaging goes and not wanting to surprise markets that's so very much more and like what Paul is trying to accomplish. Yeah, no more yesterday calling for 100 basis points. Then, on So low interest rates would be be pretty Jeffrey Funlock Said that as well. There is something going on with rich people in 25 pieces points. Go for it The case that a lot of people are making when it comes to 75 or 100 basis points the idea that perhaps the fed does actually need to go far more aggressively but then what about the psychological effects of calls calling it 100 basis points cuz last time you did it it was the ",https://www.youtube.com/watch?v=dp8PhLsUcFE,2668,2022-09-14 18:12:43
8895,"Powered by more than 2700 journalist and analyst in more than 120 countries Hi Nancy Lyons this is Bloomberg. Alright, Nancy, thank you so much. Nancy Lyons and her 99 one newsroom in Washington DC. You are listening and watching Bloomberg Business Week on this Wednesday. Carol Master along with Tim Stenivic and one of the stories we wanted to bring to you because we're gonna be actually catching up with David Rubenstein. Is that tomorrow? Yeah. Is that right? Paul Afternoon, right? Yeah, Paul's giving us a thumbs up. I got the, I got this new book. My desk. How do you invest? Do you know it's such a popular book in the newsroom that Paul put it on my desk and somebody stripped it? Can I just say, hey, go swipe it from somebody else's desk. I think in the close to 2 years I've been doing this, we've had three different books from David Rubenstein. Rather prolific. What have I done in that time? That are out there including in the investment space and then is able to take a lot of this conversations put them into incredible books and then share them with the general public What investors should do right now? Huh. With the pullback that we've seen in recent weeks. Listen to this. He said that earlier today that it's actually a good time to investors to jump back into stocks especially after the release of August inflation data triggered Tuesday's market plunge. One man sell off is one man. Make some mark it Carol. Here's what he said really skilled investors I think are buying things now at the bottom of the market or close to the bottom of the market he said this he'd I think cut up with the surveillance team earlier today when markets are in trouble as they are now you could argue now is probably Pretty good time to invest. ",https://www.youtube.com/watch?v=dp8PhLsUcFE,2669,2022-09-14 18:17:15
8896,,https://www.youtube.com/watch?v=dp8PhLsUcFE,2670,2022-09-14 18:21:17
8897,"Inflation of CPI the even bigger rebound of PPI but I do wonder if that gap of course is closing on the right hand of the screen we got PPI this morning remain of course Demand month over month falling one 10th of one% but there were some Statistics within PPI that are still rising. So, I do think that jury is still out when we're really thinking about the big inflationary pressures underway. And the inflationary pressures and when you look at that chart and sort of that Rental here of course we know a big part of that differential is that well a lot of these companies were able to pass those costs on and the big question going forward guys I guess is Arthur gonna have that same pricing power over the next couple of Well another question to romaine is whether or not individual investors are gonna come back into the market we saw them come in in a big way earlier today our belly lip shelt out with a great piece and talking about retail investors in particular coming in buying up the S and P 500 ETFs So Apple share some two 1 billion dollars coming into the market the year second largest day of retail net flows having said that Sam Stouffel who's chief investment strategist over at CFRA research he wasn't surprised about the bounce back that we saw earlier in stocks but says for investors get ready for markets to tread water at least for a bit check it out History tells us that whenever we have had a four% 1 day decline that we usually see a bounce of about one% the day after that's happened about two out of every three times but then we sort of trade sideways for the next week as well as the next month Or resuming an uptrend 3 months down the road. So, basically, you know, I I think investors just have to hold on to their hats right now. Because on that note ",https://www.youtube.com/watch?v=dp8PhLsUcFE,2671,2022-09-14 18:25:56
8898,"Getting to a potential rail strike too later in the week. Yeah. Lot for us all to deal. Once again, nothing's quiet, guys. Alright, we're gonna come back, continue these conversations, count down to the clothes, and just about 30 minutes time, live on radio, TV, and YouTube, and of course, don't miss beyond the bell. We're gonna catch it down to the market On this wednesday our team back at 4 PM Wall St time. You're listening to Bloomberg business week with Carol Messer and Bloomberg quick takes Tim Stenovic On Bloomberg radio. Alright, you are listening and watching Bloomberg Business Week on this Wednesday. So much going on in a week from now, we've got the next fed meeting. I'm still waiting for that Game that Sam Stoval was talking about. Well, not seeing that today. He said like 2 out of 3 times. Sam, I gotta say I love Sam. Market cycles looks at it from a technical basis you know and so maybe the percentages of we did see a bouncer earlier the day's not over the day's not over and I feel like it's gonna be the countdown to that fed meeting that's gonna make things even trickier alright you are listening and watching Bloomberg business week Cal Master Tim Stenivic and this is Bloomberg Radio ",https://www.youtube.com/watch?v=dp8PhLsUcFE,2672,2022-09-14 18:30:05
8899,,https://www.youtube.com/watch?v=dp8PhLsUcFE,2673,2022-09-14 18:34:18
8900,"Investment management i will tell you one thing i take a lot of issue with what the market is pricing in for next year which is nothing other than the fed making you turn and becoming accommodative and it is quite clear to me that the fed is going to pursue it's aggressive stance and Neutral but not accommodative and that's not what our prices are reflecting right now. Meanwhile, JP Morgan Chase, a chief US economist Michael Ferroli says beneficials are unlikely to raise rates by a supersized 100 basis points when they meet next week. San Francisco based twilio make her of customer service communication and marketing software says it will cut about 11% of Jobs and restructure today we're seeing recapping stocks are trading mixed S and P up three now up one 10th of one% I'm Charlie A Bloomberg business. Thank you so much for that update. You are listening and watching Bloomberg business. We Calmaster Tim Stenovic. So, among the things on our radar also on investors radar. It is among our most red on the Bloomberg today about the looming US rail strike that threatens to push inflation even higher across the country and to this is coming Excuse me after we saw this morning's PPI report where prices jump more than expected last month. Yeah, look, railroads account for significant portion of goods that are transported within the US. More than a quarter of the goods transported here. So, that would cause a real snorel to say the least. Let's get into it with Kachi Dimitriva. She's US economy reporter for Bloomberg News She joins us this afternoon from in the field just outside of Washington this afternoon. Kati, how are you? ",https://www.youtube.com/watch?v=dp8PhLsUcFE,2674,2022-09-14 18:38:48
8901,"And you can tell from from that kind of a piece of talks but this is this is pretty serious. We're getting down to wire. Tick tock though when we look at the clock Katia under the railway labor act right congress can step in to either impose a resolution based on a presidential emergency board plan that was submitted in August or Order the trains to operate as usual while the two sides continue to negotiate. So, That likely to happen even if they don't come to some agreement Yeah, that's right. That is, that continues to be an option, right? So, it's what they did in the in the 1990's to a vert a real strike back then. Catastrophic economy Politically, that's still an option on the table. But as my political colleagues and White House colleagues have reported, it's not necessarily something that they wanna do. Ideal situation here is that they will come to an agreement. The two sides and you know, hopefully hammer something out but as far as right now, as far as we know, you know, the likelihood of that happening right this minute is not high. I mean, we had another reunion, a small reunion, involved, send out a press, state Earlier today saying that they don't agree to to the current deal and are kind of holding out and could strike later. So yeah oh a big goal. How big is the the delta between what the rail workers want and what the companies are willing to give. In 30 in the last 30 seconds we have. Oh yes. ",https://www.youtube.com/watch?v=dp8PhLsUcFE,2675,2022-09-14 18:43:04
8902,"Couple stories we wanna mention and this has to do with the relationship between Russia and China which has definitely come to the forefront as a result of Russia's invasion of Ukraine. Yeah, we'll shortly before invading Ukraine back in February, Vladimir Putin and Xi Declared a no limits friendship yet even as his forces suffer humiliating losses on the battlefield of Russia's president shouldn't expect much help at his first meeting with his Chinese counterpart since that? Yeah, what's interesting today? President Xi and President Putin meeting face to face and who's Beckistone. Their first sit down since a Beijing meeting before Her Olympics that yielded a lengthy joint statement of more than 5000 words in it. They vowed to have quote no forbidden areas of cooperation and challenging the US led global order and pushing for a multi-polar world. But remember back a few months ago February. It appeared that China was caught off guard when Putin invaded Ukraine a few weeks after that meeting. Officials in Beijing initially struggled to both support Russia and avoid endorsing a clear violation of sovereignty. A pre-tex that could be used to just Foreign intervention in Taiwan which China claims as it's territory. Geopolitical discussions, realities, I think of our time. What is the relationship between China and Russia specifically? And remember after that invasion because of the meetings that had gone on between Russia, China, we were we were all curious. How much did President Xi know About the invasion. Yeah. And there was a lot of About that hey Will there I wanna get to another story that's the most red carol Putin's options narrowing after you crane delivers a battlefield route if you've been following this over the last couple of days you've been seeing that Ukraine is actually made some headaway when it comes to the battlefield criticism of Russia of these ",https://www.youtube.com/watch?v=dp8PhLsUcFE,2676,2022-09-14 18:47:27
8903,,https://www.youtube.com/watch?v=dp8PhLsUcFE,2677,2022-09-14 18:51:38
8904,"And so we have seen an explosion of factories there and it it is effectively a work around of Trump's tariff policy which the Biden administration is basically kept in place and so it's interesting about that is You know, you the basically have gained the system And so things going forward may not be manufactured in China as before you find some cheap real estate in other countries Mexico's not the only version of this but certainly the closest to the US so how's this how's this working out as as a little bit of arbitrage Christina well that's the globalization is always average right So I think when we interviewed companies that are based in one particular industrial park that we focused on they most of the Chinese friends preferred to emphasize the the you know proximity to the US market and the savings on shipping but when pressed they admitted that you know for example one furniture maker Facing tabs of 25% when we were shipping from China and now qualify for duty free shipments into the US. Blew me away is how quickly they were able to do that, right? Like I I always feel like when we're talking to CEOs and like, well, the shift, you know, if we have to shift our production elsewhere, it's gonna take a long time. I mean, they move pretty quickly and it reminds us that they are still the manufacturer to the world. Yes, and I think some of these companies are pretty, I mean, they're not all big. I mean, one of the manufacturers is a really big manufactur China but like so they are nimble and they you know Policy ",https://www.youtube.com/watch?v=dp8PhLsUcFE,2678,2022-09-14 18:56:14
8905,"Has Dan and they're building a special road. For example, from like, you know, the, from the industrial park to the border. And so yeah but I think that some people have said that Mexico might have actually seen even a bigger windfall of this kind of investment. If I'm low was being less nationalistic on topics like energy and you know and things like that but this is great for Mexico. Yeah. Right? And like the That really jumped out of me here is near shoring could boost Mexico's exports by 35 1 billion a year. A bit over seven%. I mean that's like that's real. That's real. Also, I mean, while the Chinese investment like like the most recent figure is 500 1 million dollars, it's not huge. I, there is, there are a couple of deals that could happen this year that would be transformative. That would that we're talking about one 1 billion dollars factories. One of them Engine maker that's looking at two different sites in Mexico and those kinds of investments pull supply chains you know around them you know so that kind of that kind of thing I think would take it to the next level right until the suppliers that play into it hey you guys point out in the story that Chinese companies aren't the first to seek That's right. Yes Well this is great export platform now. But I think it's interesting right in terms of the globalization conversations that we're having about what's going on. What? Yeah, I forgot about that. We haven't talked about that forever. Well, I mean, What? Yeah. Yeah. ",https://www.youtube.com/watch?v=dp8PhLsUcFE,2679,2022-09-14 19:00:40
8906,Countdown to the clothes Bloomberg's comprehensive cross platform coverage ahead of the US market close starts right now This is countdown to the clothes just 60 minutes left in your training session Caroline High remain Bostic Taylor Riggs join now by our colleagues Carol Master Tim Stenevick the gang is back together we are going across TV radio YouTube too well I have to say a bit of a light last a day in terms of actual benchmark moves but volume is surging on the SAP once again Carol yeah but bounce it around But I agree with you very little change. I was looking for some outperformance in the market today and I saw that in Highs today still holding on to about a half a percent gain but you know they're still down more than 30% so far this year Tim and that is worse than the S and P ,https://www.youtube.com/watch?v=dp8PhLsUcFE,2680,2022-09-14 19:04:52
8907,"To be elevated. We thank you to Terrace for this sort of a chart. Just showing, well, basically at the 10 year average right now. Dipping slightly below it but we're if you're looking at forward looking PE ratios over here we are seeing in general 17. One the 10 year averages of look look at this chart in this entirety for our TV audience because not only is it back down but think about what econ Conditions were in those previous years compared to where we are today. I think there's an argument to be made that that blue line should be a little bit lower than where it is Yeah, right. It all depends on what the outlook is, right? And if these recession Come to fruition. I do wonder about evaluations have to come down even further. Well, here's something that maybe investors might get freaked out about. Legendary investor, Mark Mobius, catching up with our overseas team, a little bit earlier on Bloomberg Television. He When it comes to race and a little bit of warning this may catch your breath a little bit here's what you have to say The third has a game plan their game plan is to make sure that the interest rate is higher than inflation that's the way they believe the way to kill inflation So, you have eight% CPI that means you have to have nine% So we're gonna see higher and higher rates if the CPI numbers keep on coming this way. And of course that is Mark Mobi as running his own firm, running his own money, and of course someone who's seen a lot of market cycles but guys, I do wonder like if something like that came to fruition, I think about Caroline that chart you just put up in terms of evaluations. If that comes to truth, you know, how much valuations would have to come down? ",https://www.youtube.com/watch?v=dp8PhLsUcFE,2681,2022-09-14 19:09:17
8908,"It's a little rough when you come back. Oh my god. How many 1000 emails? You know, with I think we're gonna see that in terms of the trade. I think it would be safe to say that. It'll start to calm down a little bit because we're gonna wait for what the Fed has to say. Next week and what we get in terms of maybe clarity about what's still to come? How aggressive they continue to be and I agree mark He has seen a lot of cycles. It's a pretty big number but who would have thought some of the inflation numbers? I certainly didn't think the prints would get as hot as they did. And it's persistent. It's staying. It's sticky. Yeah, that's the concern, right? It's that it's not actually coming down as quickly as it went up. And even if we talk about the idea of peaking, right? And and Down decelerating it doesn't mean that we're getting down to that fed funds you know that fed target excuse me of two% right how long will it take to come down will it kinda come down for a little bit plateau again come down and I think do you have political plays into it look at what we're seeing about you know what's going on you know chronically In Europe in terms of their concerns. Energy, food, exactly, so the macro economic stuff there and then, here, the real strike, I keep going back to that. McDonald's CEO talking about 2023 and some concerns about that I mean Continues to be really important. Please into the business round table data that we got earlier that CEO confidence is at a 2 year, 2 year low. ",https://www.youtube.com/watch?v=dp8PhLsUcFE,2682,2022-09-14 19:13:42
