id,text,video_url,iteration,created_at
8797,"Being conflict pretty soon. Can we clear something up here quickly? I think it's very important folks as John mentions that we all saw each other breakfast today. The breakfast we have are completely different. I'm doing a Churchill full English thing. You're eating some damn oatmeal, fruitsy pie granola thing and Lisa's breakfast folks is to go run five mi No. No problem with that whatsoever. Futures are positive. Thomas this massive breakfast. Anyway, at the S and P are four tenths of one%. Yields a higher as well up by three basis points on a 10 year three 4391. We talked a lot about the short end. The front end of the curve Through 370 Lisa an approach in 380 at one point in the last day or so yeah and Tammy raised a point earlier where you were talking about how it's not just the Fed's response to these numbers in the US it's globally what the response is strongly and we're hearing it from the ECB at Chief Economist today who comes out and says that inflation is still way too high The policy is still way to accommodative. So that's what we're hearing. The latest out of the rest of the world. At 8:30 AM: we get US August PPI. Does it matter? It will matter if it comes in hotter than expected and confirms what we saw yesterday. Perhaps on the margins. If it comes in much weaker, it will confirm things. For people who are coming out and say, you guys all have it wrong. Either way, we are coming off such a Level. The bar is pretty high to really move. We need a 10:30 AM: EIA crude oil inventory report this comes after that reporting that Anne Marie helped put out their yesterday about what happens if oil prices get down too lower to $80 a barrel too low I guess I'm saying in quote for this administration they will come in they will buy how much ",https://www.youtube.com/watch?v=dp8PhLsUcFE,2571,2022-09-14 11:09:24
8798,"Central Banks are so much hotter the trade of between growth and inflation and so far what we have heard from madam Lagard is perhaps some lip service to this trade off but not really acknowledging how closely it would be to actually bring down inflation through hiking race and what that means Rose and what that means for the labor market. So, we believe that until Central Bankers acknowledge that trade over and choose to leave with inflation. We are going to be in this environment for an extended period of time where the politics of inflation will be prevailant instead of the economics of inflation Which will become clearer as we enter next year but right now all eyes are fighting inflation which based on what we saw yesterday the cool part Inflation is proving to be sticky and persistent. Where a lot of people would agree with you about Europe and you're hearing a lot of notes or reading them that are saying underweight Europe. It's not so In the US it's not consistent in terms of the messaging how far away from realistic pricing do you think we are in equities even after what we saw yesterday Right now obviously Mark is a moving very very quickly yesterday Very dramatic self but today bouncing back a little bit. We believe that actually more needs to be given back to properly reflect the fact that we should be looking at a earnings recession. So, right now, if you look at your today market pricing, we think that actually The raid path is to some extent fully reflecting up the pricing but the fact that ",https://www.youtube.com/watch?v=dp8PhLsUcFE,2572,2022-09-14 11:13:19
8799,"I'm Lisa Mateo China is facing it's biggest drop in oil demand and more than three decades according to the international energy agency Ukrainian troops are keeping up the pressure on retreating Russian forces Ukraine's border guard services said the army is now retaking a town just two mi from Russia that was seized on the First day of the war. Russian troops have been seen withdrawing toward Moscow controlled crimeia. Google has lost most of the first round in its fight to overturn the EU's record $four. 3 billion Annie Trust fine judges upheld the vast majority of the Europe Commissions arguments but they cut the fine to four. 1 billion. Google is accused of imposing unlawful restrictions on manufacturers of Android mobile devices and mobile network operators. A strike set for Friday could prevent American railroads from transporting farm products, another key goods, it could cost the US economy two 1 billion dollars a day. President Biden is personally trying to break the law jam between railroads and labor unions, labor secret We'll meet with railroad and union representatives today In Queen Elizabeth the second coughing is now at Buckingham Palace today there will be a procession through London to Westminster Hall where she And stay for 4 days before her funeral. Members of the public will be able to pay their respects 24 hours a day. Global news 24 hours a day on there and on Bloomberg Quicktake By more than 2700 journalists, Annalys, and more than 120 countries. I'm Lisa Mateo, this is Bloomberg. ",https://www.youtube.com/watch?v=dp8PhLsUcFE,2573,2022-09-14 11:17:49
8800,"It's knocking it out the ballpark. This is a level of uncertainty that we haven't had to deal with. Television and radio. CPI. Tune in to the line for some NFL NBA and MLB. Could you retire too early? I mean, look at some of these payouts. I absolutely retired too early. For the inside scoop on sports betting, catch the lineup right here on Bloomberg. Markets are preparing to close but the day is not over yet. 45% Global asset markets Bitcoin ain't buying along today. Is it gonna be short term? Sydney. Good morning everybody have a great evening. You do not wanna miss this story. Bloomberg brings you crucial data at terminal speed. ",https://www.youtube.com/watch?v=dp8PhLsUcFE,2574,2022-09-14 11:21:58
8801,F which is Warren Buffett's railroad Norfolk Southern they could walk off the job starting tomorrow and it's almost impossible to overstate the damage that would do to the US economy most of the Economies of farm products move by rail and it's almost harvest season and remember yesterday food prices went way up in the CPI already one railroad Norfolk Southern is not accepting cars new cars for shipment across Country as of today they don't want the car stranded out there and we've been short new cars and prices have been rising and so there is an inflation problem there is a recession problem this could really really screw things up. Amary talk to me about the politics of this and how you expect secondly Walsh to engage In what Mike McKee's talking about. Oh he's gonna have a big meeting this morning with both the rail carriers and the union representatives to try to get an agreement and while Washington does seem somewhat calm David Westam is talking about this with me Contingency plans and looking at what emergency power is the president would have to enact To make sure that what Mike is saying these flows of goods could continue one of the problems they already have though is that already you see certain goods they're starting to stop Things like ammonia which is desperately needed for fertilizer which also of course is needed to grow crops and to feed our table huge inflation story it is also used in hazardous explosive products you can't leave that idlely by in a train car so already you are seeing these companies stop some of these goods so the impact ,https://www.youtube.com/watch?v=dp8PhLsUcFE,2575,2022-09-14 11:26:21
8802,"Incredible stories. Let's paint the picture of this John help me out here cuz I'm back in economy while you're upfront looking out the window you're coming in and you're overshoot London Come around just this side of Rotterdam circles And maybe circle and then you turn around and you get AA rock star view of London Am I right? Literally flying over Buckingham Palace. Time depends on how many times you've never seen the view myself. At 6 AM and then everyone's coming down at 6 AM and you have to keep going round and round. Yeah, I've done that. I've enjoyed the London Heathrow. Anyway, that's a separate complaint. Too personal at 920 Eastern time Lisa can I stop laughing 920 Eastern Time that very emotional procession is gonna begin that journey from Buckingham Palace the gates will open and then the coffin of the queen will be followed by the raw family the senior rules All the way through the male up through horse guards parade through Whitehall and then onto Westminster Hall and we'll be following some of that for you just before the open about going into that opening bow equity futures just about positive but let me tell you those going to Florida Live from London. ",https://www.youtube.com/watch?v=dp8PhLsUcFE,2576,2022-09-14 11:30:45
8803,"Access the financial world on demand. Hear from leading economists Policy makers. And industry experts via live and on demand webinars. Only from Bloomberg. Start exploring to see what's moving the markets. Visit Bloomberg. Com webinars The bounce fades this morning. Good morning to you. Your future's just about positive by two tenths of one% on the S and P 500. Equities up by seven points. Yields higher gain by four basis points on a 10 year three 4468. We were just above Paris on Euro dollar. That was a brutal move. That's the first time I've said brutal For the last hour Highest level since 2000 In this market right now. It's the move of the front end. It's the movers. Tom, you've said it one 1 million times over the last day. The movie real yields. ",https://www.youtube.com/watch?v=dp8PhLsUcFE,2577,2022-09-14 11:35:09
8804,Of Black Rock was talking about that Mike Wilson at Morgan Stanley is talking about but perhaps they sell off yesterday really represented. Yeah I would say there's sort of two things happening in credit. One the underlying corporate balance sheet strap particularly in investment grade credit remains very solid. You know despite the marginal slow down in the economy. In the high yield space we're starting to see obviously on the margin low quality companies experiencing Refinancing issues but by a large credit markets have behaved in a very orderly way so to extend it we are tightening financial conditions credit spreads are wider across both investment grade and high yield it's happened in a in a Orderly way than the moves we've seen for example in inequities. So are you seeing opportunities within the rates space when are you seeing yields get to a place where you've seen the highs playing sad ball or getting close to the highs in the 10 year old I mean I know about the dangerous thing to say because every time someone says it then it tests it the next day but I'm wondering if we're getting to that place where you're starting to see value again duration. Yeah I mean duration's been very interesting. I think we've been early in terms of seeing value in in duration. You know plus minors 100 basis points every you know 6 to 8 weeks so there's not been a lot of stability interest rate volatility has been exceptionally high. What's happening here is the fets putting a lot of credibility in play in the front end of that curve If we're looking inflation expectations further out they are at your today lows to to Tom's point on tenure break evens And as this process plays out as inflation starts to cool and as the economy starts to slow progressively into the middle of next year ,https://www.youtube.com/watch?v=dp8PhLsUcFE,2578,2022-09-14 11:39:26
8805,"Increases in rates there could spill back into US rates particularly the long end of of the treasury curve no doubt at the same time in the grand scheme of things the feds strategy and the domestic inflation story here Dominates by far and so if you if you're a cross market investor and you're looking at US rates European rates in Japanese rates US rates in my mind continue to offer the best value and a risk risk adjusted basis right now Add very quickly. You're not doing the fed dance but let's do it right now. What do you expect next week? Yo no doubt the fed singling that there is more work to be done so to extend that they had a terminal rate of I think the median terminal rate was three and three quarters that probably moves higher let's say 444 and a quarter to four and a half By the end of 23 Likely they start to incorporate a slow economy so higher unemployment into into their forecast Thank you. All the guests going into New York into the studio. Just wanna meet. Not that. You know it's not coincidence. I've got no idea. We hear that. Tom's not there. Let's go. Way ignoring everyone. That's true. Needle. Add thank you sir. As always, you're trying to be very diplomatic around the BOJ story. No no no just To tell us what you really think. They're trying to job on the yen to a stronger place. They're saying they will intervene if things get out of hand. They aren't gonna warn. They aren't gonna give details but they're gonna do it. What are they gonna do? Abandon the peg? Are they able to hand right now? ",https://www.youtube.com/watch?v=dp8PhLsUcFE,2579,2022-09-14 11:43:43
8806,"What's likely to be fraction of discussions among you nations? In Germany, the government is open to historic step of fully nationalizing the country's biggest natural gas in order. Chancellor Olive Schultz is administration is ready to inject Capital into universe and increase its stake to above 50% 12 1 billion dollars in the first half of the year The Biden administration is considering whether to replenish the strategic petroleum reserve when oil goes below $80 a barrel. Just 2 years ago, Democr Blocked former President Trump from filling the reserve at a fraction of that price. Send it democra That cost US billions and potential profits. Us job growth is expected to slow this decade as the labor force ages that's according to the Annual growth rate is half the pace recorded in the decade through 21 about nine% of workers they're expected to be at least 65 years old roughly triple this year three decades earlier News 24 hours a day on air and Bloomberg quick take powered by more 700 journalists and analysts in more than 120 countries. I'm Lisa Mateo, this is Bloomberg. ",https://www.youtube.com/watch?v=dp8PhLsUcFE,2580,2022-09-14 11:48:01
8807,"Trade off that we're looking at in this environment shaped by supply constraint. I don't think I've ever heard Wayley that bearish that was Wayne the global chief investment strategist the Black Rob about 50 minutes ago equity features this morning fading not much for bounce now up a little more than a 10th of one% on the S and P 500 after a Four or five basis points on a 10 year to 345 27 talked a lot about a 2 year three 317 did we breach 380 Lisa That we got. Critical criminal Go down to 114 57 to breach that weaker sterling would be something we're not there at yet. Every year, every week, surveillance is buried with hundreds, truly hundreds of books, and then there's one that trots across blossom, you go, yeah, yeah, yeah, and it's on oil, it's a Javier Blast made an incredible splash with his book, his effort here on the trading of oil at worldwide. We're honored that we Join him in his London this morning. The theme of this trip on hydrocarbons is no one's willing to pay the cost. The social cost of where Europe is. Where America is for that matter where Asia is. When do we start paying the cost of mr Putin's war? Well, we are beginning to start the paying now. Businesses Europe have been paying it for several months already because they don't have price caps as households has in many European countries so businesses particularly small and medium enterprises have been fully exposed ",https://www.youtube.com/watch?v=dp8PhLsUcFE,2581,2022-09-14 11:53:58
8808,"A version to taking money from the big oil companies for fear of at the big gas companies for fear of cannibalizing from their investment. The the European Union is taking a different Which is right? While my politics will say probably the European Union is more right than than the UK but at the end of the day everyone is gonna tax so how to pay for this is a question of who you tax the companies or the families and the whole economy the UK Over the next few months. Supporting the economy through the crisis. That's gonna be borrowing money and that's gonna have to be pay through taxes in the future. It's a question of whether you tax everyone or you tax particularly some of the companies that they're benefiting from the high prices. So if you try to crimp to man, if you got it from that side Know a number of countries have started to do. How much activity has to get taken offline? How much production of factories has to be put aside and delayed? We need to reduce consumption of electricity and particular by 10 perhaps 15% a So we need to reduce Activity but probably 10 15% and that at a time so some people will not sound like a lot but that's reducing the GDP activity Government who are gonna have two Monday A reduction? Are we gonna see every company, every lobby, telling the government Important that everyone else. ",https://www.youtube.com/watch?v=dp8PhLsUcFE,2582,2022-09-14 11:58:13
8809,"So you built a successful company but you might not wanna run it for the 10, 15, 20 years. Or do you? And if you didn't, would you wanna go into government or the president called you to serve our country? Would you go on a government or would you start another company? I love what I do And I I feel like I have this luxury with 23 That It's and it keeps evolving. You know, we started out just as a you know, started a consumer company. We're thick and research. We gotten into drug discovery in 2015 and now we're getting to the delivery of care. So, Been really lucky with 23 me that has been endlessly interesting. And I'm surrounded by Individuals where I learn from them and what I always advice people to do is like you should keep you should take jobs where you're learning and if you stop learning in a job then you should quit and like frankly when people leave 23 me like I say if you're not learning anymore you should move on. So I I'm I'm 100% committed to 23 that said my other passion is ",https://www.youtube.com/watch?v=dp8PhLsUcFE,2583,2022-09-14 12:02:35
8810,"Yesterday session we were looking for a bounce this Wednesday morning Tom that bounce High level 101. Year old that is a change for everybody listening and watching on Bloomberg into twos Lisa with all the headlines going through 370 and then we just made another one Yeah, I'm just watching this because honestly, this has been the direction of stocks just in the opposite direction. If you take a look at to your yields, they have climbed now through solidly through three. Eight% and keep climbing the pace of move has been jaw-dropping the pace of resetting the understanding of what the Gonna do has shifted quite significant 24 hours or so ago has just disrupted the whole narrative around this step down from 75 basis point heights to 50 to 25 every single note I read from everybody raise the same question Andrew Holland host the cities been on top of this more than most he's looking for 75 next week and the potential for another Five in November from the fed. It raises a lot of questions about how much more work they have to do and more importantly for risk assets how much more damage that needs to be done to the economy to get inflation lower? We make fun of this whole good news is bad news kind of conundrum but really what this means More momentum there is and people spending the more ability to withstand higher prices and to sustain them even higher it causes the fed to have to really slam on the brakes that much more dramatically and that's the problem ",https://www.youtube.com/watch?v=dp8PhLsUcFE,2584,2022-09-14 12:07:04
8811,"About one% the day after that's happened about two out of every three times but then we sort of trade sideways for the next week as well as the next month before resuming an uptrend 3 months down the road so basically you know I I think investors just have to hold on Hats right now. I've been dying, dying, dying to talk to you about a concept I heard, maybe 10 days ago, which is a lot of good ideas out there in common stocks, but you can't get scale, you can't buy accountable number of stocks. Do you would see FRA find that you've got a number of good ideas, and then it's hard Other good ideas Well I I think what you're finding is that as time goes on you find that there are fewer and fewer companies on which you have solid conviction because what our analyst do is they're looking 6 to 12 months down the road they're not really looking for the next couple of weeks and so yeah they they take a look at the In economic projections in earnings forecast look also at momentum and sometimes that list tends to get trimmed as a result but we still have a solid count of stocks that we regard as being five star or strong buys. Sam how do you reject this idea that we're going to see and earnings decline that has not yet been priced in this is what we leave Black Rock was saying and this is what Mike Wilson of Mark and Stanley has put out there that basically what the bond market is The activity of a lot of companies. ",https://www.youtube.com/watch?v=dp8PhLsUcFE,2585,2022-09-14 12:11:23
8812,"Marcus Ashworth say yesterday about foreign central banks after that print we literally got the inflation print quickly shifted towards talking about the federal reserve and the market fallout and then Tom Marcus Ashworth sat in that seat and he said this is the Snooze for other central banks and the rest of the world. I agree and will the rest of the world is a key thing here. I'm enough old school where I'm worried about Ecuador. I'm worried about 1992 of Mexico in any number of other items of the past. There is a two now that EM is different this time and I'll buy it for a minute. Oh, I check every morning. Tie Bob, Philippine Hey so all the rest of it and you just you never know where it's gonna be you can think as hard as you want and you never get it right about which is gonna snap Ginormous nation odd oper energy in between this there and I'm sorry It's a social mandate that we don't hear from the western banks. One hand and a thumb it into that you've got the effects dynamic as well and that's really what Marcus was speaking to yesterday not just in the end problem that if you wanna call that any central bank around the corner and threat needle street I love you to do that governor baby's a little bit too close Hey Facebook People are having it. Is whether it's the feds world and they're just living it and they have no say really even if they do raise rates sufficient to match the fed and that's certainly what we've been seeing in the currency Paris. So what's coming up next? Glen Youngkin Republican from Virginia. Would you rather discuss Wickland? Politics. The politics of ",https://www.youtube.com/watch?v=dp8PhLsUcFE,2586,2022-09-14 12:15:40
8813,"When the price of anything goes up, the consequences reach far beyond what you'd expect. But perhaps most of all, when it comes to food. In 2010 surging food prices help spark the Arab Spring lives were lost regimes fell and the consequences are still with us. Once again food prices are rising and fast Energy cost broken supply chains and surging demand were just some of the factors that have driven food prices to their first record high since the Arab Spring. And that's all before a war between two of the world's biggest food producers. Ukraine is called the bread basket of Europe and taken with Russia the two account for about a quarter of global weed trade they produce more than half of the world sunflower seeds and oil nearly 20% of the barley Now throw in rising energy prices and processing transporting even refrigerating food gets more expensive plus fertilizer production is extremely energy intensive less fertilizer means lower crop field and prices rise even more. Pandemic revealed how complicated and fragile global trade systems are. ",https://www.youtube.com/watch?v=dp8PhLsUcFE,2587,2022-09-14 12:19:52
8814,"At this point you would say 75 is certainly gonna be on the table there in November. This morning I think we're all looking for about south of the loss Right now positive about a 10th of one% on the SMP 500 up by two or three points only up by two or three points aggressive losses yesterday the biggest 1 day loss is I've said repeatedly through this morning and many others have as well biggest 1 day loss going back to June 20 Yields are so much higher over the last few months rough five basis points on a 10 year to 346 24 I said coming into this week we've had six consecutive weeks of 10 year old's climbing it's not just a 10 year it's a 2 year as well at least just quickly where are we Yeah. At 380 we're now 381 315 at just this incredible rise and then the correlated it commencerate drop in the S and P in the net it's okay wanna move that's been three AC plus To watch here this morning and of course data dependent but certainly watching foreign exchange is an international measure of where we are right now and this is the most interesting time to speak to the gentleman from Rice University with mechanical engineering is a background he went on to engineer all sorts of efforts in private Equity, and venture capital. He's the governor. The Republican from Virginia, Glen Young, and we're thrilled the governor could join us this morning. Governor, I cannot think of a time to speak to you ",https://www.youtube.com/watch?v=dp8PhLsUcFE,2588,2022-09-14 12:24:38
