id,text,video_url,iteration,created_at
8722,"Intervention whether that's Gtwo and what stepping back from Yule Curve control. Are you there's no question that the Fed has a game plan their game plan is to make sure that the interest rate is higher than inflation that's the way they believe the way to kill inflation Have eight% CPI that means you have to have nine% Traits. See higher and higher rates if the CPI numbers keep on coming this way Wait, hang on, Mark. Nine% interest rates is that is that where you see the peak? Yes Hey The pet has to raise The interest rates higher than inflation in order to inflation that's their belief. And that's the game plan. So you're you're making a call this morning of nine% rates by the federal reserve of the United States of America what with more aggressive quantitative tightening and what kind of an unemployment rate would nine% rates Deliver for the United States. Well, you know, the good news in America is stressable. You've got a strong dial, which means Much cheaper than previously that's number one and number two you have a situation where Have lots of cash Because there's there are incomes from overseas are getting better and better and my recent visit to the US indicates that things are going very well for Americans they're spending like crazy So I don't see the and of course Anywhere else in America you'll find that they'll looking for workers ",https://www.youtube.com/watch?v=dp8PhLsUcFE,2496,2022-09-14 05:41:58
8723,"Are there Mark Let's just extraculate what you've given to Danny and I. The risk is nine% Rates the risk is tighter queue tea Hey and to Danny and anybody else tuning in this morning that may well imply a much bigger ransacking of equity markets than what we saw yesterday or year that I done five% yesterday how much Wealth demolition Will come in equities if the trajectory that you've just put forward comes to play. Are you must remember we were already come down quite a lot you know we are in a bear market no question about that so I'm looking at maybe another 10 15% before people wake up to the reality that they're some great companies out there that are beating inflation and those are able to price The goods higher than inflation rate And these are gonna be very good opportunities for investors. So, we're probably when we look at the index, maybe another 10, 15% down, but then there's gonna be an opportunity to be buying. So Mark that's that's the picture of of American risk assets but inflation rate hikes from the fet is also hitting the most vulnerable it's hitting emerging markets as well what happens to your EM trades to EM risk in this environment Well, if you look at EM currencies without almost without exception, they've all come down. Please substantially against the US. Just like the Euro has come down. Now, what that means is that for some of these countries that are export oriented, they're gonna be in a much better position to export. To the US. ",https://www.youtube.com/watch?v=dp8PhLsUcFE,2497,2022-09-14 05:46:25
8724,It's a type of arriving and it'll be interesting to see how that develops Mark Mobius thank you very much to the phone department there for Mobius Capital Partners big cause Mark I don't know where to go and hide so I'll be looking for a shelter somewhere near you here in Dubai that's Mont Mobius Our guest this morning on Mark it's nine% on rates frisky cutie European Union that is at the Parliament's Manford Webba the chair of the European people's party joins Maria today on the grind. Right here on Bloomberg. I've always been a person who's just been attracted to hair. I like to sit and think in theories. How I can manifest these visions that I have for braiding and how I can take something that Macy ,https://www.youtube.com/watch?v=dp8PhLsUcFE,2498,2022-09-14 05:50:41
8725,"There is a great backing, a great support for the main line presented by the commission. And that's not been touched. Is that about to change? Reduce the penancy to Russia nine% of of European gas supply for the moment. So that's why we did a lot and it was for one for 1 year for half a year. It was a big step he did. So that's why we are on the right track. That is what we are doing and put him feels it. And now it's a question how to to help our people And that is what we are calling for is European people's party. We call for a winter of solidarity. We have to stay together. It's a poor part of our society. We have to have social investments and we have to care about the business sectors. Those who are depending strongly on the gas from Russia Energy I really know in front of a possible recession now our concern in via radio to answer this. Session. That is a word that scares a lot of Europeans, particularly also in Germany. It's a contrary exposed, still to the Russian gas market. Is it unavoidable? Can you take the actions To get your battle. It's not a it's not AA it's not AA law that the recession is not coming so we can we can we can avoid it if you are if you are ready to do so and that's by certainty for the consumers for the market it's the most important one Europe needs a plan commission bill present a day some elements of this planet then I expect leaders to act. You know if you have currently situation that Macron Calls for opening a gas line. If you have a debate about Bringing gas to the European market with an additional gas pipeline in ",https://www.youtube.com/watch?v=dp8PhLsUcFE,2499,2022-09-14 05:55:16
8726,"No business as usual it's impossible yes there's no no business as usual it's done come back to the old to the old system that's clear for me Song. So I think that's clear for me. We cannot work together with Russia. It's nothing happens. Criminal and we have to treat him like this. Of course, Also German politician it's clear to Germany the relationship has changed it's this this is And you know that in Germany They are more used to to be friendly to Russia. Russia especially under the Putin regime is not is not a partner we can work and have also put on the line we admire very much with the Ukraine soldiers are doing now they are winning they are winning territory back It's amazing. Nobody expected this. So that's why let's continue on supporting Ukraine friends. His weapons with also his mission. And let's stick to the sanctions and let's give a social answer to our citizens. Well you're very clear. It was appreciate the fact that you're very frank. With your words Matt for Beaver. Thank you so much for joining us. Of course had the EPP delegation here as we wait for Of course we have coverage all day here on Bloomberg TV. ",https://www.youtube.com/watch?v=dp8PhLsUcFE,2500,2022-09-14 05:59:25
8727,Apples delaying it's next major iPad softer update iPad OS 16 by about a month from September to October. Apple made the decision for a number of reasons including a still buggy stage manager multitasking interface and in order to link the launch closer to the more similar MacOS Ventura. Still it's an unusual move In 2011 Released it's new iPhone and iPad software updates simultaneously each year around September. By staggering the releases users may find some issues around compatibility with cross device features like retracting and editing messages and iMessage The new shared iCode photo library in the new feature for transferring Facetime calls between iPhones and iPads. It will also make it a bit harder for developers to launch apps that run on both the iPad and iPhone that require new APIs and features found across iPad OS 16 and iOS 16 Regardless it was still of course the right move Stage manager on iPad OS 16 is still quite buggy I don't find it particularly intuitive and it's not compatible with most iPads and many third party apps in the app store the feature clearly need some more polish and complaints from consumers about Manager well now no longer probably overshadow the earlier launch of the iPhone 14. ,https://www.youtube.com/watch?v=dp8PhLsUcFE,2501,2022-09-14 06:03:46
8728,"Trading in Europe. Let's have a look at the future's picture for you and remind ourselves I apologize for making you relive this but what we have what happened yesterday? This is the future We are set for here in Europe which given the extent of the losses on on Wall St yesterday perhaps is some comfort the S and P down by more than four Yesterday. The more than five%. Meanwhile, you're at lost just one. Seven% on euro stocks 50. So, we are expecting to go weak at the start of the European trading day. And and the US picture, well, it doesn't look, Doesn't look spectacularly bad maybe that's another a store and clutching it to today but yesterday of course we saw the dollar surge we saw yield search we saw a commodities coming down and interesting that they take us through the GMM we're seeing a continuation of some trends from yesterday I'm thinking about commodities continuing to decline and Looking weak in Asia Mark but on the FX side a little bit of a fight pack from some effects. Yes, there's a small bit of fight back there. Yeah, and you only have noticed that but look, the rest of the column is red and that is the kind of follow Dollar strength. Sure the dollar's not too much today. But that was probably the really big theme yesterday is that we we talked And the dollar rally back really strongly and that's a tightening of financial conditions. It's just terrible for equities across the board in Asia. Really the most pain though wasn't US stocks. So, in fact, the pain and age has not been as bad as we Feared perhaps and I'll do the administrations that wall commodities are down again a little bit softer. In fact they've been a little lower beater reaction to the gloom and doom. They were seen in equity markets than what we've really seen in FX markets that have been the And even argue More dramatic than what we saw in bonds. Yes, bonds moves have been very big. You'd expect On the back of an inflation print. But it was really really quite dramatic in US stocks yesterday. I'm not gonna bleakness and risk sentiment is very clear across the board in the gym and. ",https://www.youtube.com/watch?v=dp8PhLsUcFE,2502,2022-09-14 06:08:15
8729,"Japan Mark is anything that we've heard over the last 24 hours really relevant changing your thinking about where we head on Japan we've seen years coming a little bit higher we've seen plenty of virgins intervention we saw a line about the BOJ conducting a rate chat Effects anything material here Not really it means that we're getting to the rate check stage we're gonna get to more two A volatility but dollar yen's gonna keep on going higher to the Capitulates on it's yield curve control and I don't think that's terminant so I think this dermatic's gonna play out for the next few months and I think that ultimately Dolly Yen's gonna see much higher levels if they try to come into They actually intervene in the market and sell dollar yen and sure they might drop at four or five big figures. If Dolly Young goes back to 137, 138, you're gonna have the whole FX trading world go, mine, and excitely buy every dollar and they can. Because they know the BOJ will lose until they change policy to support their FX stunts. Okay so it'll come back to the BOJ Mark thanks for those thoughts remember you can get up to date analysis and insight from Mark and the rest of the markets live team NLIV go that is the function to use on your Now the EU is pushing radical stats to send the energy crisis. European commission president Erin will call for rationing measures and a swoop on energy companies profits in a speech before the European Later today for more we joined by Bloomberg's Maria today at Maria good morning to you what are we expect to hear? Well, Anna, what a day for Ursula Thunderlion. Remember about 2 weeks ago, she promises intervention and just as verbal guidance to the market. It has been bringing prices down since her peak at the end of August. So, clearly the stakes are high for the head of the commission. ",https://www.youtube.com/watch?v=dp8PhLsUcFE,2503,2022-09-14 06:12:42
8730,"Interesting on the core print to look at that plus energy emergency will have the latest from Stransburg as early on the lion gives her state of the union that address coming in around an hour it's my 50 In fact, I should lay out the blocks response to the crisis. If you have any of your own questions, please do send them to us. Get in touch. IB plus TV go. That's the function to put into your Bloomberg. This is Bloomback. Hey Chris crucially important and I think we've moved from this attitude from it's an indulgence a waste of time almost an illness that needs cure As universally important to human life as sleep mystery surrounding its necessity and utility have only just been recently uncovered Some of our biggest discoveries were in the 1970's or 1980's and so it makes it a really exciting feel because it seems as though we're uncovering new insights each and every day. Some scientists are going further to find out how sleep and what happened there can be harnessed to further expand our understand ",https://www.youtube.com/watch?v=dp8PhLsUcFE,2504,2022-09-14 06:16:45
8731,"I'm still in the 75 basis point camp I think the you know inflation was a little bit on the Much more likely if you know not certain but much more likely to see a 75 baseball hike I think in ter Trajectory and going into next year I think those people that were expecting some cuts in 2023 are probably reconsidering those forecasts now and expecting more of a play plateau in interest okay Mark Nina, good morning. I'm with you that the reaction the market seems to be more drama Perhaps the shock in the data but the data did show this is demand led inflation primarily now and it's in the services components not the good components and it's in the sticky components in that situation is there any possible way of bringing this inflation problem under Without a severe curbing if I could demand it hence a recession and if there is a way how does the economics behind that work? So it is hard in general just looking historically not only in the US but in developed economies in general it's very difficult to bring down inflation that is In or near double digits territory without an economic downturn. Certainly, the fetus trying to engineer that but what they're saying at this point and in fact, what they have been saying for a while is even if this does lead to an economic downturn, they're judgement and Argue that there are judgement is correct. ",https://www.youtube.com/watch?v=dp8PhLsUcFE,2505,2022-09-14 06:21:04
8732,"The common frat perhaps underappreciated by the markets. I mean maybe the reason that people have lost over it is that it's very hard to to to know because it's it is quiet unprecedented the level of quantitative easing the now needs to be sort of unwanted and how that's going to look is it going to be as putting code big of a In the last year it's it's hard to say but it's certainly not something to to be ignored but I agree that it's not really making the the waves at the moment that were there were once expected. Nina, thank you so much. Stay with us. Nina's Economic and business research CEO stays with us on the programme to give us their thoughts on the UK we're talking UK inflation which slowed slightly in August but call CPI Rose what will this mean for Andrew Bailey and the Bank of England this is Blingberg When US inflation numbers are released stunning inflation Terminal speed. This is about a narrative shift in markets. Anytime soon. Policy mistake. ",https://www.youtube.com/watch?v=dp8PhLsUcFE,2506,2022-09-14 06:25:30
8733,"Trend in core I suppose and a lot of the forecast suggested it'll be back up in October. Yeah, I mean, you know, I wouldn't call nine. Nine%, you know, inflation, good news, and in any sense of the world given that the target is is What is good news on inflation is what we heard from the prime minister on the energy price price freeze or cap given that that is actually Saved over four five percentage points for our early 2023 lates 2022 inflation forecast but in I mean there there is still an inflation problem not all of it is energy driven in we are seeing wages rising we had a very recently earlier this week a labor Hmm. So the Bank of England very much needs to to act Nearly saying in the break we're talking that using the bank of England's like really behind the far behind the curve ECB's got a little bit more justification being cautious and fed is now doing the right thing on the bank of England given that you think they're massively behind the curve how high do they need to get rates where do you think the terminal rate needs to be UK. Unfortunately, they just because I think they're behind the curve doesn't mean that they agree. So, I think what we're going to see for the rest of the year is a further couple of 50 basis point hikes and then 125 basis point hike. So, that is ",https://www.youtube.com/watch?v=dp8PhLsUcFE,2507,2022-09-14 06:30:01
8734,"I went back and looked and very few secretaries of state in the last 100 years or maybe ever have really gone back in the garment so why didn't you wanna come back in For any issue when you're if you've got eight grandchildren you've got two daughters you've got wonderful family why didn't you wanna come back and And go through this terrible process we have in Washington of getting things through consensus and getting people to agree to what you wanna do because I want those grandchildren to have a future It's very simple We're not in a good track right now. The world is not serious enough about reducing our admissions fast enough, David And the result is that the planner is gonna continue to evolve in reaction to what we human beings are doing to it. Through fossil fuels. Most of the emissions that are going up nowadays into the atmosphere and are creating this increase level of energy that comes from the ocean, goes into the storms, the floods, the rain, all of that is explainable and it's all linked to the changes we are creating on the planet. So, it's very simple. I wanted to come in because I think we have a real chance now to make something happen and I think Glasgow was a major step forward in the effort to do that. ",https://www.youtube.com/watch?v=dp8PhLsUcFE,2508,2022-09-14 06:34:05
8735,"Where where sorry we're a little bit blow there and the 15 year 15. Eight were quite a chunk above there so generally we've traded much cheaper over the last 15 years that's a few different But you could see that all of them were in that ballpark of saying that US stocks Longer expensive and I think it's important to know that. Now, that doesn't mean there are buy to put this in context. Us stocks stayed really, really expensive from Lake Tasna 20 onwards and I was one of those people who Out on being bullish throughout the whole early part of 21 because I was like there are too expensive they're too expensive if you're optimistic buy the rest of the world you can't buy US stocks and they continue to And then it was only when we got a catalyst that they started collapsing Late 2021 that it became right to be bear stocks. So valuations are there. You gotta wait for a catalyst for them to change. I think importantly stocks should get cheap. Two reasons. One is we nearly always have an overshoot. The way this cycle works is we have these kind of overshoots and you can see that this purple line is in A 15 year average and you can see that I kind of goes up and down in a nice loop because we do have those overshoots so I expect an overshoot and the final point is The world is getting much tougher we're we're seeing a really big tightening of flash conditions we're expecting growth to slow down we're gonna see earnings come down so that would Price falling even without the peer ratio changing so I think that ultimately this just does justify the idea that stocks can trade an awful lot lower over the next 6 months over the Here. Okay, Mark, thanks for that. Let's get back to the energy questions facing Europe. The EU is pushing radical steps to extend the energy crisis. European commission president on the lion, will call Actually measures and they swoop on energy companies profits. That's all expected during a speech this morning before the European Parliaments. For more we're joined by Bloom Bakes at Maria today. Oh Maria. ",https://www.youtube.com/watch?v=dp8PhLsUcFE,2509,2022-09-14 06:38:29
8736,Brought all society and corporates on board. 4 PM. For for peak hours it's putting the pressure on households not with a policeman in their bedroom of course but Depression on how's old collectively saying okay if you have to put your washing machine on then do it at 5 AM and not at seven or at 8 PM You know that basic things but when you look at the market that's during the peak hours that the price is rocketing and that's what we want to avoid in an urgent way Second we need to cap the revenues and that the taxation issue we need to cap the revenues of electricity and oil and gas You believe that will happen Will happen. Element of what will be announced today. On electricity generation companies To get the rent to the number states so that we can invest in solidarity to handle the social consequences and to invest in green energies plus It's one of Levy On oil excess profits It will be announced today by Vandali. And I I know you care a lot about social issues and the environment but I wanna ask you a question. What's your response to that? The shop they have access profits I would like to tell if I take a French company I Quite well is more 3000000030000000000 for this year. ,https://www.youtube.com/watch?v=dp8PhLsUcFE,2510,2022-09-14 06:42:48
8737,"The trial is at the mid October. Wall St Giants are forecasting deep declines in investment banking fees for the current quarter with investors boot by the economic outlook city group CFO says bees such as bank are likely to plan it Percent in line with the broader slowdown hitting the sector that mirrors earlier comments from JP Morgan that clients are staying on the sidelines. So to say Volkswagen has lined up commitments from Anchor investors including the Luigian sovereign well fund the world's biggest for its Port listing Volkswagen is said to be mulling It's looking to finalize the price range over the weekend. Starbucks has boosted its outlook for sales and profit on rapid expansion and an expected recovery in China. The coffee giant now sees earnings for share rising 15 to 20% in each of the next three fiscal years and plans Turn 20 1 billion dollars to shareholders during the period. That's your Greenberg business splash, Anna, Alice, thanks very much, Anna Sankins here in London. Coming up, we speak with North Sounds Park Yoga, Parson, we'll talk venture capital and the climate for that as rates rise. This is ",https://www.youtube.com/watch?v=dp8PhLsUcFE,2511,2022-09-14 06:47:10
8738,"Continue to support the entrepreneurs and you know even if the market has really had major correction The entrepreneurial activity typically is much more longer term centric and and the companies that we will be backing for the next two 3 years are eyeing a position to market leadership that perhaps is To 10 years ahead in time and then we are circling a different cycle. The good thing about that is obviously that there is less competition for them to succeed. There is less competition for talent and there is also less competition among investor Which makes our entry tickets a little bit more attractive actually. Good morning party organ I'm curious what's your kind of timeline for investing this new fund when do you expect to get most of invested and which sectors are you seeing the most exciting opportunities? Hey, good morning. Yes, we do see that typically we deploy about half of the capital in about 3 years and then we say the the the the remaining 50 To the best performing companies for the remaining 7 years We expect to be going into enterprise software we're seeing a lot of activity right now in the environmental sector like ESG powered stuff That it's really a true different Many entrepreneurs and that's the way how they can really beat incumbents And also I think prior health care sector is going through a you know dramatic change and the healthcare processes really need to be innovated and we see tremendous I'm out of good stuff happening in the market there. ",https://www.youtube.com/watch?v=dp8PhLsUcFE,2512,2022-09-14 06:51:29
8739,I'm able to start a business or count a cyclical call for the morning. But you're good. Thank you very much. Bye you're good person. North Saints general partner. Thank you for joining us. Coming up we'll get back to listed companies. We'll talk about the socks that we're watching the ones in focus today including intertext. First half sales and earnings beat as the owner of the Zara clothing chain defies a global surge in inflation. This is Lingbeck. In the past two decades China has built large infrastructure projects in almost every country in Africa. We want to be treated like partners the Chinese came along and said great we don't do aid in charity we wanna do business with you Global gateway will mobilize 30000000000 till 2027. Now the US and Europe are answering back with their own infrastructure initiatives to counter China. But African experts are skeptic ,https://www.youtube.com/watch?v=dp8PhLsUcFE,2513,2022-09-14 06:55:54
