id,text,video_url,iteration,created_at
535,"Finance isn't doing that. To their own staple coin. So, in some ways, this is gonna make it a lot easier for them to maybe you know, have to have market makers do less tactics to you know, keep up the quality of all their stable coins, but in on another way, in another angle, it's sort of looks like a power grab Finance. David in a separate crypto story you know we're in the final countdown for this big merge upgrade that's happening to Theory and it feels like we've been talking about it forever as of course the block chain for the second largest coin Ether what's the latest I mean how much of these price moves we're seeing today is pegged to that as well what do we expect? Yeah so the expectations that we know for the when the merge is finally completed which is sometime between September 10 and the 20th with most people saying something like 8 AM on September 15 that sort of like the majority projection but we really don't know but when the merge is Drop by 99. Five%. And then from there, you know, what we're looking at is like a few different things that are sort of interpreted but really they'll only other immediate thing we know is that the ethereum merge trade is gonna become the most popular trade in crypto over the last month. Plenty of people have been talking about it Also, during the same period, as of today, ",https://www.youtube.com/watch?v=pinYGgnrDs8,24,2022-09-06 15:21:36
536,"Well, traders are bracing for a volatile month. This Wall St looks to a potential 75 basis point rate hike, both in the US, and in Europe. Now, research platform Global factors increasingly weigh on US markets joining us now is Hugh Roberts quant inside head of analytics he would get to You today before we get into what exactly QI measures let's talk about what viewers typically think as the fear gauge and we talk about the Vics a lot Why do we need an alternative to that? Well the easiest answer for that or probably the most painful answer from investors is to put me the negative carry. The shape of the forward future's car for Spiking ",https://www.youtube.com/watch?v=pinYGgnrDs8,25,2022-09-06 15:25:48
537,"To less stable Sentiment driven markets and that's really how our clients use the volume indicator. So if you let's break down some of those benchmarks that you highlighted the Euro dollar, the dollar yen, the 10 year yield, I mean those are all you know, we have seen huge swings there within the Hours or so what is that tell you when when you break it down through QI you're index what does that tell you about where the market's headed? So what we're doing we do have valuation tools that can save for example the S and P 500 at the moment is currently half standard deviation cheap it is sold off slightly more aggressively than macro fundamentals warrant but what the volume did does is not a valuation tool it's looking at the ability of Pro to explain price action and therefore say well Price action is not driven by macro. We are in these periods of Positioning and sentiment driven so really this is you have to distinguish between evaluation tool which we can do or just a really trying to give people a heads up for when markets are potentially about to go through about a risk golf and should really be thinking about that positioning in their sizing recording Okay Hugh Roberts quant inside head of analytics appreciate the time today thanks so much for joining us We'll cover up putting a band aid on student loans. The president of Purdue University is gonna be joining us to discuss why he thinks the president suited loan plan misses the mark. We'll be right back. ",https://www.youtube.com/watch?v=pinYGgnrDs8,26,2022-09-06 15:30:16
538,And some criticism and almost equal measure assessing the cost of plants has been equally as controversial. Some estimates see coming with the price tag of almost one 1 trillion dollars. Let's bring Who finance contributor Kevin Sorelli joining us from Washington DC and Kevin you know the thinking behind this move was that this could potentially give the president And the Democrats are bigger bump going into the midterms what have we seen so far in terms of the backla Let's come with this. Especially from conservatives and even from some central democrats including a former Obama economist Jason Ferman who tweeted out just within the last couple of days that this is something that quote pouring roughly half a one 1 trillion dollars of gasoline on the inflationary fire that is already burning is reckless Doing in a while going well but on one campaign promise and breaking another is even worse beyond that you alluded to this but the pen warten school a warden school business at University of Pennsylvania has come out and said This could cost one 1 trillion dollars and even additionally to that many states are weighing conservative states are weighing whether or not to even file lawsuits to see whether or not the president has the ability to do this. The politics of this are actually some Interesting because you've had speaker Pelosi give a tasset behind the scenes endorsement of this policy you've had senate majority leader Chuck Schumer come out and say that he very much supports it but then you've got this more popular debate brewing beneath the Also saying this does nothing to keep the cost of tuition down ,https://www.youtube.com/watch?v=pinYGgnrDs8,27,2022-09-06 15:34:37
539,"Students to borrow more believing that they may well be excuse from that obligation later so It it's a little hard really to rank by concerns about this but I will say I guess beyond them all the inequity. Of rewarding the currently wealthy or those who are destined to be wealthy half of this debt is in graduate education so thank doctors and lawyers Whatever they're earning now what they're going to earn and it'll be subsidized by those who didn't get that chance and never will. Is there a way to go about forgiveness in a more fair way? I mean, if the concern is that, you know, those who can afford to pay are getting the relief and that this isn't necessarily targeting things. Is it for example, a much better option to let's say target the interest that comes with the loans which some would argue is really Inflates it. I suppose for those who put themselves in the position that in which they can't or or decline to pay now some sort of a workout one by one would be a preferable As as opposed to blanket forgiveness of the kind we've we've just seen I've always thought that the real Solution to this or preferable approach would be to put schools like ours at least partial risk so some of the recovery here could be coming from colleges and universities who the data For a long time have pocketed something like two thirds of all the new subsidies federal government has provided that'd be one place to go for some recovery of funds beyond those that the borrower has Taken on beyond their ability to pay ",https://www.youtube.com/watch?v=pinYGgnrDs8,28,2022-09-06 15:38:51
540,Vacation for affordability Being a place where they're less likely to be rudely surprised by a big increase each year is one attraction along with our academic quality. Beyond Purdue when you think about those the enrolling declining enrollment that you just pointed to What does that mean for future revenue streams? Are we gonna continue to see more consolidation among some of these smaller universities as a result? I think it's inevitable Both a smaller Private schools and in some cases we've already seen public universities especially regional campuses being consolidated Probably always would have made sense i think we may lose here and there are some you know fine institutions that'll be ashamed but in some cases that will have been self inflicted. Buy raising tuition year after year because they could And because people didn't have haven't had Reliable quality measure so that too many people in the past associated a higher price with higher quality now more and more folks have come to question that and hence the declining enrollments So many shifts happening on that front Mitch Daniels it's good to get your perspective today Purdue University president joining us there We're coming up looming wrists are giving investors a lot to be nervous about but could pain Mean more opportunities to invest we'll discuss after the short break. ,https://www.youtube.com/watch?v=pinYGgnrDs8,29,2022-09-06 15:43:11
541,"Inflation Energy crisis across the globe. Here to break it down. How investors should approach these uncertain times. We've got eternals. Us investment analysts, Cali Cox, Kelly, good to have you on today. You always got a good polls on Retail investor mind is right now what's Intimate that you're seeing as we see more chopping us on the market. Yeah or is he a lot of nervousness out there and it makes sense we're gonna have a busy fall and we have a lot of these unprecedented intentions really heating up right now and we've seen here that the S and P and the coin are both kind of in the danger zone right now Bitcoins hovering around 20 K slipping below it and the SMP's down below all it's major technicals When there's a lot of uncertainty out there. Those technicals are places where investors can pause. Unfortunately, there are more ceilings than floors at the moment. Pipeline It's output how do you think investors should be looking at this in terms of the impact they're likely to see in their portfolio? Yeah well if you're in the US of course we're reading headlines about what's going on in Europe and it's it's obviously unsettling but you have to remember that the world is now more connected than ever and the fact that Europe is going through this energy crisis includes struggle with you know such a tough obstacle this winter could keep the US Strong. ",https://www.youtube.com/watch?v=pinYGgnrDs8,30,2022-09-06 15:47:43
542,"Admitting that you can't predict the future but at the same time, you know, really staying guarded in case we see Marchestra from here. Of three straight weeks of decline certainly the economic print whether that's inflation or jobs that's gonna be the big driver as we look ahead to that fed meeting later this month is that gonna continue to be in the driver seat in ter What's going to be moving the market? Yeah well the devil always be in the driver's seat and especially these days it's it's it seems like the feds every word is being broken down Which is what I It does get a little more serious about inflation and the fact that demand hasn't dropped off a little bit. So Especially if you're focused on more speculative stocks. So just understand the environment you're invest Yeah brace for more volatility especially in what is typically our choppier month Calicox is always appreciate your time she's Analyst ",https://www.youtube.com/watch?v=pinYGgnrDs8,31,2022-09-06 15:52:00
543,,https://www.youtube.com/watch?v=pinYGgnrDs8,32,2022-09-06 15:56:15
544,"Back a little bit further we're gonna head in to 1987 territory and they quickly divolves from there all of this to say the strengthening US dollar and it strengthening for a couple of different reasons here first we have higher interest rates and Second we also serve as a haven a safe haven so when we see money flowing into the US dollar versus all these other currencies and here's the yen by comparison my concern is that when the BOJ the bank of Japan has to blink has to Course could be a huge disruption in the market that spills into over over into everything including equities here at Kiko Been talking about. And we haven't even talked about the euro at 99 to the dollar. Obviously the ECB meeting later this week. We'll see where things go from there. Let's talk about the markets here though. Bracing for the reputation for September. What can we expect? Well, I think when we begin September, it's always School time traders go back to their trading desk and let's go back to the WiFi interactive I do have a little bit of time to show some of the season alley stats but we don't have earning season until basically the third week of October so here's Kelly Cox who we just saw on her program but she tweeted this a little bit ago this is Some P five hundred's average return since 1950 by month so this goes January February a little bit negative but here's September down half a percent I think that speaks as to what we're seeing in the markets right now we don't really have a catalyst until we get the CPI numbers in a Weeks until we get that fed meeting in 3 weeks. So, until then, we're kind of in no man's land. We could go down a bit. We could go down a lot. We could rally a bit and I don't think it's gonna make much of a difference until we get some of those key numbers later. Yeah, ",https://www.youtube.com/watch?v=pinYGgnrDs8,33,2022-09-06 16:00:45
545,Back everyone let's take a look at how treasuries are headed off the back of this morning's jobs report current yields another data point in painting a bigger picture of where the economy Quantitative tightening here. Joining us now with more we've got Timmy and Hyman ProShares global investment strategists. Send me an always a pleasure to speak with you and and get some of how you are perceiving the markets and and what they're reacting to here. When we think On what August was here particularly you mentioned a note that there were some classic rising rate and inflation favorites like energy and financials does that persist going into September? I think it may very well and it's interesting that you said quantitative tightening just a second ago guess who didn't say quantitative tightening chair pal didn't mention it once last Friday which was interesting because We still had over five% euro over year waging increases that's a little bit of the stickiness of the wage price thing so you put ,https://www.youtube.com/watch?v=pinYGgnrDs8,34,2022-09-06 16:04:56
546,You can find the aristocrats of wide margins in the last two quarters if you can find pockets of pricing power that's gonna be very valuable and I think we may be a little sideways market wise until we see some of those Qthree earnings start to come in and that's we're still 6 or 8 weeks from the beginning of the season okay so even if the report Was neutral. Is it is it market neutralizing in terms of the move that we've been tracking since last Friday since the feds and fetch air drone pals 8 minutes speech at Jackson Hole which triggered this this most Since seller. I think it's gonna be more about quantitative tightening and I was so glad you said it because That's what has the greatest chance of moving the dial In a longer end end of the curve where the suppression of yields is being removed that's where the impetus for rising rates in the fives and the tens can come from in the near term so yes I think that employment report was kind of neutral with regards to the bond market but the doubling of the shrinking of the balance sheet that started Is far from a neutral a neutral impact Send me an hyman pro share it's global investment strategy just always good to see you have a great weekend. ,https://www.youtube.com/watch?v=pinYGgnrDs8,35,2022-09-06 16:09:25
547,"We'll be talking about vulnerable workers and vulnerable communities. Today's report is an ice report for us to be celebrating Labor Day. Yes, you share, we see songs strong increases. Slightly below expectations. Also suggesting there's a little there is a deceleration going on Which is very kind intuitive but it rose because people are still looking for jobs and being drawn into labor market. So, all in all, good report. Finally, also in terms of the wage print, wage growth, the year over number is very strong Compared to previous number estimates and then compared to pricing increases and goods You know we despite the headlines B we did see some weakness Prior 2 months where are you seeing some path to weakness in the labor market? Well that's great that you answer that cuz if in the household survey which my colleagues the institute we spend much of our time looking at and and in a blog post that's coming out today my Labor Day One does potentially cost any tail here is that for blacks, Latinos, for people with the high only high school degree. They're unemployment rates rose. ",https://www.youtube.com/watch?v=pinYGgnrDs8,36,2022-09-06 16:13:41
548,"We let you go one more question. Policy from the Fed what is that due to income inequality in this country? Well, I've I don't want to I feel like I'm dodging your question but I have to leave the the policy conversation to my bank president and and to to the broader committee but I will share is that you know that I have done some research with the former Fed economist named Seth Carpenter Where we did look at but all historically what happens when tightening occurs and and this is one reason why I'm very why we at the institute are so focused on vulnerable populations and that is when the economy does slow down these groups are more sensitive to to to increases the in Climate And as I said we have to work with all stakeholders all parties involved here to tamp down inflation but to also Make those critical investments in in in vulnerable people and vulnerable communities and if we can do that that'll grow productivity because we're keeping people in the labor market we're drawing people on like the market productivity is the is one of the two ingredients so the economic growth which is what we need to be focused on Thanks for having me. Of course, Bill Rogers vice president at the Institute for Economic Equity at the Federal Reserve Bank of St. Louis. Always good to see you. Have a great weekend. Request, thanks, you too. ",https://www.youtube.com/watch?v=pinYGgnrDs8,37,2022-09-06 16:18:07
549,"From three. Five to three. Seven% but what we wanna do what businesses in this country need and more people getting Into the workforce and hopefully that will continue that trend will continue as we move forward. I'll take a three. Seven% unemployment rate all day long if we get more people involved in the workforce. Mister secretary always nice to see you do you think this your job's report jobs and excess of 3000 of these more normal reports is We should expect in the month ahead Well, it's hard to say that I still think that there's some good reports in front of us and then, at some point, there's gonna be a leveling off and having a good report will be 50 1000 jobs. But I still think we're at the point where companies are still hiring in the big place. People are still looking to get back Force we have areas like hospitality and some parts of education that that I'm quite fully back from pre pandemic levels a lot of sectors are back but I still think there's a lot more room for growth and then on top of that this area is like cyber security and nursing and teaching that that are looking for more and more employees so I think we're gonna see some growth on those areas as well. Mister secretary Jennifer Sean Berger here. Thanks so much for joining us. The fellow reserve certainly gonna be paying attention to this report as it looks how to how much it's going to be raising interest rates at its next meeting later this month. Taking that in conjunction with upcoming inflation data. What do you think this report means for the outlook Almost eight, nine consecutive weeks right now. We see a little down to little downturn and inflation, a little, little, the numbers ",https://www.youtube.com/watch?v=pinYGgnrDs8,38,2022-09-06 16:22:30
550,"You're absolutely right we have to address this issue Mister secretary is someone that has worked their tail off for for many years Mayor of Boston now you're in the seat as at US as the US labor secretary what do you think about this generation's quiet quitting movement? You know I'm just learning about what the client quitting movement is and you know I haven't in my in my travels in the last couple of weeks you know Chicago Detroit San Antonio all over the place that that issue hasn't come up but certainly it's something that if if it raises to our level I will we'll have to address it Go over and talk to him and find out what the issue is, what the situation's at, and and have those conversations and I think that that's how in if I'm if I'm explaining it right, that's what I would do. Quit quitting was was presented to me about 2 weeks ago and what I thought it was I thought people quitting their job and then I found out it's not that it's people kinda stepping back a little bit in their job and certainly that's that can be dealt with on a between a management the company Sending you a check do you need to be dealt with? It shouldn't get to that point where you're firing somebody. You should, if you're an employer, if you're a manager, you should find catch on right early enough that your employees unsatisfied, aren't happy, and they need to be a dialogue, a conversation, and, and, and if your employee is just doing ",https://www.youtube.com/watch?v=pinYGgnrDs8,39,2022-09-06 16:26:43
551,"Business. What it does it? It's it's it's representing the respect and and the rights of workers. And I think that there's an opportunity. I think what's happening in the aligned industry. A lot to do with the pandemic. A lot to do at work. A shortages. A lot to do with with with what's been going on in this country for the last 2 years. I think that the pandemic through that industry through a loop and also through the hotel And and and retail industry to a loop and also through the training industry the only industry that seems to have come back from that completely without having any disruption is retail and I think that a lot of the business practices that these companies are having They need to look at their business practices and trying to figure out how do you get back on track and we need to get workers back into the workplace that's quite honestly the bottom line. The airlines, I mean, I think a lot of these flights are being cancelled or delayed. It's because in I've been on in plenty of airports waiting for the flight crew to come in From one plane to another plane. What we need to do is continue to invest in workforce development job training and more people trained up for these jobs moving forward. And then organizing a separate piece of that. Us labor secretary Marty Walsh thanks so much for taking the time and joining us here for this discussion this morning on the back of the jobs report that we have been continuing to watch the market side just appreciate the time once again and to our own gen sean burger who's joining us Well for the conversation we appreciate it. ",https://www.youtube.com/watch?v=pinYGgnrDs8,40,2022-09-06 16:31:02
552,"Those are big numbers and it really doesn't matter who you are. I mean, that that is the highest inventory growth we have seen. So, it's your question, how long will it take? It's not gonna be quick. If it's quick, it's probably a problem. What's the secret sauce here? How much longer can Lula I mean could continue to put up these numbers and ultimately they're they're pushed to double revenues by what 2025 or 2026. It's not like they're You told me about it. I got a whole closet folder stuff now. They don't You and I have done a lot of work historically over where brands peak and Lulu is crossed the threshold that most brands normally see their peak Now the question is the price point they are charging as much higher so there's this interesting dynamic where they can sell they can generate higher revenues on fewer unit But to your point they do need to find incremental units and so there's an interesting comment thrown out on the call yesterday where they're throwing eyed armaged Bell bag or whatever the newest version of your favorite accessory to wear to Disney World Brian is at the end of the day, they are bringing new customers to lower price point, right? So, the bell bag is a cheaper item that Lulu has. If you recall, if we go back, Michael Coors and bring out a lot of people into their fold. Using the watch. Which was a lower price entry point. So there's this interesting I think they're going to need to travel the Spence very carefully. Where it's great to bring a new customers with items that charge last But you always do run the wrist that the incremental customer becomes your deteriorating brand customer ",https://www.youtube.com/watch?v=pinYGgnrDs8,41,2022-09-06 16:35:24
553,,https://www.youtube.com/watch?v=pinYGgnrDs8,42,2022-09-06 16:39:35
