id,text,video_url,iteration,created_at
6092,"What about crypto play to earn is all the rage right now play to earn specifically is something I'm cautious about it creates a Force out of players for certain players to kinda monetize. Now, to be fair for us in the in the game industry, this is existed for years and years. There have been gold farmers of people who literally just spend their time doing some menial task in a game to a cruise some currency that they could sell to some other rich player and for real money We made some comments in Minecraft about how we view NFTs in the space cuz we saw people doing things that we thought were exploited in our product and we said we don't want that. I think sometimes it's it's hammer looking for a nail when these technologies come up. But the actual human use or player use in our case of these technologies. I think there could be some interesting things. So let's About your priorities looking forward you know if you're in the middle of trying to do this really big deal are we gonna see Keep doing deals are you still on the lookout for new studios or new geographic locations where you want to build out Microsoft gaming presents? Definitely on the second part geographic Expansion is critically important but we've hired our first people in Nigeria now as part of our team. We have teams in India, teams in South America. You know, when I talk about three 1 billion gamers, I'll just use Africa for a second. Like one. 2 billion people on the count and average age is what 20 or 21 ",https://www.youtube.com/watch?v=dp8PhLsUcFE,639,2022-09-05 16:58:05
6093,"What is the gaming industry look like in 5 years and what does it look In 20 years. We're gonna see video games really game their space Perspective on others lived experience and I think that's a pretty cool thing. Alright, thank you. Phil, for joining us. No one covers the world like Bloomberg. Hours a day. ",https://www.youtube.com/watch?v=dp8PhLsUcFE,640,2022-09-05 17:02:19
6094,"For Franklin my grandfather Just was a big fan. I think he's probably the most interesting of the founding fathers. Almost three quarters of a century later, his granddaughter succeeded her brother as CEO of the company now called Franklin Templeton. No, no, there was never, there was never any pressure to go into the business. I always aspired to be in the business. In 1957, the firms funds had $two. 5 million in assets under management. Now under Jenny Johnson that's climb to $one. 40 billion today we're a dominant global asset manager you know probably more coverage than anyone else just after Johnson took over in 2020 Franklin Templeton closed its biggest deal ever the $four. 5 billion takeover Over 30 countries with 1300 investment professionals it offers more than 200 investment strategies My father always said take care of the client the business takes care of itself right and so the reputation of the firm and the reputation of the family are very much intertwined Franklin Tembleton is a much different company than it was three generations ago. But then Ben Franklin did say when you're finished changing you're finished. Let's talk about this company's people may not be that familiar with it. This company was started in 1947 by your grandfather. Is that right? That's correct. Management business before. So, he had a brokerage business, Johnson and Associates and he set up a little subsidy called Franklin Funs and my father ",https://www.youtube.com/watch?v=dp8PhLsUcFE,641,2022-09-05 17:06:52
6095,"Some funds often outperform in a moment of market. Having said that, Asset manager, your job is, is to provide risk adjusted returns. So, you know, it got to the point where Hop Companies Russell 1000 large cap Represent 40% of And you know and and and had access returns at the time but the the average investor cares about downside protection too. It's a heavy concentration. Diversified portfolio but that meant you probably under perform but now when you've seen the market decline those top five decline 24% on average where is the rest decline about 17%. So, you know, again, as a manager, your job is Long-term investment performance. What suppose I say, alright, I wanna put some money in a franklin tablet and fund. What type of return should I expect on a stock fudge? Should I be getting six% a year, five%, eight%? What should I realistically expect after fees? Well if you look at I think it's the the S and P from it's S and P 500 from it's sort of beginning. I think the average return is about 10 and a half percent. The last Decade of this kind of very momentum market. It was closer to 15%. ",https://www.youtube.com/watch?v=dp8PhLsUcFE,642,2022-09-05 17:11:05
6096,Welcome to the world of decentralized finance Bloomberg's covering all things crypto. According to PWC there were at least 296 deals in 2021. That was 50% more than a 2020. And the motions 2001 of the big deals announced last year was Franklin Templeton's purchase a private equity fund manager Lexington partners for almost one Eight 1 billion dollars. The pace has been even faster. There were 109 announced deals 11% more than it at the same time in 2021. A couple of the big ones UBS bought robo advisor wealth front for $one. 4 billion Hawaiian sprunch game paid the same amount for private credit manager Carval And it could pay another 350 1 million dollars No momentum slow to the second quarter. ,https://www.youtube.com/watch?v=dp8PhLsUcFE,643,2022-09-05 17:15:44
6097,"You know the equity markets may go down some or they may maybe bottom. I don't know that any of us know that. We're we're entering into earning season right now. But again, I would just say to folks, just A good diversified portfolio that's appropriate for your risk level and stick with it and if if anything don't look at if you can't afford to be invested for a probably a couple of years maybe cash is a better move right now but if you could afford to be invested for a couple of years then then Set up a diversified portfolio and just don't look at it. Some people say that one of the best opportunities now is cryptocurrency. Crypto has had some problems. What do you tell people that say they wanna be encryptocurrency? Do you offer the opportunity for people to invest in crypto through Franklin Templeton? Yes, actually we do. So, first of all, That bitcoin is the greatest distraction from the greatest disruption that is happening in financial services today So, I wish because every time everybody gets in a conversation about crypto, it leads into a conversation about whether this currency, whether it's dodge coin, or bitcoin, is a value. Forget that. That's like a religion. You either believe I get a believer or non believer and they're never gonna agree. But blockchain is a technology and what it can do is going to be hugely disruptive. So not only is it gonna be disruptive on traditional back offices and just create much greater efficiency. But disruption on on business models and I'll give you a couple examples that ",https://www.youtube.com/watch?v=dp8PhLsUcFE,644,2022-09-05 17:19:56
6098,"Use a financial advisor because the financial advisor will deal with the emotional Difficulty of a market drop. Bloomberg Bloomberg So, let's talk about your own background. So, where did you grow up? Why was I born in New Jersey and and California in 1973 my Franklin bought a company out in California and so I moved out to California with the family and so you grew up in a pretty large family Lot of seven children in 10 years. Yeah, a lot of chaos. And Dinner table. They talk about money management all the time. ",https://www.youtube.com/watch?v=dp8PhLsUcFE,645,2022-09-05 17:24:05
6099,"We walk in with a In a responsibility to you know Help help a person who's who wants to retire and and be independent financially or if you have a special needs child and you worry about saving enough money to make sure that that child's taking care of after or you've you know you wanna save enough money to launch a business whatever it is These are people's dreams and like there's no better business to do this than ours. So, what do you think is the biggest mistake that investors make when they generally look at what they're doing? Your observation would be that the typical most common mistake investors make us what? They Cell, low, and buy high. The typical Esther. That's why I feel strongly that people should use a financial advisor because the financial advisor will deal with the emotional Difficulty of a market drop when you suddenly look at your retirement account it's down 25% and say don't worry we're in this for the long run Just stay in and so it's you know that's been one of the biggest challenges I think. And what's been the best investment advice anybody ever gave you? You know be diversified and and stay in the market. I think the biggest issue is is people hesitating and not getting in the market. So I assume you know you go to cocktail parties Every time you're running Franklin Templeton I assume people come up there and say Jenny can you give me some investment tips what should I do with my money does that happen a lot? ",https://www.youtube.com/watch?v=dp8PhLsUcFE,646,2022-09-05 17:28:32
6100,"So is there more pressure when you're trying to win a basketball championship Then when you're trying to please investors where's the greater pressure Oh I think I think it's definitely trying to win a championship. It's hard because a lot of like when you invest and you know this when you're investing You can control a lot more things You know, on a basketball court, you can't control whether somebody's gonna make a shot, you've gotta get lucky, and what's the greater pleasure making five times your money on a distressed debt investment or winning the NBA championship? They're both fabulous I I wish I could do one each year that would be great but I I think it was a great feeling in being right on an investment that You've done a tremendous amount of work and you've made money for your clients which I think is great. I think winning a championship It's a very surreal feeling because there's a whole city or state that is actually behind you You know, we had 70 1000 people at the finals and we had them all outside. It's 17 1000 in stands. And then literally like 60 1000 people outside And when we won like just the joy that you had brought to the city was phenomenal. Markets are preparing to close but the day is not over yet. ",https://www.youtube.com/watch?v=dp8PhLsUcFE,647,2022-09-05 17:32:53
6101,"Now John serves as chairman of planner Perkins which operates 32 funds with more than 675 investments but John's focus has moved beyond the internet revolution to Climate revolution I Went around, checked up a lot of controversy declaring that the internet had been under hyped. I say the same thing today about the climate revolution. You're one of the most famous venture capitalist in the world in part because you had a lot of deals that were spectacular. Two of the most spectacular were Google and Amazon. So when you saw the guys who created Google and you saw Jeff Bezos do you say these are gonna create these guys are gonna create world class companies or do you say maybe they'll get my money back what did you think in the first time you met them? So, I met Jeff when he was 30 years old and he and I were both computer science. Kinds of geeks in Amazon had a business plan. It was growing to be the world's best book seller online. And so I invested I think it was Eight 1 million dollars for 15% of Amazon and Jeff and I set out to build an amazing world class team and he had a vision which True to this day that if he had the broadest selection With the most affordable prices in the best customer experience that flywheel he could get to grow by obsessing on the customer and yes i believed he was successful No I had no idea that it would be worth $one. 20 billion today But the same thing happened Years later when I met 221 year old Stanford University PHD dropouts Larry Page and Sergey Brent And in that case I invested Hmm. ",https://www.youtube.com/watch?v=dp8PhLsUcFE,648,2022-09-05 17:37:16
6102,"A real business. So, you join a Perkins. It was then a relatively smaller firm than it is today, I soon. Sure, there were four partners. Eugene Kleiner, Tom Perkins. Frank Caulfield and Brooke Myers And it manage the modest amount of money then perhaps it's 100 1 million dollars So did you ever think that the world adventure capital would become the explosive world of technology that's now become at that time? No, I didn't but I didn't think much about that because what I really wanted was for Cliner Perkins To commit to back me when I found a company that I would start with friends and they made that commitment because they've done that several times before. The business plan for Jeanette was written inside Kliner's office. The business plan for hybrid tech Wanna call my antibodies inside cleaner's office. So, Eugene and Tom were a typical venture capitalist. They were really Engineers and operators and successful entrepreneurs. In the venture world, you're committing relatively small songs compared to the buyout where I prefer per deal. But do you have to get all of your partners to agree or can you just say I'm gonna do this and hope you'll support me. So You don't have to have everyone agree and indeed some of our best investments were very controversial. Google was controversial Within the partnership and within the industry. It was 100 1 million dollars valuation on a company with no revenues and no business plan and founders with no business experience. And it turned out to be ",https://www.youtube.com/watch?v=dp8PhLsUcFE,649,2022-09-05 17:41:29
6103,"I met with John Door on the Stanford campus The movies was the seed for what became a school on sustainability. Inconvenient truth but when it came to my 15 year old daughter Mary Straight at me and she said dad I'm scared and I'm angry. Generation created this problem. You better fix it. In the room went south John Door didn't stay silent for long he investigated green energy all over the world. More importantly, he and his wife gave Stamford a $one. 1 billion gift and persuaded others to donate almost 600 1 million more. The result, the door school of sustainability. Sanford's such a great in Remember their plan to address climate was so thoughtful and ambitious I I and my family felt compelled to back it. Stanford's first new school in 70 years open this fall. It's three part structure includes academic departments Introduce disciplinary institutes and a sustainability accelerator We are in fact in many ways kind of reimagining academia and the accelerated is all about solutions of problems that are going on. These are technology That can be scalable. ",https://www.youtube.com/watch?v=dp8PhLsUcFE,650,2022-09-05 17:45:55
6104,"There are still going to be some remaining carbon emissions that we have to remove. Either through trees, natural means, or direct air capture, which is what they call mechanical trees. All told the speed and scale plan takes us from oh to 59 gigaton times. 2050 Halfway there by 2030 we have just seven and a half years to get this done in time and so the plan includes four accelerance ways to make sure that we get it done fast those are winning the politics and policy Turning movements into more than protests making them real actions Innovating doing more research on the new So we'll lower the cost for what we have now in innovate for the new. The now and the new and then finally invest to invest like crazy to get this transition successful. So let's suppose I live in India or on China. I'm a citizen of those countries. I say, well, you and the United States, you polluted the world for a long time. We're still a developing countries We want the right to develop our economies and we shouldn't be having the same standards that you have. What do you say to that argument? I'd say they're right. And I also say that this is a problem that we all have and we all have to solve together. The Indians right now em Far less carbon per citizen than we do Historically the US since the world's largest a midterm. Of carbon pollution currently China is the largest but we're the wealthiest country in the world and so we've got to go first we've got to prove that this can be done without ruining the economy it takes only about two% of GDP to make the necessary investments and then we're gonna have to With China and Europe help the developing world fund this transition ",https://www.youtube.com/watch?v=dp8PhLsUcFE,651,2022-09-05 17:50:20
6105,It's imperative that we do this Is is Larry thinks sad There will be a 1000 Private unicorns. Companies worth of one 1 billion dollars working in climate. I think what we're seeing here at Stamford is that climate science is gonna become the new computer science. So where all the young people wanna work for all the right reasons. My partners and I Decided not to back eve on musk. That's probably the worst investment decision of all time. Hey Facebook Welcome to Dead Australia Hey ,https://www.youtube.com/watch?v=dp8PhLsUcFE,652,2022-09-05 17:54:31
6106,"We were starting Cisco. So, that was an a miss on my part. More recently I had the opportunity to invest in an electric vehicle company In the conventional wisdom was adventure capitalist but not to invest in electric any vehicle companies not new car companies at all there been 400 new car companies in the nation's history Everyone of them but one has gone bankrupt But I would still very attractive to the market We had the choice of Backing a brilliant card designer by the name of Henrik Fisker Or ambitious slightly crazy entrepreneur by the name of Musk Rob removed the wrong decision But Tesla did very very well and so did electric vehicles. When I make a mistake, I only think about it for the next 10 or 20 years. How long is it? Take for you to get over these things. Well, I don't obsess on these but I won't ever forget And today when you If you read a back somebody do you a monitor them carefully do you help them you open doors for them what do you actually do other than give them money it depends what What what what What will help the most? Usually, it's recruiting and growing the team We're in a worldwide rake race to get the most talented people to believe in and pursue the vision. I'd like to see David ideas are easy execution is everything ",https://www.youtube.com/watch?v=dp8PhLsUcFE,653,2022-09-05 17:58:57
6107,Something as universally important to human life Sleep. Mystery surrounding its necessity and utility have only just been recently uncovered. Some of our biggest discoveries were in the 1970's or 1980's. And so it makes it a really exciting field. Because it seems as though we're uncovering new insights. Each and every day. Some scientists are going further to find out how sleep and what happened there can be harness to further expand our It's easy to memorize things that makes you smart if you can spit it back a lot of facts but if you wanna be wise if you really want wisdom you gotta know when and how and why to use that information And that's what you bring figures out while you're sleeping. Over the past few weeks has made it clear. It wants to go higher. It got a little spook by the idea that due to political potentials are rising. Watch Bloomberg surveillance early edition for the news you need when you need it. Twice as much as Can it sustain it's normal at a time when everybody else is facing a very different reality. ,https://www.youtube.com/watch?v=dp8PhLsUcFE,654,2022-09-05 18:03:16
6108,When you look at Holland or the Netherlands then the name the Netherlands already says that we are a low line country One for this country is below Through it. It's funeral to flooding. Back in the day the only things keeping the water at bay were the dikes which are basically just raised amounts of earth. Once every few decades the water would overwhelm the dikes and cause catastrophic flooding. And that was just the way things were. Until 1 day in 1953 all that suddenly changed. 53 it was disorder I was 5 years old and I live on the farm There was no radio So people didn't know Very hard A powerful storm struck the southern coast Overwhelming dates that have been badly damaged in the second world war. On the morning of February 1 1953 Kosa's father and brother woke him up and told him what it happened They say Oh And Mother in Child. Papers. ,https://www.youtube.com/watch?v=dp8PhLsUcFE,655,2022-09-05 18:07:31
6109,But in this way we are also adding a water storage This is the first water square that we have been developing but it's part of a bigger package of measures. An interesting one close by here is what we call the duck park or the the rooftop park Which is a kind of a long levy of one km and on top of it a huge rain park. It's storing excessive rain water because of the green roof. Looking at the challenges A lot of people think it's going to cost us a lot of space and money. And we try to show that you can use it to work on a better city. In some ways the Dutch are just as baffled as the rest of us about climate change. For one thing there's a question of what happens when sea levels rise beyond a certain point The Maslin barrier was built to withstand one m of sea level rise. And a redesigned barrier could potentially handle even more than that. But there's only so much that even Dutch engineering can do Beyond two m it's difficult That what you are working on news scenarios supposed will be more than two m for me to five m then what people ask me will you be moving on a certain Moment and time to to the higher grounds in the Netherlands I I I can't imagine that that will be a decision ,https://www.youtube.com/watch?v=dp8PhLsUcFE,656,2022-09-05 18:11:49
6110,"The financial world on demand. Hear from leading economists Policy makers. And industry experts via live and on demand webinars. Only from Bloomberg. Start exploring to see what's moving the markets. Visit Bloomberg. Com webinars Hey Important. I think we've moved from this attitude from it's an indulgence, a waste of time, almost an illness that needs a cure. For something as universally important to human life Mystery surrounding its necessity and utility have only just been recently uncovered Some of our biggest discoveries were in the 1970's or 1980's and so it makes it a really exciting feel because it seems as though we're uncovering new insights each and every day. Some scientists are going further to find out how sleep and what happened there can be harnessed to further expand our understanding ",https://www.youtube.com/watch?v=dp8PhLsUcFE,657,2022-09-05 18:16:15
6111,I don't know if she's joining me doing Add to our economy and his colleagues designed a steel trust tower so instead of fighting against the wind it can simply pass through the gaps between the trusses You don't I know. To stabilize the tower the team used a traditional Japanese design called Shimbashira that dates back over a 1000 years This is the flexible central pillar of a Japanese pagoda which stabilizes the tiered wooden structure during an earthquake or typhoon in a similar way to a tree trunk supporting its branches A Shimbashire has been found at the center of the world's oldest wooden structure made from a tree filled in 594 AD. For Sky Tree the team designed a 375 m talk concrete core column connected to the towers still out of frame by series of flexible oil dampers devices that control and want a vibrations The swing of the call column and outer frame and opposite directions reduce the vibration of the entire tower by up to 50% during an earthquake and 30% during strong winds Ambassador We know Hey ,https://www.youtube.com/watch?v=dp8PhLsUcFE,658,2022-09-05 18:20:37
6112,My faster and cheaper software powered by artificial intelligence. After a decade of research architectural engineering company Techinaka has developed a typhoon simulation software called Kasamadori Is there not a At the moment no honey Hey Hey For three km square urban area it usually takes 3 months to build a model conduct a wind tunnel test and get the results Software the entire process can happen in just 2 or 3 days and it's engineers are trying to reduce that down to half a day. It sounds like a lot Yes Hey Hey Hey You know what? ,https://www.youtube.com/watch?v=dp8PhLsUcFE,659,2022-09-05 18:24:48
6113,Consumes less energy and releases less carbon dioxide New trees can also be planted to absorb a missions. But building tour structures with wood offers up its own engineering and financial challenges That didn't stop Japanese construction company Mayada from trying though. Hey And talk to this they need Maya is going to construct a 13 story wood and steel hybrid office building in Tokyo Shabuya district To make the building earthquake proof designers came up with a hybrid lattice structure that will support the walls and create a more user-friendly experience. The ta da. ,https://www.youtube.com/watch?v=dp8PhLsUcFE,660,2022-09-05 18:29:12
6114,The software is come in to automate the process. Made for robots not for humans. The only job your resume has is to be comprehensible to the software that is reading it because that software or robot is gonna decide whether or not a human ever gets their eyes on it. That might not be totally inclusive or not be Concerns about how this technology could exacerbate discrimination Really FTC I think for most the FTC needs to be making sure that we're fully understanding this technology. We don't trust companies to self regulate when it comes to pollution. We don't trust them to self regulate what it comes to workplace comp. Why on earth would we trust them to self regulate AI? ,https://www.youtube.com/watch?v=dp8PhLsUcFE,661,2022-09-05 18:35:05
