id,text,video_url,iteration,created_at
6012,"For the winter Europe will be invade difficult position where they may have to consider some kind of energy rationing even rolling power cuts a lot will depend on just how cold it gets We're expecting this or a lot of people were expecting this. So, have we, you know, have ministers. I mean, I don't think it's the ministers of Southeast Ministers of Europe but can we buy things from other country? I don't know whether it's African, how much we have to pay for it. We can buy a limited amount of other countries. USA is the one that's really stepped in to ship record amounts of LNG Possibly Atlantic but there were capacity constraints. There's only so much energy that the US can ship because there are any saying the export terminals in America and there's only so much LNG that Europe can import because it it has the terminals but not in all the right places. Germany, for example, will not get any LNG Port capacity until later this winter when it puts a temporary facility in so it's it's difficult and it's especially difficult for Germany. So well do we have a European plan on how to deal with this? Not yet. But it's humming. There are plans. Obviously there's been a plan to reduce consumption for some time but I think we're gonna Phoenix celebration those plans energy ministers meet on Friday and there are clearly quite radical proposals on the table A to reduce demand to make this winter more manageable but second to alleviate the Pressure on consumers and businesses inside Europe. About capping the price of power even capping the price of gas now that's not easy but I think what we can take away is that politicians are ready for more radical interventions in markets and maybe even suspending markets ",https://www.youtube.com/watch?v=dp8PhLsUcFE,559,2022-09-05 11:09:43
6013,"Prioritizing business has been probably Been taken too far in recent in recent years I think essentially we've had this zumba vacation of large large suedes of the business community again across the western world particularly in America but elsewhere as well and governments constantly having to prop up these companies is not good in for the medium to long term health of the economy it's pushes down productivity it So again I personally would advocate being careful about exactly what support is provided to businesses but that obviously is gonna be a very political political question political answer. James the team at Morganston they actually says that they see more pain in store for European profit margins now this is what they wrote in their note this morning with corporate pricing power starting to fade the margin outlook is likely to get much more difficult next year Global financial crisis what does that mean for corporates Well, big picture. There's potentially a healthy rebalancing again. The other side of the this kind of concentration of wealth amongst the one%, the 10%, the 25%. Is there something similar has happened in corporate space? Essentially, we've seen an oligopalization and a financialization of the corporate world and that hasn't really been good for the long term health of the economy. Margin There's been far too much super profitability and that has therefore sort of dragged down economic growth essentially it's led to a high savings rate and that's a problem and and ",https://www.youtube.com/watch?v=dp8PhLsUcFE,560,2022-09-05 11:14:03
6014,Would be utterly catastrophic for the global financial Particularly the situation in Europe and the UK is so utterly pernicious it's so no win that I really think the dollar is gonna be king for a good few months just yet when it does turn I think It turns pretty quickly. We'll be sticking around. We also talk about the UK that's coming up next. Let's trust. We'll bring you the announcement live in about 15 minutes Now we think and this is after a pretty bruising tory race this is Bloomberg. ,https://www.youtube.com/watch?v=dp8PhLsUcFE,561,2022-09-05 11:18:21
6015,"Markets are preparing to close but the day is not over yet. 45%. Upgraded today to overweight. You need top angles to bring you exclusive global inside into cross asset markets. Bitcoin ain't buying along today it's gonna be short term The clothes weekdays on Bloomberg. Tune in to the lineup for some NFL NBA and MLB. Did you retire too early? I mean, look at somebody's payout. I absolutely retired early. For the inside scoop on sports betting, catch the lineup right here on Bloomberg. Today, the UK conservative party decides who will succeed Boris Johnson as prime minister. Hey Facebook Bloomberg markets everyone. 12 minutes from now to face off between the foreign secretary's trust and the former chancellor of the extracter. Now, for more, we're joined by Lizzy Birden who's outside number 10 Danning St, Lizzy, I mean, you must be surrounded by thousands and thousands of reporters As we wait to hear the big news is it going to be Liz Truss? That was the expectation. I must say there are journalists from all around the world on two levels here. It really is. Even bigger than the event when Bo ",https://www.youtube.com/watch?v=dp8PhLsUcFE,562,2022-09-05 11:22:38
6016,"Saves the nation from higher energy costs I'm sure it's a general rule and you prime minister's calls for celebration but if the answer is going to the part but that's a pretty much a British Institution so I'm sure we'll we'll use that as a as a as a worthy excuse to go to an excuse What are you expecting? I mean, you know, we talk about the bank of England, independence, the fact that loose trust has said, you know, we need to review what they're in charge of and what they do with inflation. There's a number of things even like tax cuts. How much are we going to see of loose trust in campaign mode if she gets an Yeah I mean there's over the truth is somewhere in the middle of all of this I I do share concerns about how the bank have been given to handle this situation the extent to which they've contributed by keeping policy to stimulatory for too long and from the utter in transcendence really of of the Bank of England's inflation is risen. We all understand the notion of a Marginally below target and place an expectations can lead to these things becoming self-fulfilling regardless of the cause so I'm a big believer in good hearts I'm not a big fan of targets I think inflation targeting has been a terrible idea and it's been executed terribly I'd like to see a much more holistic mandate rules central banks including the Bank of England doesn't look like that's what we're gonna get if we have a normal GDP target I think that can still lead to a sort of inappropriate policy making along the way but the idea of unfund Tax cuts across the piece at the moment really does feel like or in fuel on an already raging fire. James is a weaker pound necessarily all bad news or does it help with exports? ",https://www.youtube.com/watch?v=dp8PhLsUcFE,563,2022-09-05 11:27:05
6017,There's some good value and certainly emerging market locals currency bonds and I do think there is been a medium to long term value in the long end of the treasury market but it is a difficult environment when all assets are falling together And you're picking a good football team so there's always that to cheer. Exactly. Literally 4 minutes away from the announcement of the UK's next prime minister will have that announcement And all the market reaction that goes with it. This is bluebrick. ,https://www.youtube.com/watch?v=dp8PhLsUcFE,564,2022-09-05 11:31:17
6018,Welcome to Bloomberg Markets everyone in Froncing Lockway here in London we're moments away from finding out who the new UK prime minister is so let's Straight to number 10 Downing St or Lizzy Burden is on standby Lizzy who will it be? Well it's widely expected to be Liz trust the polls have said so for a long time now why well Richie Sunac is seen to have been partly responsible largely responsible for Boris Johnson is downfall of course his resignation along with the Secretary Sadu Javez triggered that weave of resignations from government that brought down Boris Johnson and so in the eyes of many in the party membership Remains popular soon acts been portrayed as a traitor but secondly his economic message was much bleaker in his in his perspective more realistic than Liz trustes whereas she's continued the optimism of Johnson. She says that her tax cuts will boost growth. Lizzy we're just getting a bit of movement actually so let's go straight to the QE centre where we have a reporter on the ground to listen and this is Andrew Stevenson To deliver this contest which has shown the Conservative Party to be in good voice and good strength. We've held 12 regional hostings the length and breath of the United Kingdom ,https://www.youtube.com/watch?v=dp8PhLsUcFE,565,2022-09-05 11:35:39
6019,"And now through the war in Ukraine was never going to be easy but time and again he rose to the challenge and delivered for our country It is now essential that we come together as a party and unite behind our new leader and our new prime minister to continue Prime minister will build on the outgoing prime minister's legacy and continue to deliver prosperity, And security for everyone So we've no further do will you please warmly welcome our two fantastic candidates wish you soonak and liz trust And ladies and gentlemen to announce the result of our leadership election please welcome our returning officer Sagram Brad Thank you, Andrew. Good afternoon. On the seventh of July The prime minister announced his resignation as leader of our party. ",https://www.youtube.com/watch?v=dp8PhLsUcFE,566,2022-09-05 11:40:26
6020,"326. Therefore, i give notice that Liz Trust is elected as the leader of the Conservative Union as party. Hey Facebook take the video Well thank you Sagram It's an honor to be elected as leader of the conservative and unionist party I'd like to thank the 1922 committee the party chairman and the conservative party for organizing one of the longest job interviews in history thank you very I'd also like to thank my family, my friends, my political colleagues, and all of those who helped on this campaign. I'm incredibly grateful for all of your support. I'd like to pay tribute to my fellow candidates particularly Richie Sunak it's been a hard four campaign We have shown the depths and breaths of talent in our conservative party. ",https://www.youtube.com/watch?v=dp8PhLsUcFE,567,2022-09-05 11:44:19
6021,"And I will deliver But we all And I will make sure that we use all the fantastic talents of the conservative party Members of parliament Counselors Councilors and activists and members right across Country Because my friends, I know that we will deliver, we will deliver, or we will deliver. We will deliver a great victory for the conservative party in 2024 thank you ",https://www.youtube.com/watch?v=dp8PhLsUcFE,568,2022-09-05 11:48:45
6022,"Of the parliamentary party she doesn't necessarily have the full banking backing of the Tory faith will let alone the broader community because as she's knowing there's no election really due for 2 years and so she will be governing in effect without a public mandate for up to 2 years until election Next section comes so she's coming in perhaps without broad support from any of those areas and that's gonna prove challenging. Ross let's also bring Nina Squiro CBR chief executive into the conversation. You know, we just heard that very short Scotland tomorrow what will be her her first task energy How will she fund any support she gives to households We've heard a lot of sort of the rhetoric of the types of gold she's going to aim to pursue and you're absolutely right that the cost of living crisis starting with energy bills is going to be her first Substantial task. We haven't had a lot of detail on exactly what she's going to do or how she's going to fund. There are stories out now that she is now considering a bill free as which is going a lot further than what we were hearing from her during the campaign. In terms of how that's going to be funded. So, a further tax Energy companies is one option but she hasn't been super supportive of that so far. She just said she's gonna continue cutting taxes, right? And yeah, Speech the only like 5 minutes speech we got and and she's she says she's gonna deliver what she promised So another another option would be that these sort of bill freezes are actually gonna be a postponement of bill payments which would mean that there is sort of going to need to be a temporary gap in funding but it actually households themselves over the next years if not a decade are going to be paying back these ",https://www.youtube.com/watch?v=dp8PhLsUcFE,569,2022-09-05 11:53:12
6023,,https://www.youtube.com/watch?v=dp8PhLsUcFE,570,2022-09-05 11:56:51
6024,Of all of the market reaction to the new prime minister of the UK Liz Trust also talk a little bit about pageantry tomorrow we know Prime minister of the UK tomorrow afternoon this is Bloomberg. Apples delaying it's next major iPad softer update iPad OS 16 by about a month from September to October. Apple made the decision for a number of reasons including a still buggy stage manager multitasking interface and in order to link the launch closer to the more similar MacOS Ventura. ,https://www.youtube.com/watch?v=dp8PhLsUcFE,571,2022-09-05 12:01:45
6025,"Well I'm not a gay Johnson Riley Steel but I am from Bloomberg Markets now we have a new prime minister here in the UK let's trust announced as an ex leader The former chancellor of the executive Of party voting. Well, trust will inherit an economic storm facing Britain that includes an energy crisis in Europe, a region racing to stay off a catastrophe this winter that energy crisis rightling the nerves of European traders, stocks dropping for the six times 7 days, the euros sinking to a 20 year low. So, this is what we heard in the 30 minutes or so we had a very short speech by this trust she promised to deal with the energy crisis very thin on details we don't know who will be in charge of energy we don't know who will be in charge of of course the treasury what we do know that she will also she says continue to cut taxes now European stocks actually slumping if we look at Markets and I think we have a great market board for you, European, Worsening energy crisis is adding more and more risk to a global economy already facing high inflation and a wave of monetary tightening. Now, for more on the UK and the results, we have a new UK prime minister. Is our Lizzy Burden who joins us now from number 10. So, Lucy, she doesn't get To meet with the queen. ",https://www.youtube.com/watch?v=dp8PhLsUcFE,572,2022-09-05 12:06:15
6026,"This is a terrible moment for the UK economy Absolutely. I mean, I think that's gonna be the perhaps the most challenging environment that incoming princess had for for many many decades. There's angie crisis brought inflation problems, growth problems, geopolitical issues, so I think the the level of difficulties is incredibly For whoever would have won this. A call to think that she needs to deal with is of course the energy crisis. What's the right way to do this? So I know there are a lot of people Hey Facebook there's a price cap or you need to get to support some of those you know households that are struggling the most and then you speak to market participants and you say but Need to demand destruction. And I think it meant you need to do a bit of both and what that means is that you need to have some kind of price cap especially for the households and most vulnerable to raising angry cost but at the same time you shouldn't add net new demand to the economy so you need to tax you need to take away demand from somewhere else and that's something this process has ruled out so in some ways she's made her life even Difficult by ruling out lots of different possible policy tools that she could use to deal with this. Fundraising. I've actually she didn't won by the huge, you know, gap that we thought she would. Does that change the way that she speaks to the UK citizens? Does it change her policies? And will she ever call for an election? That's a great question. I mean, she didn't Segment of popular support will be how she in home was delivers on her promises I think the other challenge she'll have is just like any other mid you know ",https://www.youtube.com/watch?v=dp8PhLsUcFE,573,2022-09-05 12:10:33
6027,"Could because if you look her track record she's done massive U turns. Right. Over the years she was pro romaine. They should look to Brexit. She was Lib Dems before then converted to Tories. So that tells you she does have the ability to change when the circumstances change. The the question is whether she'll have enough time. Right. To be able All of that. So I think the it's it's I think it's gonna be very difficult for her to do that. Any part of the guild market that looks attractive. Right now, nothing. Pizza. He will continue to weaken and the risk is that we we overshoot to historically low levels I think we're an environment of general dollars rent and so that's gonna be very vulnerable for the UK how long do you think that will continue for I mean if it's dollar strength this helps with commodities the footsy 100 I mean are are we I might clutching Yeah I'm not saying anything right now. To start to do the value trade. So I would hold off for three 4 months before one interest into those trades and and be much more defensive in in that kind of context. And Europe in general with the CK your zone is being hit by every single You can imagine. So, you probably wanna stay away from the region until things stabilize and you know, instead look at other parts of the world which which I'm also stability. Well I think US probably looks more attractive on a relative basis compared to your place like Japan look probably more attract Relative to Europe as well so there's relative you know you could play countries against each other so that's some opportunities there do you play on currencies the currencies are so volatile My bike would be generally to be long dollars I think the dollar will still continue to do well in this environment because the US doesn't have the same energy problems as the countries the fed's gonna raise rates probably more than other So that's positive for the dollar. But at some point it's strong dollar or a king dollar is also going to give you a problem for the US. It will be but the issue for the US in an environment where there's a shortage of commodities, a strong dollar helps the US and to some extent, the US, you know, has enough domestic demand ",https://www.youtube.com/watch?v=dp8PhLsUcFE,574,2022-09-05 12:14:52
6028,"Artificial inflating the company's Well, coming up, we'll have plenty more of course on the markets. We'll also look at a pound as this trust is UK Prime Minister. These floating flowers are made of 92 1000 solar panels. ",https://www.youtube.com/watch?v=dp8PhLsUcFE,575,2022-09-05 12:19:04
6029,Bloomberg brings you crucial data at terminal speed 315 1000 jobs created an optimistic number for Maybe leading a store to Atlanta. Here's the first word I made. Has won the better race to succeed Boris Johnson as UK prime minister the foreign secretary emerge Victoria's today after 2 months conservative Leadership contest that started with 11 candidates and concluded with a runoff against former chancellor of the exchecker Rishi Sunat A short speech after the results were announced. To show that we will deliver The next 2 years. I will deliver a bowl plan to cut taxes and grow our economy. I will deliver on the energy crisis Trust won't take power until Tuesday when she visits Queen Elizabeth the second in her Scottish castle to be formally appointed she will become Britain's third female prime minister ,https://www.youtube.com/watch?v=dp8PhLsUcFE,576,2022-09-05 12:23:24
6030,"On the fifth of December a European Union Ban on Seaborn imports of Russian crude comes into effect that could take Between one. Two to one. 4 million barrels a day of supply off the market and less Russia can divert even more of its crude to India and elsewhere Of course Russia is a key member of the Opec Plus group so that makes for a very difficult dynamic because Russia I don't think he's going to want the rest of the group to increase production if they're able to to take its market share so I think that leaves Opec Seen a very difficult position In in terms of actually balancing the market come December. So I know there there's you know they've been trying to actually basically just put electricity or energy to one side in the summer months but now with this you know Nordstream not coming back online I mean it could be like a real winter of dis Horrible. Europe has been putting energy to the side over the summer. Actually, most of you are preparing. Well, yes, most most year, sorry, putting aside, yes, yeah, no, I'm in Europe has been On the one hand build up it's it's reserves of natural gas in those countries that have big reserve big storage capacity for UK doesn't and they've been working very hard to reduce consumption both of of gas and electricity and those two things I think are ",https://www.youtube.com/watch?v=dp8PhLsUcFE,577,2022-09-05 12:27:51
6031,People talking about that all day yesterday. Bloomberg brings you crucial data at Terminal Speed. Federal reserve. Britain Alice. Maybe leading a store to Atlanta. Basis. ,https://www.youtube.com/watch?v=dp8PhLsUcFE,578,2022-09-05 12:32:01
6032,Not willing by the majority that we thought she would. She talked quite Boris Johnson. I don't know whether his policies change how we should look at sterling. What happens Can't we now? A lot of questions right there is the big question. I mean the next key questions of course is gonna be who will be chancellor in place of managing the economy through this cost of living crisis of That fiscal piece really very very extremely important for investors here whether you're sterling trader or whether you're an equities investor you know that really will just set From markets. I think especially heading into the winter time. And then the other question of course is also what is to become of the Bank of England inflation mandate? I know that trust is referred to that Potentially something that she could look at once she is in place for house maybe climbing down a little bit from that position but again still a lot of questions over Key things but I think these two things in particular would be a very much interest to market Is there anything that would be sterling supportive I think you know if we do see a situation where news becomes bad enough that it becomes good news and in a way that could probably play out one way that it could play out would be if we see the economy really showing signs of distress that trusts the government will To deploy some kind of support some kind of assistance for consumers and you can households heading into the winter time and we were already seeing that with Germany for instance and that could be a similar silver Heading towards a similar direction Christy did you see any quirks in the markets after the announcement Or sterling is there anything on on the the kind of lesser ,https://www.youtube.com/watch?v=dp8PhLsUcFE,579,2022-09-05 12:36:28
6033,"For royal watchers she goes to The queen tomorrow how will this trust the campaigner be different from this trust the prime minister? Well, that's a good question. I mean, she's obviously got a very large inbox. Stuff. She's got a deal. Personally, I'm particularly worried about about the the county rings that we've seen in the past. You can get economy. Is the energy crisis which is which is huge issue And the challenges I think Deficit That's probably what she faces. Yeah she also won the Tory leadership but actually in a closer than expected race Change her policies. Get 50 From that perspective I think yeah I think I I think she'll chill she'll go for girlfriend time now it'll be an implemental response that she talked about ",https://www.youtube.com/watch?v=dp8PhLsUcFE,580,2022-09-05 12:40:43
6034,"Well, this is on him expecting European currencies to remain lower for longer. Now, he writes the following Friday's announcement that gas flows through the North St gas pipeline would be stopped for the foreseeable future due to an oil leakage have added further downward As if anyone needed to the Euro and the rest of the European currency is what happens to Euro from here. Well you know I think the euro there's gonna be an argument there's a bit of a bad side cuz it's so big enough but you know the the trend I think is lower it's it seems to me it's not often currencies get long term momentum but it seems to me that's one of those types if you think about Europe it's it's very difficult to see his way through Backdrop And recession Euro Slow. Is there anything out there that actually points to good news? I I know your shop is called Longview. It was extremely difficult to see what will adopt with The long running of this but is there anything that we should look to for silver lining ",https://www.youtube.com/watch?v=dp8PhLsUcFE,581,2022-09-05 12:45:07
